n,cig,strutturaProponente:codiceFiscaleProp,strutturaProponente:denominazione,importoAggiudicazione,importoSommeLiquidate,oggetto,sceltaContraente,tempiCompletamento:dataInizio,tempiCompletamento:dataUltimazione,lottoID
207,6490064A3B,00514490010,Città di Torino,867427.00,861198.00,INTERVENTI SU PAVIMENT.VIE STRADE E PIAZZE DELLA CITTA'. BILANCIO 2015. LOTTI NORD E SUD. RIDETERM.QUADRO ECONOMICO PER PRESA D'ATTO AGGIUDIC....,01-PROCEDURA APERTA,2017-02-14,2017-12-10,idm4188
208,59478744E5,00514490010,Città di Torino,216422.00,207856.00,I.S. PAVIMENTAZIONI VIE STRADE PIAZZE CITTA' - BILANCIO 2014 - COD.OP.3999/2014 - ULTERIORI OPERE ART.57C LETT.A) D.LGS.163/06 IN ESEC. DELIB. 2016-...,04-PROCEDURA NEGOZIATA SENZA PREVIA PUBBLICAZIONE,2015-11-02,2017-03-27,idm4208
209,6299707AAA,00514490010,Città di Torino,40577.00,37512.00,"ULTERIORE SPESA PER LAVORI URGENTI ORDINARIA MANUTENZIONE SUOLO - AFFIDAMENTO ALLE DITTE AGGIUDICATARIE - CIRC. N.1-2-6-8 PER EURO 83.695,00= IVA COMP...",01-PROCEDURA APERTA,2016-01-16,2017-01-31,idm4228
210,6299767C2D,00514490010,Città di Torino,28262.00,26593.00,"ULTERIORE SPESA PER LAVORI URGENTI ORDINARIA MANUTENZIONE SUOLO - AFFIDAMENTO ALLE DITTE AGGIUDICATARIE - CIRC. N.1-2-6-8 PER EURO 83.695,00= IVA COMP...",01-PROCEDURA APERTA,2016-02-08,2017-03-10,idm4248
211,55246426CC,00514490010,Città di Torino,163200.00,160664.00,ORGANIZZAZIONE E GESTIONE SERVIZI MUSEALI DI BIGLIETTERIA E PRESIDIO DEGLI SPAZI ESPOSITIVI PRESSO I MMUSEI IN CONVENZIONE CON LA CITTÀ E LE SEDI ...,02-PROCEDURA RISTRETTA,2017-04-28,2017-09-14,idm4268
212,ZDC13405B0,00514490010,Città di Torino,5839.00,5839.00,MS V. ZANDONAI 24. BONIFICA E DEMOLIZIONE BASSO FABBRICATO - INCARICO DIRETTORE OPER. CON FUNZ. DI COORD. SICUR. IN FASE ESEC.,23-AFFIDAMENTO DIRETTO,2017-06-14,2017-12-12,idm4285
213,55246426CC,00514490010,Città di Torino,181742.00,178747.00,OGGETTO: SERVIZI MUSEALI DI BIGLIETTERIA E PRESIDIO DEGLI SPAZI ESPOSITIVI PRESSO I MUSEI IN CONVENZIONE CON LA CITTÀ E LE SEDI AFFERENTI IL SERVIZIO ...,02-PROCEDURA RISTRETTA,2017-06-28,2017-11-06,idm4323
214,5563187723,00514490010,Città di Torino,20785.00,16982.00,M.S. VIA ZANDONAI 24. BONIFICA E DEMOLIZIONE BASSO FABBRICATO - APPROVAZIONE ULTERIORI OPERE,04-PROCEDURA NEGOZIATA SENZA PREVIA PUBBLICAZIONE,2017-09-12,2017-09-21,idm4340
215,55246426CC,00514490010,Città di Torino,169040.00,166818.00,"SERVIZI MUSEALI DI BIGLIETTERIA E PRESIDIO DEGLI SPAZI ESPOSITIVI PRESSO I MUSEI IN CONVENZIONE CON LA CITTA'E LE SEDI AFFERENTI IL SERVIZIO ARCHIVI, ...",02-PROCEDURA RISTRETTA,2017-08-11,2018-01-30,idm4357
216,55246426CC,00514490010,Città di Torino,501274.00,497450.00,"SERVIZI MUSEALI DI BIGLIETTERIA E PRESIDIO DEGLI SPAZI ESPOSITIVI PRESSO I MUSEI IN CONVENZIONE CON LA CITTÀ E LE SEDI AFFERENTI IL SERVIZIO ARCHIVI, ...",04-PROCEDURA NEGOZIATA SENZA PREVIA PUBBLICAZIONE,2017-09-28,2018-04-06,idm4374
217,714084293A,00514490010,Città di Torino,47580.00,47580.00,"AFFIDAMENTO REDAZIONE E GESTIONE SITO WEB CONTEMPORARY TORINO PIEMONTE 2017 ALLA DITTA CULT S.R.L. EURO 47.580,00 CODICE CIG 714084293A. IMPEGNO ...",04-PROCEDURA NEGOZIATA SENZA PREVIA PUBBLICAZIONE,2017-09-29,2018-11-30,idm4391
218,ZB9171C337,00514490010,Città di Torino,270.00,56.00,CORSI DI FORMAZIONE MUSICALE - COMUNICAZIONE URGENTE AD ALLIEVI ED INSEGNANTI TRAMITE SERVIZIO DI TELEFONIA MOBILE VODAFONE - MESSAGGISTICA. IMPEGNO ...,01-PROCEDURA APERTA,2018-01-01,2018-12-31,idm4408
219,6852711C00,00514490010,Città di Torino,141964.00,141707.00,AFFIDAMENTO MEDIANTE RICORSO AL M.E.P.A. PER LA FORNITURA SHELF-READY DI PUBBLICAZIONI ITALIANE PER LE BIBLIOTECHE CIVICHE TORINESI. IMPEGNO DI SPESA ...,07-SISTEMA DINAMICO DI ACQUISIZIONE,2017-12-29,2018-06-29,idm4425
220,685272578F,00514490010,Città di Torino,36414.00,34339.00,"AFFIDAMENTO MEDIANTE RICORSO AL M.E.P.A. PER LA FORNITURA SHELF-READY DI PUBBLICAZIONI ITALIANE PER RAGAZZI. IMPEGNO DI SPESA DI EURO 15.000,00. LOTTO...",07-SISTEMA DINAMICO DI ACQUISIZIONE,2017-12-29,2018-06-29,idm4442
221,7326221CD0,00514490010,Città di Torino,630000.00,8516.00,"LOTTO N.1: PUBBLICAZIONI ITALIANE, IVI COMPRESE L'EDITORIA SCOLASTICA E LE OPERE DI EDITORI STRANIERI",01-PROCEDURA APERTA,2018-08-06,2019-01-03,idm4459
222,7326264050,00514490010,Città di Torino,40000.00,0.00,LOTTON. 2: PUBBLICAZIONI STRANIERE,01-PROCEDURA APERTA,2018-08-03,2019-01-03,idm4476
223,7326301ED4,00514490010,Città di Torino,140000.00,0.00,LOTTO N. 3: PUBBLICAZIONI ITALIANE PER RAGAZZI,01-PROCEDURA APERTA,2018-08-03,2019-01-03,idm4493
224,55246426CC,00514490010,Città di Torino,456323.00,451776.00,SERVIZI MUSEALI DI BIGLIETTERIA E PRESIDIO DEGLI SPAZI ESPOSITIVI PRESSO I MUSEI IN CONVENZIONE CON LA CITTA' E LE SEDI AFFERENTI IL SERVIZIO ARCHIVI...,04-PROCEDURA NEGOZIATA SENZA PREVIA PUBBLICAZIONE,2018-02-08,2018-06-30,idm4510
225,6370999AAF,00514490010,Città di Torino,930.00,929.00,FORNITURA BOMBOLETTE SPRAY PER ATTIVITA' CONNESSE AL PROGETTO MURARTE DELLA CITTA'. DITTA SPOT - CODICE CIG 6370999AAF. SECONDO IMPEGNO LIMITATO DI ...,08-AFFIDAMENTO IN ECONOMIA - COTTIMO FIDUCIARIO,2018-04-19,2018-09-30,idm4527
226,Z7421A004C,00514490010,Città di Torino,6870.00,6626.00,SERVIZIO DI STAMPA CIRCUITI MUPI JUNIOR RELATIVI ALLA PROMOZIONE DEGLI EVENTI «TORINO VERSO UNA CITTA' ACCESSIBILE» E «CONTEMPORARY ART 2018». IMPEGNO...,07-SISTEMA DINAMICO DI ACQUISIZIONE,2018-08-07,2018-12-31,idm4547
227,6370999AAF,00514490010,Città di Torino,16000.00,0.00,FORNITURA BOMBOLETTE SPRAY PER ATTIVITA' CONNESSE AL PROGETTO MURARTE DELLA CITTA'. DITTA SPOT DI PAGANO ANDREA - CODICE CIG 6370999AAF. TERZO IMPEGNO...,08-AFFIDAMENTO IN ECONOMIA - COTTIMO FIDUCIARIO,2018-12-14,2018-12-31,idm4567
