n,cig,strutturaProponente:codiceFiscaleProp,strutturaProponente:denominazione,importoAggiudicazione,importoSommeLiquidate,oggetto,sceltaContraente,tempiCompletamento:dataInizio,tempiCompletamento:dataUltimazione,lottoID
209,7705503E38,00124600685,CITTA' DI PESCARA,11440.0,0.0,"""RIQUALIFICAZIONE PISTA CICLABILE CORRIDOIO VERDE ESISTENTE TRATTO STAZIONE CENTRALE - MONTESILVANO - MIGLIORAMENTO ACCESSO AI PARCHI URBANI ED ALLA RIVIERA NORD"" - AFFIDAMENTO INCARICO DI DIREZIONE LAVORI E COORD. SIC. FASE DI ESEC. ARCH. DI FABIO",23-AFFIDAMENTO DIRETTO,,,idm3722
210,ZB52610019,00124600685,CITTA' DI PESCARA,796.0,971.12,"RINNOVO LICENZA ANNUALE 2019
EASYTELEMATICO",23-AFFIDAMENTO DIRETTO,2018-12-31,2019-12-31,idm3740
211,ZB525BD37C,00124600685,CITTA' DI PESCARA,235.0,235.0,"FORNITURA ABBONAMENTO ANNUALE RIVISTA
WKI GIURIDICA ""URBANISTICA E APPALTI""",23-AFFIDAMENTO DIRETTO,2018-12-31,2019-12-31,idm3760
212,Z7024E36EE,00124600685,CITTA' DI PESCARA,120.0,120.0,"FORNITURA N. 2 VOLUMI CON SOFTWARE “LE
NUOVE REGOLE SUI COMPENSI DEGLI AVVOCATI” GIUFFRE'
EDITORE",23-AFFIDAMENTO DIRETTO,2019-03-20,2019-03-20,idm3780
213,Z1C26563A8,00124600685,CITTA' DI PESCARA,582.0,582.0,IMPEGNO DI SPESA PER ACQUISTO MASCHERINE MONOUSO-DPI- PER OPERATORI DELLA POLIZIA MUNICIPALE A FAVORE DELLE DITTE: GERARDO FERRAMENTA S.A.S- - CIG Z1C26563A8 E METALCOLOR DI TARABORRELLI DEMETRIO - CIG Z0A26563B5-,23-AFFIDAMENTO DIRETTO,2018-12-20,2019-02-05,idm3800
214,Z0A26563B5,00124600685,CITTA' DI PESCARA,155.0,155.0,IMPEGNO DI SPESA PER ACQUISTO MASCHERINE MONOUSO-DPI- PER OPERATORI DELLA POLIZIA MUNICIPALE,23-AFFIDAMENTO DIRETTO,2018-12-20,2019-01-02,idm3814
215,Z8925BA64A,00124600685,CITTA' DI PESCARA,4980.0,0.00,"LAVORI DI RISANAMENTO CONSERVATIVO E RIPRISTINO IMPIANTO IDRICO E OPERE MURARIE NEI LOCALI ADIACENTI IL TEATRO MICHETTI - AFFIDAMENTO DITTA CSI CENTRO SERVIZI IDRAULICI DI PAPA MASSIMO 

LAVORI DI RISANAMENTO CONSERVATIVO E RIPRISTINO IMPIANTO IDRICO",23-AFFIDAMENTO DIRETTO,,,idm3828
216,ZFA2651D17,00124600685,CITTA' DI PESCARA,4950.0,0.00,"LAVORI DI MANUTENZIONE ORDINARIA DISPOSITIVI DI SICUREZZA, VIE
DI ESODO E USCITE DI SICUREZZA VARI IMPIANTI SPORTIVI DI PROPRIETA'
COMUNALE. AFFIDAMENTO ALLA DITTA DAMIANI GIORGIO",08-AFFIDAMENTO IN ECONOMIA - COTTIMO FIDUCIARIO,,,idm3846
217,Z902625EF0,00124600685,CITTA' DI PESCARA,18732.7,0.00,"ADESIONE CONVENZIONE CONSIP ""SPC2"" - INTEGRAZIONE",26-AFFIDAMENTO DIRETTO IN ADESIONE AD ACCORDO QUADRO/CONVENZIONE,,,idm3864
218,7680826221,00124600685,CITTA' DI PESCARA,5824.0,0.00,ADEGUAMENTO FUNZIONALE E MESSA IN SICUREZZA DEL MARCIAPIEDE LATO MARE DI VIA CASTELLAMARE ADRIATICO. PROGETTAZIONE DEFINITIVA ESECUTIVA E COORDINAMENTO DELLA SICUREZZA IN FASE DI PROGETTAZIONE.,23-AFFIDAMENTO DIRETTO,,,idm3882
219,7711108F9C,00124600685,CITTA' DI PESCARA,34784.68,0.00,FORNITURA DI ATTREZZATURE E MATERIALI DI CONSUMO. AFFIDAMENTO TRAMITE MEPA ALLA DITTA ETERNEDILE SRL,23-AFFIDAMENTO DIRETTO,,,idm3894
220,ZB724D405C,00124600685,CITTA' DI PESCARA,25772.73,0.00,SERVIZIO DI NOLEGGIO N. 3 SCUOLABUS PER IL TRASPORTO DEGLI ALUNNI DELLA SCUOLE COMUNALI. - AFFIDAMENTO DIRETTO,23-AFFIDAMENTO DIRETTO,,,idm3906
221,77355097F6,00124600685,CITTA' DI PESCARA,7993.44,0.00,INDAGINI GEOLOGICHE E GEOTECNICHE  - AFFIDAMENTO EX ART. 36 COMMA 2 LETT. A DLGS 50/2016- APPROVAZIONE TRATTATIVA DIRETTA MEPA - DITTA AURELI SOIL,23-AFFIDAMENTO DIRETTO,,,idm3918
222,Z21253871E,00124600685,CITTA' DI PESCARA,8176.5,0.00,"INTERVENTI DI RIPARAZIONE ELETTROPOMPE RETE ACQUE BIANCHE  - AFFIDAMENTO EX ART. 36 C. 2, LETT A) DITTA IDROPOMPE SRL",23-AFFIDAMENTO DIRETTO,,,idm3936
223,Z092510E21,00124600685,CITTA' DI PESCARA,15700.0,0.00,SERVIZIO DI VERIFICHE PERIODICHE BIENNALI RIGUARDO GLI IMPIANTI DI TERRA E GLI IMPIANTI ELEVATORI DI PERTINENZA COMUNALE - AFFIDAMENTO CON TRATTATIVA DIRETTA MEPA ALLA DITTA BUREAU VERITAS ITALIA SPA,23-AFFIDAMENTO DIRETTO,,,idm3948
224,ZDA25AC701,00124600685,CITTA' DI PESCARA,900.0,0.00,FORNTITURA E POSA IN OPERA DI TARGA MARMO PRESSO LA FONTANA VECCHIO LAVATOIO DI LARGO MADONNA. AFFIDAMENTO DITTA AQUAZUR,23-AFFIDAMENTO DIRETTO,2018-12-07,,idm3960
225,7676826D36,00124600685,CITTA' DI PESCARA,73480.0,0.00,"INSTALLAZIONE DI SISTEMI PER IL CONTROLLO E LA QUANTIFICAZIONE DEI VISITATORI DI RISORSE AMBIENTALI E CULTURALI ESISTENTI (POR FESR ABRUZZO 2014-2020, ASSE VII SVILUPPO URBANO SOSTENIBILE). AGGIUDICAZIONE DEFINITIVA ALLO STUDIO NICOLI, DI GRAZIANO NI",23-AFFIDAMENTO DIRETTO,,,idm3973
226,ZDA2657588,00124600685,CITTA' DI PESCARA,3060.0,3733.2,IMPEGNO DI SPESA PER LA FORNITURA DI N. 170 PLACCHE PETTORALI CON IL LOGO DELLA REGIONE ABRUZZO PER GLI APPARTENENTI AL CORPO DI POLIZIA MUNICIPALE – AFFIDAMENTO DIRETTO ALLA DITTA SARTORIA CIVILE E MILITARE RECCHIA SAS – CIG N. ZDA2657588,23-AFFIDAMENTO DIRETTO,2018-12-27,,idm3991
227,ZF0265B93B,00124600685,CITTA' DI PESCARA,450.0,468.0,IMPEGNO DI SPESA PER IL RINNOVO “MEMOWEB AVANZATO” – GRAFICHE E. GASPARI – RAPPRESENTANTE GALLI DONATO SAS DEL DR. GALLI ANGELO & C.,23-AFFIDAMENTO DIRETTO,2019-01-01,2019-12-31,idm4010
228,ZBA266930C,00124600685,CITTA' DI PESCARA,790.0,0.00,"LAVORI DI MANUTENZIONE ORDINARIA ANTILEGIONELLA PRESSO LO STADIO ADRIATICO. AFFIDAMENTO DIRETTO EX ART. 36, COMMA 2 LETTERA A) D. LGS. N. 50/2016 ALLA DITTA PACE DINO",23-AFFIDAMENTO DIRETTO,,,idm4030
229,Z0D260A7AD,00124600685,CITTA' DI PESCARA,4800.0,0.00,"LAVORI DI MANUTENZIONE ORDINARIA E DI DISINFESTAZIONE ANTI LEGIONELLA IMPIANTI IDRICI, SANITARI E ANTINCENDIO DELLO STADIO ADRIATICO - GIOVANNI CORNACCHIA",23-AFFIDAMENTO DIRETTO,,,idm4048
230,ZD9262C208,00124600685,CITTA' DI PESCARA,15000.0,0.00,"PROGRAMMA FORMATIVO DI EDUCAZIONE AMBIENTALE PER LE SCUOLE DENOMINATO ""VIVIAMO L'AMBIENTE!"" - AFFIDAMENTO DITTA SHARE CITY SRLS",23-AFFIDAMENTO DIRETTO,2018-12-15,,idm4066
231,7732503755,00124600685,CITTA' DI PESCARA,13299.2,0.0,SERVIZIO INVERNALE DI SGOMBERO NEVE E SPARGIMENTO PRODOTTI ANTIGHIACCIO DEL COMUNE DI PESCARA PER DUE STAGIONI INVERNALI (2018/2019 E 2019/2020) - AREA DI INTERVENTO N. 1 (LOTTO N. 1) - TRATTATIVA DIRETTA MEPA CON LA DITTA DI GIAMPAOLO S.R.L,23-AFFIDAMENTO DIRETTO,,,idm4079
232,6587027AA1,00124600685,CITTA' DI PESCARA,15144.0,0.00,MANUTENZIONE URGENTE IMPIANTI ELEVATORI DI PERTINENZA COMUNALE - AFFIDAMENTO DITTA SCHINDLER S.P.A.,23-AFFIDAMENTO DIRETTO,2018-12-31,,idm4097
233,7653852E77,00124600685,CITTA' DI PESCARA,36400.0,0.0,"SERVIZIO DI VALUTAZIONE DELLO STATO DI DEGRADO E DELLA SICUREZZA STATICA DI QUATTRO PONTI IN GESTIONE AL COMUNE DI PESCARA:RAMPE ACCESSO ASSE ATTREZZATO,PONTE  STR. COM. PRATI,PONTE  FOSSO VALLE LUNGA,V. PRIMO VERE,PONTE STR. COLLE PINETA – SS 174",23-AFFIDAMENTO DIRETTO,,,idm4110
234,Z7225DFB14,00124600685,CITTA' DI PESCARA,2200.0,0.00,FORNITURA DI VERNICI ECOLOGICHE PER SEGNATURA MANTO ERBOSO CAMPO STADIO ADRIATICO G. CORNACCHIA - AFFIDAMENTO TRAMITE MEPA DITTA AGRICENTER DI PIMAZZONI ANDREA GIOVANNI,23-AFFIDAMENTO DIRETTO,,,idm4128
235,7732917CF8,00124600685,CITTA' DI PESCARA,18950.8,0.0,SERVIZIO INVERNALE DI SGOMBERO NEVE E SPARGIMENTO PRODOTTI ANTIGHIACCIO DEL COMUNE DI PESCARA PER DUE STAGIONI INVERNALI (2018/2019 E 2019/2020) - AREA DI INT. N. 8 - GRANDI VIE PESCARA SUD  (LOTTO N. 8) - TRATTATIVA MEPA CON  EEDILIZIA ARAMINI SAS,23-AFFIDAMENTO DIRETTO,,,idm4146
236,Z7F2687052,00124600685,CITTA' DI PESCARA,11731.5,0.0,"SERVIZIO DI VIGILANZA ATTIVA DEI PARCHEGGI POSTI NELL'AREA DI RISULTA DELL'EX STAZIONE CENTRALE DI PESCARA DENOMINATI ""PARCHEGGIO CENTRALE"" - TRATTATIVA DIRETTA MEPA ED AFFIDAMENTO ALLA DITTA FEDERALPOL SRL.",23-AFFIDAMENTO DIRETTO,,,idm4164
237,769151247E,00124600685,CITTA' DI PESCARA,13916.0,0.0,FORNITURA DI ATTREZZATURE E SEGNALETICA STRADALE ATTRAVERSO TRATTATIVA DIRETTA SU MEPA - AFFIDAMENTO ALLA DITTA MFR SRL.,23-AFFIDAMENTO DIRETTO,,,idm4182
238,Z8C2616F9B,00124600685,CITTA' DI PESCARA,4230.0,2533.44,AFFIDAMENTO ALLA DITTA SOCIETA’ GRAFICHE E. GASPARI SRL PER L’ACQUISTO DI UNA LICENZA BIENNALE PER L’ATTIVAZIONE DELL’APP PER LA POLIZIA LOCALE – PROGETTO MYCITY – SUL MEPA MEDIANTE ORDINE DIRETTO -  CIG Z8C2616F9B,23-AFFIDAMENTO DIRETTO,2019-01-01,2020-12-31,idm4200
239,Z1C2661810,00124600685,CITTA' DI PESCARA,245.0,254.8,IMPEGNO DI SPESA PER L’ACQUISTO DI PUBBLICAZIONI - AFFIDAMENTO DIRETTO A FAVORE DELLA DITTA GRAFICHE E. GASPARI CIG. Z1C2661810,23-AFFIDAMENTO DIRETTO,2019-05-27,2019-05-27,idm4220
240,7707705760,00124600685,CITTA' DI PESCARA,25376.0,0.00,"LAVORI DI CONSOLIDAMENTO E RISTRUTTURAZIONE STELE DANNUNZIANA. AFFIDAMENTO INCARICO DI PROGETTAZIONE DEFINITIVA/ESECUTIVA, COORD. SICUREZZA IN FASE DI PROGETTAZIONE E ESECUZIONE VERIFICHE - ING. PAOLO IANNETTI",23-AFFIDAMENTO DIRETTO,,,idm4240
241,77328895DF,00124600685,CITTA' DI PESCARA,7635.6,0.00,SERVIZIO INVERNALE DI SGOMBERO NEVE E SPARGIMENTO PRODOTTI ANTIGHIACCIO DEL COMUNE DI PESCARA - STAGIONI INVERNALI 2018-2019 E 2019-2020. LOTTO 6,23-AFFIDAMENTO DIRETTO,,,idm4258
242,77329410CA,00124600685,CITTA' DI PESCARA,18950.8,0.00,SERVIZIO INVERNALE DI SGOMBERO NEVE E SPARGIMENTO PRODOTTI ANTIGHIACCIO DEL COMUNE DI PESCARA - STAGIONI INVERNALI 2018-2019 E 2019-2020. LOTTO 9,23-AFFIDAMENTO DIRETTO,,,idm4276
243,ZE22634CBE,00124600685,CITTA' DI PESCARA,3035.0,0.00,AFFIDAMENTO DIRETTO A FAVORE DELLA R.T.C. SRL PER I SERVIZIO DI MANUTENZIONE RADIO,08-AFFIDAMENTO IN ECONOMIA - COTTIMO FIDUCIARIO,,,idm4294
244,Z9D264B1AA,00124600685,CITTA' DI PESCARA,122.95,122.95,IMPEGNO DI SPESA PER L’ACQUISTO DI PUBBLICAZIONI MAGGIOLI - AFFIDAMENTO DIRETTO A FAVORE DELLA MAGGIOLI SPA - CIG: Z9D264B1AA,08-AFFIDAMENTO IN ECONOMIA - COTTIMO FIDUCIARIO,2019-02-02,2019-12-24,idm4312
246,77079891BF,00124600685,CITTA' DI PESCARA,9500.0,11590.0,"AFFIDAMENTO SERVIZIO BIENNALE DI AGGIORNAMENTO E MANUTENZIONE DEI PROGRAMMI IN USO ALLA CENTRALE OPERATIVA MULTIFUNZIONALE, TURNI E SERVIZI E INFORTUNISTICA STRADALE - GARA N. 7264247 -",23-AFFIDAMENTO DIRETTO,,,idm4344
247,7713740B9C,00124600685,CITTA' DI PESCARA,4770.0,0.00,ORDINE DIRETTO DI ACQUISTO MEPA: ACQUISTO STAMPANTI PORTATILI PER L'ACCERTAMENTO DI INFRAZIONI AL CDS IN MOBILITA' -7713740B9C,23-AFFIDAMENTO DIRETTO,,,idm4356
248,7679327D1A,00124600685,CITTA' DI PESCARA,25118.39,0.00,SERVIZI INVERNALE DI SGOMBERO NEVE E SPARGIMENTO PRODOTTI ANTIGHIACCIO DEL COMUNE DI PESCARA PER LE STAGIONI INVERNALI 2018-2019 E 2019-2020. LOTTO 3,04-PROCEDURA NEGOZIATA SENZA PREVIA PUBBLICAZIONE,,,idm4374
249,Z9826306CB,00124600685,CITTA' DI PESCARA,23473.7,0.0,INTERVENTI DI RIORDINO E PROTEZIONE DELLA FLORA E RIDUZIONE DEL RISCHIO DERIVANE DALLE ALBERATURE PROSPICIENTI LE AREE DI FRUIZIONE NELLA RISERVA NATURALE DANNUNZIANA - AFFIDAMENTO ALLA DITTA VIVAIO ALTEA SRL.,23-AFFIDAMENTO DIRETTO,,,idm4392
250,Z6E2661898,00124600685,CITTA' DI PESCARA,17769.83,0.0,PRIMI INTERVENTI URGENTI DI ELIMINAZIONE O MITIGAZIONE DEL RISCHIO DERIVANTE DAGLI ALBERI SOTTOPOSTI A VTA - TRATTATIVA DIRETTA MEPA ED AFFIDAMENTO ALLA DITTA IL MELOGRANO SRL,23-AFFIDAMENTO DIRETTO,,,idm4410
251,7298628A5A,00124600685,CITTA' DI PESCARA,283651.02,0.00,REALIZZAZIONE PISTE CICLABILI,04-PROCEDURA NEGOZIATA SENZA PREVIA PUBBLICAZIONE,,,idm4428
252,7733449400,00124600685,CITTA' DI PESCARA,16190.0,0.00,LAVORI DI REALIZZAZIONE DI IMPIANTI DI VIDEO SORVEGLIANZA IN VARI IMPIANTI SPORTIVI E ADEGUAMENTO DELLA SALA GOS PRESSO LO STADIO ADRIATICO G CORNACCHIA,23-AFFIDAMENTO DIRETTO,,,idm4503
253,7733235367,00124600685,CITTA' DI PESCARA,7150.0,0.00,SERVIZIO DI PROVE ED INDAGINI STRUTTURALI PRESSO L’IMPIANTO SPORTIVO R.CURI – RAMPIGNA,23-AFFIDAMENTO DIRETTO,,,idm4521
254,ZC226B0591,00124600685,CITTA' DI PESCARA,330.0,0.00,MANUTENZIONE SERVER A SEGUITO GRAVI MALFUNZIONAMENTI - IMPEGNO DI SPESA,23-AFFIDAMENTO DIRETTO,,,idm4539
255,ZAF26B56BA,00124600685,CITTA' DI PESCARA,2405.5,0.00,CONSULTAZIONE ELETTORALE DEL 10 FEBBRAIO 2019 - SPESE PER ACQUISTO STAMPANTI,03-PROCEDURA NEGOZIATA PREVIA PUBBLICAZIONE,2019-01-16,,idm4557
256,Z982522AC5,00124600685,CITTA' DI PESCARA,1500.0,0.00,SERVIZIO PUBBLICITARIO SU QUOTIDIANI E RETI LOCALI - PRESENTAZIONE UFFICIO UEAM COMUNE DI PESCARA,23-AFFIDAMENTO DIRETTO,,,idm4576
257,ZB22522CE0,00124600685,CITTA' DI PESCARA,518.0,0.00,ORGANIZZAZIONE COFFEE BREAK - PRESENTAZIONE UFFICIO UEAM COMUNE DI PESCARA,23-AFFIDAMENTO DIRETTO,,,idm4594
258,Z1B25501EC,00124600685,CITTA' DI PESCARA,0.00,0.00,ASS. TECLA - IMPLEMENTAZIONE ED ATTUAZIONE UFFIO UEAM COMUNE DI PESCARA,26-AFFIDAMENTO DIRETTO IN ADESIONE AD ACCORDO QUADRO/CONVENZIONE,,,idm4618
259,7717522C9D,00124600685,CITTA' DI PESCARA,26500.0,0.00,PIANTUMAZIONE ALBERI IN VARIE ZONE DELLA CITTÀ.  AFFIDAMENTO ALL’ IMPRESA IL VERDE SRL UNIPERSONALE DI PAOLINI LIDIA.,23-AFFIDAMENTO DIRETTO,,,idm4636
260,7673181D43,00124600685,CITTA' DI PESCARA,39841.0,0.00,INTERVENTI DI SOMMA URGENZA PER RIPRISTINO MANTO STRADALE ZONA SUD DELLA CITTÀ A SEGUITO DI AVVERSE CONDIZIONI ATMOSFERICHE DEL 22/10/2018 - IMPEGNO DI SPESA A FAVORE DELLA DITTA ZACCARDI ASFALTI GROUP SRL,23-AFFIDAMENTO DIRETTO,,,idm4648
261,7373333ADE,00124600685,CITTA' DI PESCARA,20300.0,0.00,RIQUALIFICAZIONE EDIFICIO DELL'EX MATTATOIO (COD. 1817/2018)  INCARICO DI SUPPORTO AL RUP IN FASE DI PROGETTAZIONE ED ESECUZIONE DELL'INTERVENTO  - AFFIDAMENTO DOTT. UGO IOPPI.,08-AFFIDAMENTO IN ECONOMIA - COTTIMO FIDUCIARIO,2018-03-19,,idm4660
262,7336117343,00124600685,CITTA' DI PESCARA,79740.55,0.00,COMPLETAMENTO PALESTRA POLIFUNZIONALE IN VIA CADUTI PER SERVIZIO – AREE ESTERNE,04-PROCEDURA NEGOZIATA SENZA PREVIA PUBBLICAZIONE,2018-06-20,,idm4679
263,7499970309,00124600685,CITTA' DI PESCARA,31040.0,0.00,MANUTENZIONE ORDINARIA MANTO ERBOSO STADIO ADRIATICO G. CORNACCHIA,08-AFFIDAMENTO IN ECONOMIA - COTTIMO FIDUCIARIO,2018-06-12,,idm4716
264,Z82246CFA2,00124600685,CITTA' DI PESCARA,986.98,0.00,FORNITURA VOLANTINI,23-AFFIDAMENTO DIRETTO,,,idm4735
265,7771875224,00124600685,CITTA' DI PESCARA,37336.0,45549.92,"LAVORI DI RISTRUTTURAZIONE E AMPLIAMENTO VOLTI ALRECUPERO DEL FABBRICATO EX SCUOLA MUZII DI PESCARA, AD USO DEL CONSERVATORIO L. D’ANNUNZIO. PROGETTAZIONE DEFINITIVA/ESECUTIVA STRUTTURE E IMPIANTI.",23-AFFIDAMENTO DIRETTO,2019-01-23,,idm4753
267,Z9B24CC619,00124600685,CITTA' DI PESCARA,130.0,0.00,ACQUISTO ABBONAMENTO ANNUALE ALLA RIVISTA ONLINE “BOLLETTINO DI LEGISLAZIONE TECNICA”,23-AFFIDAMENTO DIRETTO,2018-10-15,,idm4819
268,Z3524FECFC,00124600685,CITTA' DI PESCARA,1776.32,0.00,RIQUALIFICAZIONE STRUTTURALE PESCARA NORD – OPERE DI COMPLETAMENTO E MESSA IN SICUREZZA DI VIA CARAVAGGIO (TRATTO VIA TIEPOLO E VIA BERNINI/VIA BERNINI E PARCHEGGIO GLOBO). PERIZIA DI VARIANTE TECNICA E SUPPLETIVA E AFF. INC. REDAZIONE PERIZIA E D.L.,23-AFFIDAMENTO DIRETTO,2018-10-09,,idm4838
270,Z13266555E,00124600685,CITTA' DI PESCARA,1145.0,0.00,LAVORI DI MANUTENZIONE ORDINARIA IMPIANTO GAS A SERVIZIO DELLA NUOVA PALESTRA POLIFUNZIONALE DI FONTANELLE,23-AFFIDAMENTO DIRETTO,,,idm4888
271,7473975747,00124600685,CITTA' DI PESCARA,395608.08,0.00,COMPLETAMENTO RETE PERCORSI CICLABILI LUNGO LE VIABILITÀ ESISTENTI  VIA PEPE ATTRAVERSO LA RIQUALIFICAZIONE DELL'INTERO ASSE VIARIO - DA VIA D'AVALOS ALLA RIVIERA. AGGIUDICAZIONE DEFINITIVA ALLA DITTA ROCAR COSTRUZIONI SRL.,04-PROCEDURA NEGOZIATA SENZA PREVIA PUBBLICAZIONE,,,idm4900
272,747232774E,00124600685,CITTA' DI PESCARA,90569.23,0.00,"ADEGUAMENTO AI PROGRAMMI OPERATIVI AI SENSI DEL D.LGS. 81/08 E
SS.MM. E II. - DUL MANUTENZIONI STRAORDINARIE- RIQUALIFICAZIONI CIG
747232774E - AGGIUDICAZIONE DEFINITIVA A FAVORE DELLA DITTA DE-LE SRL.",04-PROCEDURA NEGOZIATA SENZA PREVIA PUBBLICAZIONE,2018-11-12,,idm4960
273,7662949190,00124600685,CITTA' DI PESCARA,31881.76,0.00,ADEGUAMENTO SISMICO E ANTINCENDIO SCUOLA STATALE ANTONELLI DI VIA VIRGILIO. AFFIDAMENTO INCARICO DI PROGETTAZIONE DEFINITIVA\ESECUTIVA ALL'ARCH. LUCA PANTALONE.,23-AFFIDAMENTO DIRETTO,2018-11-05,,idm4973
274,765454063B,00124600685,CITTA' DI PESCARA,29091.52,0.00,ADEGUAMENTO SISMICO E ANTINCENDIO SCUOLA STATALE MICHETTI DI VIA DEL CIRCUITO. AFFIDAMENTO INCARICO DI PROGETTAZIONE DEFINITIVA\ESECUTIVA ALL'ING. MAURO DELLA PENNA.,23-AFFIDAMENTO DIRETTO,2018-10-26,,idm4986
275,ZEA2630171,00124600685,CITTA' DI PESCARA,7280.0,0.00,AFFIDAMENTO INCARICO DI PROGETTAZIONE DEFINITIVA\ESECUTIVA ALL'ARCH. LUCA PANTALONE NELL'AMBITO DELL' ADEGUAMENTO SISMICO E ANTINCENDIO SCUOLA STATALE ANTONELLI DI VIA VIRGILIO - INDAGINI SUPPLEMENTARI.,23-AFFIDAMENTO DIRETTO,2019-01-02,2019-01-02,idm4999
276,766709709A,00124600685,CITTA' DI PESCARA,22950.69,0.00,LAVORI DI MANUTENZIONE DEL VERDE DA ESEGUIRSI PRESSO LE SCUOLE COMUNALI. AFFIDAMENTO ALLA DITTA VIVAI BARRETTA SRL.,23-AFFIDAMENTO DIRETTO,2018-11-28,,idm5013
277,7586950533,00124600685,CITTA' DI PESCARA,121025.53,0.00,LAVORI DI MANUTENZIONE STRAORDINARIA DEGLI IMMOBILI COMUNALI - CIG 7586950533 - AGGIUDICAZIONE DEFINITIVA DITTA BACCARI COSTRUZIONI SRLS.,04-PROCEDURA NEGOZIATA SENZA PREVIA PUBBLICAZIONE,2018-10-24,,idm5026
278,7506078384,00124600685,CITTA' DI PESCARA,189764.84,0.00,LAVORI DI MESSA IN SICUREZZA DEGLI IMMOBILI COMUNALI 2018 - ACCORDO QUADRO. AGGIUDICAZIONE DEFINITIVA ALLA DITTA EDIL DI SINNO.,04-PROCEDURA NEGOZIATA SENZA PREVIA PUBBLICAZIONE,2018-09-17,,idm5039
279,76599094DF,00124600685,CITTA' DI PESCARA,12239.81,0.00,LAVORI DI MESSA IN SICUREZZA DEGLI IMMOBILI COMUNALI 2018 – ACCORDO QUADRO (COD. 1562) - AFFIDAMENTO INCARICO DI  DIREZIONE LAVORI E COORDINAMENTO SICUREZZA  IN FASE DI ESECUZIONE ALLA DITTA DEL DUCHETTO URBAN OFFICE.,23-AFFIDAMENTO DIRETTO,2018-11-08,,idm5052
280,737590555B,00124600685,CITTA' DI PESCARA,47980.43,0.00,VERIFICA DELLA VULNERABILITA' SISMICA DELLE SCUOLE COMUNALI - CIG 737590555B. AGGIUDICAZIONE DEFINITIVA  ALLA RTP HABITARE SERVIZI INTEGRATI SRL / SIDOTI ENGINEERING SRL.,04-PROCEDURA NEGOZIATA SENZA PREVIA PUBBLICAZIONE,2018-12-17,,idm5065
281,7431165759,00124600685,CITTA' DI PESCARA,241173.6,0.00,VERIFICA DELLA VULNERABILITA' SISMICA DELLE SCUOLE COMUNALI - LOTTO 2. AGGIUDICAZIONE DEFINITIVA ALLA DITTA SAGI SRL.,04-PROCEDURA NEGOZIATA SENZA PREVIA PUBBLICAZIONE,2018-10-29,,idm5078
282,Z5B1EB8E47,00124600685,CITTA' DI PESCARA,7400.0,0.00,CONVENZIONE CONSIP TELEFONIA MOBILE 6 - PROROGA I TRIMESTRE,26-AFFIDAMENTO DIRETTO IN ADESIONE AD ACCORDO QUADRO/CONVENZIONE,,,idm5091
283,7738397737,00124600685,CITTA' DI PESCARA,2652.0,0.00,AFFIDAMENTO INCARICO PER LA REDAZIONE DI N. 2 RELAZIONI GEOLOGICHE PER SCUOLA MICHETTI E SCUOLA ANTONELLI AL GEOLOGO SANDRO POZZI.,23-AFFIDAMENTO DIRETTO,2019-02-12,,idm5109
284,Z73270B1EB,00124600685,CITTA' DI PESCARA,9455.36,0.00,INTERVENTI DI RIORDINO E PROTEZIONE DELLA FLORA E RIDUZIONE DEL RISCHIO DERIVANTE DALLE ALBERATURE PROSPICIENTI LE AREE DI FRUIZIONE DELLA RISERVA NATURALE PINETA DANNUNZIANA. SECONDO INTERVENTO COLTURALE. AFFIDAMENTO ALLA DITTA VIVAIO ALTEA SRL.,23-AFFIDAMENTO DIRETTO,,,idm5122
285,Z2227073E3,00124600685,CITTA' DI PESCARA,4730.0,5770.6,ELEZIONI DEL PRESIDENTE DELLA GIUNTA REGIONALE E DEL CONSIGLIO DELLA REGIONE ABRUZZO DEL 10 FEBBRAIO 2019. AFFIDAMENTO DIRETTO TRAMITE MEPA ALLA DITTA  DISINFEST CONTROL DEL  SERVIZIO DI DISINFESTAZIONE SEGGI ELETTORALI,23-AFFIDAMENTO DIRETTO,2019-02-11,2019-02-12,idm5140
286,ZE22630335,00124600685,CITTA' DI PESCARA,2339.98,2433.58,RINNOVO ABBONAMENTO DE JURE + IURIS DATA,23-AFFIDAMENTO DIRETTO,2019-01-31,2020-01-31,idm5160
287,Z5B26C0915,00124600685,CITTA' DI PESCARA,670.0,696.8,"RINNOVO ABBONAMENTO LEXITALIA.IT 2019
GIURICONSULT SRL",23-AFFIDAMENTO DIRETTO,2019-01-31,2020-01-31,idm5180
288,76871168CB,00124600685,CITTA' DI PESCARA,143301.27,0.00,LAVORI DI MANUTENZIONE STRAORDINARIA COPERTURA DEL FABBRICATO EX PALAZZO DI GIUSTIZIA. AGGIUDICAZIONE ALLA DITTA ECOLAPINTO SRL DI BITONTO (BA).,04-PROCEDURA NEGOZIATA SENZA PREVIA PUBBLICAZIONE,,,idm5200
289,7693950066,00124600685,CITTA' DI PESCARA,5824.0,0.00,REALIZZAZIONE SKATE PARK - PROGETTAZIONE DEFINITIVA/ESECUTIVA. AFFIDAMENTO ALL'ARCH. BARBARA DEL ROSSO.,23-AFFIDAMENTO DIRETTO,,,idm5260
290,7703039CDD,00124600685,CITTA' DI PESCARA,12376.0,0.0,COMPLETAMENTO E RIQUALIFICAZIONE DI PIAZZA NILDE IOTTI - AFFIDAMENTO INCARICO DI PROGETTAZIONE DEFINITIVO/ESECUTIVA E COORDINAMENTO DELLA SICUREZZA IN FASE DI PROGETTAZIONE ALL'ARCH. MARCELLO NIMIS.,23-AFFIDAMENTO DIRETTO,,,idm5278
291,ZED216BD32,00124600685,CITTA' DI PESCARA,22000.0,0.00,CONVENZIONE CONSIP TELEFONIA FISSA IP4 - PROROGA I QUADRIMESTRE,26-AFFIDAMENTO DIRETTO IN ADESIONE AD ACCORDO QUADRO/CONVENZIONE,,,idm5296
292,Z482727421,00124600685,CITTA' DI PESCARA,10099.82,0.00,ASSISTENZA E AGGIORNAMENTO PROCEDURA AREA PERSONALE - IMPEGNO DI SPESA A FAVORE DELLA SOCIETA HALLEY INFORMATICA,23-AFFIDAMENTO DIRETTO,,,idm5314
293,Z232677509,00124600685,CITTA' DI PESCARA,11885.25,11885.25,"IMPEGNO DI SPESA PER RECUPERO/TRASPORTO/CUSTODIA DEI VEICOLI SOTTOPOSTI A SEQUESTRO-FERMO AMMINISTRATIVO-RIMOZIONE, DPR 189/01",23-AFFIDAMENTO DIRETTO,2019-02-20,,idm5332
294,72E2677705,00124600685,CITTA' DI PESCARA,12704.92,12704.0,"IMPEGNO DI SPESA PER RECUPERO/TRASPORTO/CUSTODIA DEI VEICOLI SOTTOPOSTI A SEQUESTRO-FERMO AMMINISTRATIVO-RIMOZIONE, DPR 189/01",23-AFFIDAMENTO DIRETTO,2019-02-20,,idm5354
295,Z3F2658790,00124600685,CITTA' DI PESCARA,8831.4,7726.16,CORSO DI ADDESTRAMENTO AL TIRO DEGLI OPERATORI DI POLIZIA  MUNICIPALE ALL’USO DELL’ARMA IN DOTAZIONE – ANNO 2019 – AFFIDAMENTO DIRETTO IN ADESIONE A CONVENZIONE STIPULATA TRA IL COMUNE DI PESCARA ED IL POLIGONO DI TIRO A SEGNO NAZIONALE PESCARA ASD,26-AFFIDAMENTO DIRETTO IN ADESIONE AD ACCORDO QUADRO/CONVENZIONE,,,idm5373
296,7682177CFF,00124600685,CITTA' DI PESCARA,17120.11,0.00,MANUTENZIONE STRAORDINARIA VIA DE CECCO – OPERE A VERDE. AFFIDAMENTO ALLA DITTA VERDE VESTINA SNC.,23-AFFIDAMENTO DIRETTO,,,idm5385
297,ZF126966C0,00124600685,CITTA' DI PESCARA,4650.0,5673.0,RIPRISTINO FUNZIONAMENTO CONDIZIONATORE MODELLO MMY-MAP1204HT8-E MARCA TOSHIBA,23-AFFIDAMENTO DIRETTO,2019-01-21,2019-01-23,idm5403
298,Z1F2726819,00124600685,CITTA' DI PESCARA,22560.0,0.00,ADESIONE CONVENZIONE CONSIP TELEFONIA MOBILE 7 - IMPEGNO DI SPESA,26-AFFIDAMENTO DIRETTO IN ADESIONE AD ACCORDO QUADRO/CONVENZIONE,,,idm5417
299,7729372F8A,00124600685,CITTA' DI PESCARA,78471.45,0.00,LAVORI DI REALIZZAZIONE DELLA CITTADELLA DELL’INFANZIA NELL’IMMOBILE COMUNALE SITO IN VIA TAVO E DI UNA STRUTTURA RICETTIVA NEL PARCO DELL’ASILO CIPI SITO IN VIA CARLO ALBERTO DALLA CHIESA. AGGIUDICAZIONE DEFINITIVA ALLA DITTA A.F.D.T.  SRL P.IVA 015,04-PROCEDURA NEGOZIATA SENZA PREVIA PUBBLICAZIONE,,,idm5435
300,7730823CF2,00124600685,CITTA' DI PESCARA,57888.41,0.00,RIQUALIFICAZIONE DI VARIE VIE E PIAZZE CITTADINE” (COD. 1517/2016) – 1ª VARIANTE IN CORSO D’OPERA  - DITTA APPALTI DI BELLO SRL,23-AFFIDAMENTO DIRETTO,,,idm5447
301,777194296C,00124600685,CITTA' DI PESCARA,4104.34,0.00,"AFFIDAMENTO INCARICO DI COLLAUDATORE STATICO DEI “LAVORI DI REALIZZAZIONE DELLA CITTADELLA DELL’INFANZIA NELL’IMMOBILE COMUNALE SITO IN VIA TAVO E DI UNA STRUTTURA RICETTIVA NEL PARCO DELL’ASILO CPI SITO IN VIA CARLO ALBERTO DALLA CHIESA”, ALL'ARCH.",23-AFFIDAMENTO DIRETTO,,,idm5465
302,7735753153,00124600685,CITTA' DI PESCARA,243997.02,0.0,LAVORI DI RIQUALIFICAZIONE DI VIA REGINA ELENA - AGGIUDICAZIONE DEFINITIVA ALLA DITTA GI.DO.GI. SRL.,04-PROCEDURA NEGOZIATA SENZA PREVIA PUBBLICAZIONE,,,idm5477
303,Z9326DC0B8,00124600685,CITTA' DI PESCARA,819.67,0.00,AFFIDAMENTO DEL SERVIZIO DI CENSIMENTO ARBOREO (AGGIORNAMENTO) DI CUI AL PROTOCOLLO DI INTESA TRA IL COMUNE DI PESCARA E L'ORDINE DEI DOTTORI AGRONOMI DELLA PROVINCIA DI PESCARA.,23-AFFIDAMENTO DIRETTO,,,idm5531
304,Z4D26DC176,00124600685,CITTA' DI PESCARA,819.67,0.00,AFFIDAMENTO DEL SERVIZIO DI CENSIMENTO ARBOREO (AGGIORNAMENTO) DI CUI AL PROTOCOLLO DI INTESA TRA IL COMUNE DI PESCARA E L'ORDINE DEI DOTTORI AGRONOMI DELLA PROVINCIA DI PESCARA,23-AFFIDAMENTO DIRETTO,,,idm5549
305,Z6626DC156,00124600685,CITTA' DI PESCARA,819.67,0.00,AFFIDAMENTO DEL SERVIZIO DI CENSIMENTO ARBOREO (AGGIORNAMENTO) DI CUI AL PROTOCOLLO DI INTESA TRA IL COMUNE DI PESCARA E L'ORDINE DEI DOTTORI AGRONOMI DELLA PROVINCIA DI PESCARA,23-AFFIDAMENTO DIRETTO,,,idm5567
306,ZAA26DC109,00124600685,CITTA' DI PESCARA,819.67,0.00,AFFIDAMENTO DEL SERVIZIO DI CENSIMENTO ARBOREO (AGGIORNAMENTO) DI CUI AL PROTOCOLLO DI INTESA TRA IL COMUNE DI PESCARA E L'ORDINE DEI DOTTORI AGRONOMI DELLA PROVINCIA DI PESCARA,23-AFFIDAMENTO DIRETTO,,,idm5585
307,Z8126DC1C0,00124600685,CITTA' DI PESCARA,819.67,0.00,AFFIDAMENTO DEL SERVIZIO DI CENSIMENTO ARBOREO (AGGIORNAMENTO) DI CUI AL PROTOCOLLO DI INTESA TRA IL COMUNE DI PESCARA E L'ORDINE DEI DOTTORI AGRONOMI DELLA PROVINCIA DI PESCARA,23-AFFIDAMENTO DIRETTO,,,idm5603
308,ZC326DC0E9,00124600685,CITTA' DI PESCARA,819.67,0.00,AFFIDAMENTO DEL SERVIZIO DI CENSIMENTO ARBOREO (AGGIORNAMENTO) DI CUI AL PROTOCOLLO DI INTESA TRA IL COMUNE DI PESCARA E L'ORDINE DEI DOTTORI AGRONOMI DELLA PROVINCIA DI PESCARA,23-AFFIDAMENTO DIRETTO,,,idm5621
309,Z8F26DC19A,00124600685,CITTA' DI PESCARA,819.67,0.00,AFFIDAMENTO DEL SERVIZIO DI CENSIMENTO ARBOREO (AGGIORNAMENTO) DI CUI AL PROTOCOLLO DI INTESA TRA IL COMUNE DI PESCARA E L'ORDINE DEI DOTTORI AGRONOMI DELLA PROVINCIA DI PESCARA,23-AFFIDAMENTO DIRETTO,,,idm5639
310,7603807C07,00124600685,CITTA' DI PESCARA,295821.68,0.0,LAVORI DI RIQUALIFICAZIONE SPAZI PUBBLICI E VIABILITA' QUARTIERE FONTANELLE - AGGIUDICAZIONE DEFINITIVA ALLA DITTA I.C.F. IMPRESA CARPENTERIE FONDAZIONI S.R.L.,04-PROCEDURA NEGOZIATA SENZA PREVIA PUBBLICAZIONE,,,idm5657
311,ZA8275958E,00124600685,CITTA' DI PESCARA,702.9,0.00,MANUTENZIONE STRAORDINARIA STAMPANTE PRESSO SERVIZIO CED - INNOVZIONE TECNOLOGICA - IMPEGNO DI SPESA,23-AFFIDAMENTO DIRETTO,,,idm5723
312,7697956A3E,00124600685,CITTA' DI PESCARA,105458.45,0.00,RIQUALIFICAZIONE DI VIA DEL SANTUARIO - DA VIA RIGOPIANO A VIA MONTI DI CAMPLI. AGGIUDICAZIONE ALLA DITTA CORAZZINI COSTRUZIONI SRL DI POPOLI (PE).,04-PROCEDURA NEGOZIATA SENZA PREVIA PUBBLICAZIONE,,,idm5741
