n,cig,strutturaProponente:codiceFiscaleProp,strutturaProponente:denominazione,importoAggiudicazione,importoSommeLiquidate,oggetto,sceltaContraente,tempiCompletamento:dataInizio,tempiCompletamento:dataUltimazione,lottoID
759,ZDD2622B23,01232710374,Comune di Bologna,2690.00,2690.00,"AFFIDAMENTO CON CONTESTUALE IMPEGNO ALLA DITTA FERRETTI ANDREA DI REGGIO EMILIA PER LA REALIZZAZIONE DI SERVIZI DI DIGITALIZZAZIONE DI QUOTIDIANI PER LA BIBLIOTECA DELL'ARCHIGINNASIO PER UN IMPORTO COMPLESSIVO DI EURO 3.281,80. BILANCIO 2018",23-AFFIDAMENTO DIRETTO,2018-12-05+01:00,2018-12-31+01:00,idm23178
760,ZB125D6561,01232710374,Comune di Bologna,2380.95,2380.95,"REALIZZAZIONE PROGETTO SPERIMENTALE  ""A  SPASSO SUL BORGO""",23-AFFIDAMENTO DIRETTO,2018-12-07+01:00,2018-12-31+01:00,idm23195
761,Z4B25FAFA9,01232710374,Comune di Bologna,2500.00,2500.00,"AFFIDAMENTO A FORNITORI DIVERSI PER LA FORNITURA DI ATTREZZATURE PER LA BIBLIOTECA DELL'ARCHIGINNASIO E CONTESTUALI IMPEGNI DI SPESA PER L'IMPORTO DI EURO 3.834,52. BILANCIO 2018.",23-AFFIDAMENTO DIRETTO,2018-11-28+01:00,2018-12-31+01:00,idm23212
762,Z8B25FB03E,01232710374,Comune di Bologna,643.05,643.05,"AFFIDAMENTO A FORNITORI DIVERSI PER LA FORNITURA DI ATTREZZATURE PER LA BIBLIOTECA DELL'ARCHIGINNASIO E CONTESTUALI IMPEGNI DI SPESA PER L'IMPORTO DI EURO 3.834,52. BILANCIO 2018.",23-AFFIDAMENTO DIRETTO,2018-11-28+01:00,2018-12-31+01:00,idm23229
763,Z5B25F4433,01232710374,Comune di Bologna,1000.00,1000.00,"AFFIDAMENTO CON CONTESTUALI IMPEGNI ALLA DITTA FRANCO COSIMO PANINI EDITORE SPA DI MODENA PER LA FORNITURA DI PUBBLICAZIONI NON PERIODICHE PER LA BIBLIOTECA DELL'ARCHIGINNASIO PER UN IMPORTO COMPLESSIVO DI EURO 1.175,00.",23-AFFIDAMENTO DIRETTO,2018-11-27+01:00,2018-11-29+01:00,idm23246
764,Z7025F44F5,01232710374,Comune di Bologna,175.00,175.00,"AFFIDAMENTO CON CONTESTUALI IMPEGNI ALLA DITTA FRANCO COSIMO PANINI EDITORE SPA DI MODENA PER LA FORNITURA DI PUBBLICAZIONI NON PERIODICHE PER LA BIBLIOTECA DELL'ARCHIGINNASIO PER UN IMPORTO COMPLESSIVO DI EURO 1.175,00.",23-AFFIDAMENTO DIRETTO,2018-11-27+01:00,2018-11-29+01:00,idm23263
765,ZD925EBA94,01232710374,Comune di Bologna,1133.47,897.71,"AFFIDAMENTO A LITOGRAFIA ZUCCHINI S.R.L. DELLA REALIZZAZIONE DEL MATERIALE DI ALLESTIMENTO PER LE MOSTRE PREVISTE NEGLI ULTIMI MESI DEL 2018 NELLE SEDI DEI MUSEI CIVICI D'ARTE ANTICA E CONTESTUALE IMPEGNO DI SPESA PER EURO 1.382,83.",23-AFFIDAMENTO DIRETTO,2018-11-26+01:00,2018-12-31+01:00,idm23280
766,Z3125E2A45,01232710374,Comune di Bologna,3934.43,3934.43,"AFFIDAMENTO A MG RESTAURO DI MARIELLA GNANI DEGLI INTERVENTI DI MANUTENZIONE E STUDIO SULLE TELE DI MORANDI. CONTESTUALE IMPEGNO DI SPESA DI EURO 4.800,00",23-AFFIDAMENTO DIRETTO,2018-11-22+01:00,2018-12-31+01:00,idm23297
767,Z7125D8CFF,01232710374,Comune di Bologna,1640.00,1640.00,"AFFIDAMENTO A D - SIGN S.R.L. DEL SERVIZIO DI MANUTENZIONE PERIODICA DEL SITO WEB DELL'AREA STORIA E MEMORIA E CONTESTUALE IMPEGNO DI SPESA DI EURO 2.000,80",23-AFFIDAMENTO DIRETTO,2018-11-20+01:00,2018-12-31+01:00,idm23314
768,Z642630C63,01232710374,Comune di Bologna,480.00,480.00,"AFFIDAMENTO A NCV NUOVA CAMP VELOCI DEL SERVIZIO DI FACCHINAGGIO PER TRASFERIMENTO AUTO ELETTRICA  E CONTESTUALE IMPEGNO DI SPESA DI EURO 585,60",23-AFFIDAMENTO DIRETTO,2018-12-07+01:00,2018-12-31+01:00,idm23331
769,Z2F261372A,01232710374,Comune di Bologna,2000.00,2000.00,"AFFIDAMENTO A MEC & PARTNERS S.R.L. DELLA STESURA DI UN DOCUMENTO DI PRESENTAZIONE PER IL SERVIZIO DI FUNDRAISING E DI PROMOZIONE DI ACCORDI DI PARTNERSHIP E CONTESTUALE IMPEGNO DI SPESA DI EURO 2.440,00",23-AFFIDAMENTO DIRETTO,2018-12-03+01:00,2018-12-31+01:00,idm23348
770,ZB1262F214,01232710374,Comune di Bologna,819.67,819.67,AFFIDAMENTO A FORNARI LUCIANO E C. DELLA FORNITURA DI SPILLINE PERSONALIZZATE PER IL PROGETTO DI RACCOLTA FONDI PRESSO LE SEDI DEL MAMBO E DEL MUSEO ARCHEOLOGICO,23-AFFIDAMENTO DIRETTO,2018-12-07+01:00,2018-12-31+01:00,idm23365
771,ZD825D9817,01232710374,Comune di Bologna,319.90,319.90,"AFFIDAMENTO A ARUBA BUSINESS S,R,L, DEL SERVIZIO DI ABBONAMENTO A DOMINI WEB PER IL MUSEO DEL RISORGIMENTO E CONTESTUALE IMPEGNO DI SPESA DI EURO 390,28",23-AFFIDAMENTO DIRETTO,2018-11-20+01:00,2018-12-31+01:00,idm23382
772,Z3025F1455,01232710374,Comune di Bologna,294.54,294.54,"AFFIDAMENTO ALLA DITTA N.M.P. S.R.L. DEL SERVIZIO DI RISTORAZIONE IN OCCASIONE DELL'INAUGURAZIONE DELLA MOSTRA WHATEVER THEY DO MAY IT ALL TURN OUT WRONG E CONTESTUALE IMPEGNO DI SPESA DI EURO 324,00",23-AFFIDAMENTO DIRETTO,2018-11-27+01:00,2018-12-31+01:00,idm23399
773,7683806D4A,01232710374,Comune di Bologna,78385.00,47392.50,PROCEDURA NEGOZIATA TRAMITE RICHIESTA DI OFFERTA SU SATER/INTERCENTER PER L'ACQUISIZIONE DEL SERVIZIO DI FACCHINAGGIO DAL 01.01.2019 AL 30.04.2019 NELLE MORE DI AGGIUDICAZIONE TRAMITE CONVENZIONE CONSIP SPA ED INTERCENT-ER,04-PROCEDURA NEGOZIATA SENZA PREVIA PUBBLICAZIONE,2019-01-01+01:00,2019-04-30+02:00,idm23416
774,Z5D262B438,01232710374,Comune di Bologna,1118.00,1118.00,"ADESIONE ALLA CONVENZIONE INTERCENT-ER 'PC NOTEBOOK 8' STIPULATA CON TEAM MEMORES COMPUTERS S.P.A. E IMPEGNO DELLA SPESA COMPLESSIVA DI EURO 1.363,96 PER ACQUISTO DI N. 1 NOTEBOOK PER MUSEO ARCHEOLOGICO E N. 1 NOTEBOOK PER MUSEO DELLA MUSICA.",23-AFFIDAMENTO DIRETTO,2018-12-06+01:00,2018-12-31+01:00,idm23581
775,ZB1259842A,01232710374,Comune di Bologna,34971.71,18514.46,"IMPEGNO DI SPESA PER IL SERVIZIO DI MANUTENZIONE DI CINQUE FONTANE UBICATE NEL CENTRO STORICO DELLA CITTA' DI BOLOGNA DELL'IMPORTO COMPLESSIVO DI EURO 50.000,00. AFFIDAMENTO ALLA SOCIETA' ARTE & RESTAURO S.R.L. DI RAVENNA PER UN IMPORTO DI EURO 42.66",04-PROCEDURA NEGOZIATA SENZA PREVIA PUBBLICAZIONE,,,idm23598
776,772393157F,01232710374,Comune di Bologna,3548125.00,997391.15,"Procedura aperta per l'affidamento dei seguenti lavori: ""Villa Salus: realizzazione nuovo edificio residenziale (progetto denominato S.A.L.U.S. W SPACE – UIA01-047)""",01-PROCEDURA APERTA,,,idm23613
777,Z6B26454C5,01232710374,Comune di Bologna,33425.00,33425.00,ACQUISTO DI PC DESKTOP MEDIANTE CONVENZIONE CONSIP,26-AFFIDAMENTO DIRETTO IN ADESIONE AD ACCORDO QUADRO/CONVENZIONE,,,idm23671
778,ZC2260502D,01232710374,Comune di Bologna,4761.90,4761.90,"AFFIDAMENTO DIRETTO CON CONTESTUALE IMPEGNO DI EURO 5.000,00.= ALLA OPEN GROUP SOCIETA' COOP SOCIALE O.N.L.U.S. PER LA REALIZZAZIONE DEL LABORATORIO 'TRASFORM'AZIONI...IN'MOVIMENTO' PRESSO LA ZONA PILASTRO.",23-AFFIDAMENTO DIRETTO,2019-01-01+01:00,2019-04-30+02:00,idm23686
779,Z652606EFF,01232710374,Comune di Bologna,700.00,700.00,AFFIDAMENTO DIRETTO ALL'ASSOCIAZIONE VIRGOLA PER LA REALIZZAZIONE DI UN LABORATORIO DI QUALIFICAZIONE SCOLASTICA A FAVORE DI ALUNNI IN SITUAZIONE DI DISAGIO SOCIALE,23-AFFIDAMENTO DIRETTO,2019-01-01+01:00,2019-04-30+02:00,idm23703
780,Z7025FD41B,01232710374,Comune di Bologna,1368.00,1368.00,INSERZIONE LA STAMPA PRU MANIFATTURA,23-AFFIDAMENTO DIRETTO,2018-11-28+01:00,2018-12-05+01:00,idm23720
781,ZF42616E39,01232710374,Comune di Bologna,680.00,680.00,INSERZIONE REPUBBLICA ED. BOLOGNA - EX CAMERA IPERBARICA,23-AFFIDAMENTO DIRETTO,2018-12-04+01:00,2018-12-07+01:00,idm23737
782,Z9D25AD2FF,01232710374,Comune di Bologna,6000.00,6002.00,"Realizzazione del corso di formazione ""Introduzione al Building Informatio Modelling (BIM) - Corso specialistico BIM & Appalti""",23-AFFIDAMENTO DIRETTO,2018-12-10+01:00,2018-12-31+01:00,idm23754
783,ZA725C93CE,01232710374,Comune di Bologna,8000.00,8002.00,Realizzazione di un percorso formativo di Capacity Building destinato agli Agenti del Cambiamento del Comune di Bologna.,23-AFFIDAMENTO DIRETTO,2018-12-10+01:00,2018-12-31+01:00,idm23771
784,Z3225D83DC,01232710374,Comune di Bologna,27500.00,26989.40,"AFFIDAMENTO A BOLOGNA SERVIZI FUNERARI SRL DELLA SOMMA DI EURO 27.500,00  PER LO SVOLGIMENTO, NEL CORSO DEL 2019, DEL SERVIZIO FUNERARIO NELL'AMBITO DEI FUNERALI SOCIALI.",23-AFFIDAMENTO DIRETTO,2019-01-01+01:00,2019-12-31+01:00,idm23788
785,7730840AFA,01232710374,Comune di Bologna,488402.70,0.00,Lavori di centralizzazione semaforica nell'ambito del programma strategico per la moblità nelle aree metropolitane,01-PROCEDURA APERTA,,,idm23805
786,ZC025F3C20,01232710374,Comune di Bologna,80.00,69.00,"AFFIDAMENTO ALLA DITTA M.Z. S.N.C. DEL SERVIZIO ANNUALE DI MANUTENZIONE DELLA CALDAIA DI CASA NATALI E CONTESTUALE IMPEGNO DELLA SPESA DI EURO 97,60",23-AFFIDAMENTO DIRETTO,2018-11-27+01:00,2018-12-31+01:00,idm23835
787,ZF425FFE8C,01232710374,Comune di Bologna,1954.09,1954.10,"AFFIDAMENTO A MERULA MARCO DELLA FORNITURA DI STRUMENTI MUSICALI  PER IL MUSEO DELLA MUSICA. CONTESTUALE IMPEGNO DI SPESA DI EURO 2.384,00",23-AFFIDAMENTO DIRETTO,2018-11-28+01:00,2018-12-31+01:00,idm23852
788,ZCA26300A9,01232710374,Comune di Bologna,405.00,405.00,"AFFIDAMENTO A C2 S.R.L. DELLA FORNITURA DI UN VIDEOPROIETTORE PER IL MUSEO DEL PATRIMONIO INDUSTRIALE. CONTESTUALE IMPEGNO DELLA SPESA DI EURO 494,10",23-AFFIDAMENTO DIRETTO,2018-12-07+01:00,2018-12-31+01:00,idm23869
789,ZC92653524,01232710374,Comune di Bologna,676.41,676.41,"AFFIDAMENTO A C2 S.R.L. DELLA FORNITURA DI TONER ORIGINALI PER STAMPANTE LASER COLORI RETE MAMBO. CONTESTUALE IMPEGNO DELLA SPESA DI EURO 825,22.",23-AFFIDAMENTO DIRETTO,2018-12-07+01:00,2018-12-31+01:00,idm23886
790,Z342644BD4,01232710374,Comune di Bologna,2957.00,2957.00,"ADESIONE ALLA CONVENZIONE INTERCENT-ER 'PC DESKTOP 8'. IMPEGNO DELLA SPESA COMPLESSIVA DI EURO 3.607,54 PER ACQUISTO DI PRODOTTI INFORMATICI PER VARIE SEDI DELL'ISTITUZIONE NELL'AMBITO DELLA CITATA CONVENZIONE.",23-AFFIDAMENTO DIRETTO,2018-12-10+01:00,2018-12-31+01:00,idm23903
791,ZF02529ABB,01232710374,Comune di Bologna,23300.00,23300.00,"REALIZZAZIONE DI UN VIDEOGIOCO FINALIZZATO ALLA VALORIZZAZIONE DEL PATRIMONIO STORICO, ARTISTICO E CULTURALE BOLOGNESE IN ATTUAZIONE DEL PROGETTO ROCK A SEGUITO DI ESPLETAMENTO DI RDO SU MEPA CONSIP.",23-AFFIDAMENTO DIRETTO,,,idm23920
792,Z6526307C1,01232710374,Comune di Bologna,550.00,550.00,"AFFIDAMENTO A SER DATA S.R.L. DEL SERVIZIO DI ASSISTENZA SOFTWARE SU ATTREZZATURE INFORMATICHE MAC MUSEO ARCHEOLOGICO. CONTESTUALE IMPEGNO DELLA SPESA DI EURO 671,00.",23-AFFIDAMENTO DIRETTO,2018-12-07+01:00,2018-12-31+01:00,idm23935
793,7690501231,01232710374,Comune di Bologna,87149.39,87149.39,"AFFIDAMENTO, A SEGUITO DI ESPLETAMENTO DI RDO, DELLA FORNITURA DI TELEFONI VOIP E RELATIVI ACCESSORI",22-PROCEDURA NEGOZIATA CON PREVIA INDIZIONE DI GARA (SETTORI SPECIALI),,,idm23952
794,Z15265794D,01232710374,Comune di Bologna,3900.00,3900.00,"AFFIDAMENTO DIRETTO ALLA SOCIETA' ADCOM S.R.L. PER LA FORNITURA DI MATERIALE VARIO PER L'ALLESTIMENTO DI UNO SPAZIO MULTIMEDIALE. IMPEGNO DI EURO 4.758,00 ONERI FISCALI INCLUSI",23-AFFIDAMENTO DIRETTO,,,idm23991
795,Z5425E26F5,01232710374,Comune di Bologna,1500.00,1500.00,ARPAE - CONVENZIONE PER ATTIVITA' DI MONITORAGGIO ACUSTICO.,26-AFFIDAMENTO DIRETTO IN ADESIONE AD ACCORDO QUADRO/CONVENZIONE,2018-12-04+01:00,2019-06-12+02:00,idm24006
796,Z5026530F6,01232710374,Comune di Bologna,523.69,523.69,"AFFIDAMENTO A FERRAMENTA OZZANESE S.N.C DELLA FORNITURA DI MATERIALE DI CONSUMO E ATTREZZATURA PER UFFICI. CONTESTUALE IMPEGNO DELLA SPESA DI EURO 638,90.",23-AFFIDAMENTO DIRETTO,2018-12-07+01:00,2018-12-31+01:00,idm24023
797,Z5C25E5732,01232710374,Comune di Bologna,0.00,5776.02,FORNITURA CARBURANTE METANO PER VEICOLI COMUNALI ANNO 2019,22-PROCEDURA NEGOZIATA CON PREVIA INDIZIONE DI GARA (SETTORI SPECIALI),2019-01-01+01:00,2109-12-31+01:00,idm24040
798,ZF325904D8,01232710374,Comune di Bologna,16845.89,7007.89,"INCARICO ALLA SOCIETA' PIACENTINI INGEGNERI S.R.L. NELLA PERSONA DELL' ING. LUCA PIACENTINI DI PROGETTAZIONE DEFINITIVA ED ESECUTIVA E DI COORDINATORE PER LA SICUREZZA IN FASE DI PROGETTAZIONE, NELL'AMBITO DEI LAVORI DI "" ATTUAZIONE PSSU - PUNTI NERI",04-PROCEDURA NEGOZIATA SENZA PREVIA PUBBLICAZIONE,2019-01-24+01:00,,idm24054
799,76533120DC,01232710374,Comune di Bologna,0.00,26097.18,FORNITURA CARBURANTE GPL PER VEICOLI COMUNALI ANNO 2019,22-PROCEDURA NEGOZIATA CON PREVIA INDIZIONE DI GARA (SETTORI SPECIALI),2019-01-01+01:00,2019-12-31+01:00,idm24070
800,ZAB2570152,01232710374,Comune di Bologna,0.00,35666.47,"APPROVAZIONE DEL PROGETTO ESECUTIVO PER I LAVORI DI RIQUALIFICAZIONE DELLA PISTA DI ATLETICA DEL CENTRO SPORTIVO BAUMANN SITO IN VIA BERTINI N. 9 - QUARTIERE SAN DONATO DELL'IMPORTO COMPLESSIVO DI EURO 48.558,40. AFFIDAMENTO ALLA SOCIETA' AVOLA SOCIE",04-PROCEDURA NEGOZIATA SENZA PREVIA PUBBLICAZIONE,,,idm24084
801,Z0E2550257,01232710374,Comune di Bologna,38071.00,37912.82,"APPROVAZIONE DEL PROGETTO ESECUTIVO PER I LAVORI DI RIQUALIFICAZIONE DEL CENTRO SPORTIVO PERTINI SITO IN VIA DELLA BATTAGLIA N.9 - QUARTIERE SAVENA - DELL' IMPORTO COMPLESSIVO DI EURO 48.500,00. AFFIDAMENTO ALLA DITTA TECNOPOSE S.R.L. PER L' IMPORTO",04-PROCEDURA NEGOZIATA SENZA PREVIA PUBBLICAZIONE,2019-01-17+01:00,,idm24096
802,ZDE262BF75,01232710374,Comune di Bologna,1000.00,1000.00,"REALIZZAZIONE DEL PROGETTO 'WELFARE DI COMUNITA' E ANZIANI FRAGILI, SUPPORTO AD INTERVENTI DI PREVENZIONE'",23-AFFIDAMENTO DIRETTO,,,idm24112
803,Z92265FA19,01232710374,Comune di Bologna,2459.00,3262.70,AFFIDAMENTO DEL SERVIZIO DI ASSISTENZA TECNICA E GUARDIANIA SALE DI QUARTIERE 1° SEMESTRE 2019,23-AFFIDAMENTO DIRETTO,,,idm24127
804,Z052624A24,01232710374,Comune di Bologna,38695.06,43574.40,"APPROVAZIONE DEL PROGETTO ESECUTIVO RELATIVO AI LAVORI PER LA REALIZZAZIONE DI LINEA VITA SUL CASSERO DI PORTA SANTO STEFANO PER PERMETTERE GLI INTERVENTI DI MANUTENZIONE IN SICUREZZA E IMPERMEABILIZZAZIONE DEL MANTO DI COPERTURA, DELL'IMPORTO COMPLE",03-PROCEDURA NEGOZIATA PREVIA PUBBLICAZIONE,,,idm24142
805,Z7F264E94F,01232710374,Comune di Bologna,2160.00,1440.00,AFFIDAMENTO ALL'ASSOCIAZIONE QUANTO BASTA DELLA REALIZZAZIONE DEL CORSO DI FORMAZIONE DAL TITOLO EMPOWERMENT MUSICALE - 2 LIVELLO,23-AFFIDAMENTO DIRETTO,,,idm24157
806,Z032562C61,01232710374,Comune di Bologna,15440.00,15440.00,"AGGIUDICAZIONE ALLA DITTA GIROTTO TENDE DI GIROTTO PIO DELLA FORNITURA ED INSTALLAZIONE DI 12 TENDE OCCORRENTI AD ALCUNI NIDI DI INFANZIA, SCUOLE DELL'INFANZIA E AD UN CENTRO BAMBINI E FAMIGLIE PER L'IMPORTO DI EURO 18.836,80 (ONERI FISCALI INCLUSI)",04-PROCEDURA NEGOZIATA SENZA PREVIA PUBBLICAZIONE,,,idm24172
807,7658110849,01232710374,Comune di Bologna,54800.00,32880.00,"ACQUISTO, CONVERSIONE, INSTALLAZIONE E CONFIGURAZIONE DI LICENZE SOFTWARE ""TABLEAU"" NELL'AMBITO DEL PON METRO 2014-2020 - ASSE 1 ""AGENDA DIGITALE METROPOLITANA"" - AZIONE BO1.1.1C ""DATI E BIG DATA ANALYTICS PER LA COMUNITA'""",22-PROCEDURA NEGOZIATA CON PREVIA INDIZIONE DI GARA (SETTORI SPECIALI),,,idm24187
808,ZEC2663C84,01232710374,Comune di Bologna,5370.00,5370.00,"AFFIDAMENTO DIRETTO, ART. 36 CO. 2 LETT. A) D. LGS 50/2016 TRAMITE TRATTATIVA DIRETTA SUL MEPA PE LA FORNITURA DI 6 CONGELATORI PER I NIDI COMUNALI.",23-AFFIDAMENTO DIRETTO,,,idm24205
809,Z07261F94D,01232710374,Comune di Bologna,9500.00,9500.00,SERVIZI FINALIZZATI ALLA DEFINIZIONE DI UN PIANO STRATEGICO SULLA CULTURA.,23-AFFIDAMENTO DIRETTO,2018-12-18+01:00,2018-12-31+01:00,idm24220
810,Z3F26643D0,01232710374,Comune di Bologna,1875.00,1875.00,"SERVIZI DI GRAFICA PER LE ATTIVITA' DI COMUNICAZIONE NELL'AMBITO DEL PROGETTO ""L'EUROPA VIENE DA TE"".",23-AFFIDAMENTO DIRETTO,,,idm24237
811,Z762664CC1,01232710374,Comune di Bologna,5450.00,5450.00,FORNITURA DI 2 PC CON CARATTERISTICHE TECNICHE PARTICOLARI PER LA VISUALIZZAZIONE DELLE IMMAGINI DELLE TELECAMERE DI VIDEOSORVEGLIANZA DEL COMUNE DI BOLOGNA,04-PROCEDURA NEGOZIATA SENZA PREVIA PUBBLICAZIONE,,,idm24252
812,7740291233,01232710374,Comune di Bologna,61889.16,60311.81,Lavori d ristrutturazione degli spogliatoi della palestra delle scuole Saffi in via Panzini 1/2,01-PROCEDURA APERTA,,,idm24267
813,Z83259A2E8,01232710374,Comune di Bologna,24386.00,24386.00,FORFNITURA DI 8 ESSICCATOI ELETTRICI PER I NIDI DEL COMUNE DI BOLOGNA,04-PROCEDURA NEGOZIATA SENZA PREVIA PUBBLICAZIONE,,,idm24361
814,7691482BBA,01232710374,Comune di Bologna,0.00,30.00,"DETERMINAZIONE A CONTRARRE RELATIVA ALL'AFFIDAMENTO DEL SERVIZIO DI RACCOLTA, CARICO, SCARICO, TRASPORTO E CONFERIMENTO DI RIFIUTI DI VARIA NATURA GIACENTI IN AREA DI VIA DEL PILASTRO, BOLOGNA  SPESA COMPLESSIVA DI EURO 89.995,01  (ONERI FISCALI INCL",02-PROCEDURA RISTRETTA,2018-11-20+01:00,2018-12-31+01:00,idm24376
815,ZFA2518408,01232710374,Comune di Bologna,38734.00,18400.00,"IMPEGNO DI SPESA PER IL SERVIZIO DI RIMOZIONE DI POLVERI LUNGO I PORTICI DEL CENTRO STORICO DI BOLOGNA DELL'IMPORTO COMPLESSIVO DI EURO 50.000,00. AFFIDAMENTO ALLA SOCIETA' ENVIREM S.R.L. DI MARCO MEZZINI DI BOLOGNA PER UN IMPORTO COMPLESSIVO DI EURO",04-PROCEDURA NEGOZIATA SENZA PREVIA PUBBLICAZIONE,,,idm24390
816,Z51259FF52,01232710374,Comune di Bologna,14460.49,15038.91,"INCARICO ALL' ING. CLAUDIO CONTINI DI SUPPORTO AL RUP NELLE ATTIVITA' SPECIALISTICHE PROPEDEUTICHE ALLA PROGETTAZIONE DEI LAVORI DI AMMODERNAMENTO E RIQUALIFICAZIONE IMPIANTI SPORTIVI, CONSOLIDAMENTO STRUTTURALE E RIQUALIFICAZIONE PALA DOZZA, BOLOGNA",04-PROCEDURA NEGOZIATA SENZA PREVIA PUBBLICAZIONE,,,idm24405
817,ZDB258B7C8,01232710374,Comune di Bologna,34587.00,27198.52,"APPROVAZIONE PROGETTO ESECUTIVO RELATIVO AI LAVORI DI INSTALLAZIONE DEL SISTEMA VIDEOSORVEGLIANZA A CARATTERE CITTADINO ALL INTERNO DEL GIARDINO PIOPPETO MATTEI A BOLOGNA PER UN IMPORTO COMPLESSIVO DI EURO 39.947,00. IMPEGNO DI SPESA PER L'IMPORTO DI",04-PROCEDURA NEGOZIATA SENZA PREVIA PUBBLICAZIONE,,,idm24420
818,Z2E2616DCD,01232710374,Comune di Bologna,38770.21,31778.86,"IMPEGNO DI SPESA  PER UN IMPORTO COMPLESSIVO DI EURO 39,939,78 E CONTESTUALE AFFIDAMENTO ALLA DITTA B.M. SRL DEI LAVORI A MISURA PER LA REALIZZAZIONE DI LINEA VITA SU PORZIONE DEL SOLAIO DI COPERTURA DI PALAZZO ACCURSIO (LATO PROSPICIENTE VIA VENEZIA",04-PROCEDURA NEGOZIATA SENZA PREVIA PUBBLICAZIONE,,,idm24435
819,Z3925A765A,01232710374,Comune di Bologna,36974.30,30306.80,"IMPEGNO DI SPESA PER UN IMPORTO DI EURO 37.600,43 E CONTESTUALE ADDIFAMENTO ALLA DITTA S.I.E.B.O. SRL DEI LAVORI URGENTI A MISURA PER DOTARE DI AUTOMATISMI ELETTRICI I SERRAMENTI ESTERNI DELLE SCUOLE SAVIO A BOLOGNA PER UN IMPORTO COMPLESSIVO DI EURO",04-PROCEDURA NEGOZIATA SENZA PREVIA PUBBLICAZIONE,2019-01-17+01:00,2019-01-28+01:00,idm24450
820,Z3725C7D76,01232710374,Comune di Bologna,45872.00,32632.54,"APPROVAZIONE PROGETTO ESECUTIVO RELATIVO AI LAVORI DI RIQUALIFICAZIONE CENTRO SPORTIVO BERNARDI DI VIA DEGLI ORTI 60 PER UN IMPORTO COMPLESSIVO DI EURO 48.825,00. IMPEGNO DI SPESA PER UN IMPORTO DI EURO 46.659,50 E CONTESTUALE AFFIDAMENTO ALLA DITTA",04-PROCEDURA NEGOZIATA SENZA PREVIA PUBBLICAZIONE,,,idm24467
821,Z1125C752E,01232710374,Comune di Bologna,47787.40,39167.01,"APPROVAZIONE PROGETTO ESECUTIVO DEI LAVORI DI MESSA IN SICUREZZA ALL' INTERNO DELLA PISCINA COMUNALE CARMEN LONGO DA 25 MT IN VIA DELLO SPORT 6 PER UN IMPORTO COMPLESSIVO DI EURO 49.575,20. IMPEGNO DI SPESA PER UN IMPORTO DI EURO 48.587,00 E CONTESTU",04-PROCEDURA NEGOZIATA SENZA PREVIA PUBBLICAZIONE,,,idm24482
822,ZA125F2801,01232710374,Comune di Bologna,20000.00,20000.00,"AFFIDAMENTO ALLA DITTA TELECOM ITALIA SPA DEL SERVIZIO DI RILEVAMENTO E ANALISI DI PRESENZA E MOBILITA' DELLA POPOLAZIONE DENOMINATO ""TIM CITY FORECAST"", TRAMITE ORDINE DIRETTO SUL MEPA AI SENSI DELL'ART. 36 COMMA 2 LETT.a) D.LGS. 50/2016.",23-AFFIDAMENTO DIRETTO,,,idm24497
823,Z27262DE88,01232710374,Comune di Bologna,373.50,373.50,RINNOVO ABBONAMENTI CARTACEI ANNO 2019,23-AFFIDAMENTO DIRETTO,2019-01-01+01:00,2019-12-31+01:00,idm24512
824,Z8B262DF03,01232710374,Comune di Bologna,755.00,755.00,Rinnovo abbonamenti cartacei 2019 FORO ITALIANO,23-AFFIDAMENTO DIRETTO,2019-01-01+01:00,2019-12-31+01:00,idm24529
825,Z9B262E062,01232710374,Comune di Bologna,232.00,232.00,Rinnovo abbonamenti cartacei 2019,23-AFFIDAMENTO DIRETTO,2019-01-01+01:00,2019-12-31+01:00,idm24546
826,Z3E262E0CF,01232710374,Comune di Bologna,252.00,252.00,Rinnovo abbonamento cartaceo 2019,23-AFFIDAMENTO DIRETTO,2019-01-01+01:00,2019-12-31+01:00,idm24563
827,Z8C262E13E,01232710374,Comune di Bologna,468.00,450.00,Rinnovo abbonamento on line 2019 Lexitalia,23-AFFIDAMENTO DIRETTO,2019-04-01+02:00,2019-03-31+02:00,idm24580
828,ZB7266A9C5,01232710374,Comune di Bologna,32750.00,32750.00,"ACQUISTO  DI UN PERMUTATORE TELEFONICO, DI CAVI, DI GIUNTI DI COLLEGAMENTO E RELATIVI SERVIZI TECNICI",04-PROCEDURA NEGOZIATA SENZA PREVIA PUBBLICAZIONE,,,idm24597
829,ZBE25E36C8,01232710374,Comune di Bologna,12500.00,15000.00,"AFFIDAMENTO DIRETTO, TRAMITE TRATTATIVA DIRETTA DI ACQUISTO SUL MEPA, ALLA DITTA IL SOLE 24 ORE SPA DI MILANO DEL SERVIZIO DI PUBBLICAZIONE LEGALE SU QUOTIDIANI A DIFFUSIONE NAZIONALE E LOCALE. IMPEGNO DEI SPESA DI EURO 15.250,00 PER L'ANNO 2019.",04-PROCEDURA NEGOZIATA SENZA PREVIA PUBBLICAZIONE,,,idm24612
830,ZDB2665654,01232710374,Comune di Bologna,590.00,590.00,"AFFIDAMENTO ALLA SOCIETA' ES FIELD DELIVERY ITALIA SRL DI UN INTERVENTO DI RIPARAZIONE DI UNA STAMPANTE IN USO PRESSO IL QUARTIERE SANTO STEFANO PER UN IMPORTO DI EURO 719,80 IVA INCLUSA",23-AFFIDAMENTO DIRETTO,,,idm24627
831,768307413D,01232710374,Comune di Bologna,199000.00,74625.00,Acquisizione della piattaforma collaborativa Google Suite e dei connessi servizi informatici di assistenza,22-PROCEDURA NEGOZIATA CON PREVIA INDIZIONE DI GARA (SETTORI SPECIALI),,,idm24642
832,7739449B59,01232710374,Comune di Bologna,129293.90,225.00,"Bando di gara per l'affidamento dei: ""Lavori di riqualificazione orti urbani in Via Erbosa - Q.re Navile -  Costruzione sede e capanno per  attrezzi  orti"".",01-PROCEDURA APERTA,,,idm24657
833,Z2425BFAD7,01232710374,Comune di Bologna,5553.60,5775.74,"INCARICO ALL'ARCH. VALENTINA BARONCINI PER L'AGGIORNAMENTO DEL CATASTO PLANIMETRICO DEGLI IMPIANTI SEMAFORICI COMUNALI, PER L'IMPORTO COMPLESSIVO DI EURO 7.046,40 (INCLUSI ONERI PREVIDENZIALI E FISCALI)",04-PROCEDURA NEGOZIATA SENZA PREVIA PUBBLICAZIONE,,,idm24728
834,ZDB2526BE4,01232710374,Comune di Bologna,36233.00,35504.02,"IMPEGNO DI SPESA DI COMPLESSIVI EURO 45.722,75 E CONTESTUALE AFFIDAMENTO ALLA ELLEDI COSTRUZIONI DI BOLOGNA DEI LAVORI RELATIVI ALL'ADEGUAMENTO NORMATIVO ANTINCENDIO ALL'INTERNO DELLA SCUOLA MATERNA E PRIMARIA ALDO MORO IN VIA SANTORRE DI SANTAROSA P",04-PROCEDURA NEGOZIATA SENZA PREVIA PUBBLICAZIONE,,,idm24743
835,774618306F,01232710374,Comune di Bologna,2854901.02,410208.12,PRESTAZIONE DI SERVIZI NELL'AMBITO DEI SISTEMI GESTIONALI INTEGRATI PER LA PA,26-AFFIDAMENTO DIRETTO IN ADESIONE AD ACCORDO QUADRO/CONVENZIONE,,,idm24758
836,7740921A15,01232710374,Comune di Bologna,191688.18,38562.64,"Lavori di risanamento conservativo e riqualificazione energetica della Biblioteca A. Cabral, sita in via San Mamolo 24 Bologna",01-PROCEDURA APERTA,,,idm24795
837,ZD625E3081,01232710374,Comune di Bologna,5021.52,5021.52,"AFFIDAMENTO A FINE ART COMPANY MARTINSPEED LTD DEL SERVIZIO DI TRASPORTO DI DUE OPERE PER LA MOSTRA ""MIKA ROTTENBERG"", MAMBO. CONTESTUALE IMPEGNO DI SPESA DI EURO 5.500,00",23-AFFIDAMENTO DIRETTO,2018-12-13+01:00,2019-05-30+02:00,idm24979
838,ZE42672C89,01232710374,Comune di Bologna,3840.00,3840.00,"AFFIDAMENTO DIRETTO ALLA SOCIETA' BERTA GRANDI IMPIANTI DELLA  FORNITURA DI ADDOLCITORI DA COLLOCARE NEI NIDI DI INFANZIA . IMPEGNO DI EURO 4.684,80 ONERI FISCALI INCLUSI",23-AFFIDAMENTO DIRETTO,,,idm24996
839,Z0E2611AA9,01232710374,Comune di Bologna,1639.34,1199.82,"AFFIDAMENTO A E FLUX DELLA PROMOZIONE PUBBLICITARIA PER LA MOSTRA MIKKA ROTTEMBERG  E CONTESTUALE IMPEGNO DI SPESA DI EURO 2.000,00",23-AFFIDAMENTO DIRETTO,,,idm25011
840,ZC32658BC4,01232710374,Comune di Bologna,2459.02,2459.02,"AFFIDAMENTI DIVERSI PER INTERVENTI DI RESTAURO E MANUTENZIONE CONSERVATIVA DI OPERE DELLE COLLEZIONI E DI SPAZI DELL'ISTITUZIONE BOLOGNA MUSEI. CONTESTUALI IMPEGNI DI SPESA DI COMPLESSIVI EURO 6.735,94",23-AFFIDAMENTO DIRETTO,,,idm25026
841,ZB62663DA6,01232710374,Comune di Bologna,1639.34,1639.34,"AFFIDAMENTI DIVERSI PER INTERVENTI DI RESTAURO E MANUTENZIONE CONSERVATIVA DI OPERE DELLE COLLEZIONI E DI SPAZI DELL'ISTITUZIONE BOLOGNA MUSEI. CONTESTUALI IMPEGNI DI SPESA DI COMPLESSIVI EURO 6.735,94",23-AFFIDAMENTO DIRETTO,,,idm25041
842,ZD42658D68,01232710374,Comune di Bologna,1009.84,1009.84,"AFFIDAMENTI DIVERSI PER INTERVENTI DI RESTAURO E MANUTENZIONE CONSERVATIVA DI OPERE DELLE COLLEZIONI E DI SPAZI DELL'ISTITUZIONE BOLOGNA MUSEI. CONTESTUALI IMPEGNI DI SPESA DI COMPLESSIVI EURO 6.735,94",23-AFFIDAMENTO DIRETTO,,,idm25056
843,7665426DA2,01232710374,Comune di Bologna,81786.88,35910.47,"AFFIDAMENTO DELLA FORNITURA DI PERIODICI ITALIANI E STRANIERI IN ABBONAMENTO PER L'ISTITUZIONE BIBLIOTECHE  DEL COMUNE DI BOLOGNA PER GLI ANNI 2019 E 2020 ALLA DITTA CELDES S.R.L. DI ROMA PER L'IMPORTO COMPLESSIVO DI SPESA DI EURO 81.800,00",04-PROCEDURA NEGOZIATA SENZA PREVIA PUBBLICAZIONE,2019-01-01+01:00,2020-12-31+01:00,idm25071
844,Z922658C49,01232710374,Comune di Bologna,413.06,413.06,"AFFIDAMENTI DIVERSI PER INTERVENTI DI RESTAURO E MANUTENZIONE CONSERVATIVA DI OPERE DELLE COLLEZIONI E DI SPAZI DELL'ISTITUZIONE BOLOGNA MUSEI. CONTESTUALI IMPEGNI DI SPESA DI COMPLESSIVI EURO 6.735,94",23-AFFIDAMENTO DIRETTO,,,idm25088
845,ZDF26639FE,01232710374,Comune di Bologna,1100.00,1100.00,"AFFIDAMENTO DIRETTO, AI SENSI DELL'ART. 36 COMMA 2, LETT. A) DEL D.LGS. N. 50/2016, DEL SERVIZIO DI EROGAZIONE DEL CORSO DI FORMAZIONE DAL TITOLO ""PRIMO SOCCORSO: MANOVRE DI DISOSTRUZIONE IN ETA' PEDIATRICA"" A FAVORE DELL'ASSOCIAZIONE A.N.P.A.S. EMIL",23-AFFIDAMENTO DIRETTO,,,idm25103
846,Z772645029,01232710374,Comune di Bologna,1440.00,1440.00,"AFFIDAMENTO A PANCALDI E C. S.A.S DELLA FORNITURA DI ARREDI PER LA BIBLIOTECA DEL MAMBO COSTITUZIONE IMPEGNO DI SPESA PER EURO 1.756,80 E CONTESTUALE RIDUZIONE DELL'IMPEGNO DI SPESA N.318004358/2018",23-AFFIDAMENTO DIRETTO,,,idm25118
847,Z96264597F,01232710374,Comune di Bologna,2550.00,2550.00,"AFFIDAMENTO A TIPOGRAFIA ALTEDO S.R.L. DELLA STAMPA DELL'INSTANT BOOK PER LA MOSTRA MIKA ROTTEMBERG E CONTESTUALE IMPEGNO DI SPESA DI EURO 1.934,40",23-AFFIDAMENTO DIRETTO,,,idm25133
