n,cig,strutturaProponente:codiceFiscaleProp,strutturaProponente:denominazione,importoAggiudicazione,importoSommeLiquidate,oggetto,sceltaContraente,tempiCompletamento:dataInizio,tempiCompletamento:dataUltimazione,lottoID
1529,Z1F286C831,01232710374,Comune di Bologna,3252.10,3252.10,"AFFIDAMENTO  ALLA DITTA GIRO S.N.C, DI MARZOLINI GIORGIO & C. DI FORLIMPOPOLI (FC) DELLA FORNITURA DI ARTICOLI PROMOZIONALI PERSONALIZZATI DESTINATI AL BOOKSHOP DEL TEATRO ANATOMICO PRESSO LA BIBLIOTECA  COMUNALE DELL'ARCHIGINNASIO E CONTESTUALE IMPE",23-AFFIDAMENTO DIRETTO,2019-05-20+02:00,2019-06-19+02:00,idm36561
1530,Z8328238EF,01232710374,Comune di Bologna,400.00,400.00,ABBONAMENTO A BANCA DATI PER SCARICARE AUDIOLIBRI - SEZIONE ADULTI E RAGAZZI 2019 - ORDINE 4500107296 - BIBLIOTECA SALA BORSA,23-AFFIDAMENTO DIRETTO,2019-04-19+02:00,2019-12-31+01:00,idm36578
1531,ZD7283584D,01232710374,Comune di Bologna,245.90,245.90,"AFFIDAMENTO A CENTRO LAVANDERIA S.R.L. DEL SERVIZO DI LAVANDERIA PER CASA NATALI NELL' ANNO 2019. CONTESTUALE IMPEGNO DELLA SPESA DI EURO 300,00.",23-AFFIDAMENTO DIRETTO,2019-04-30+02:00,2019-12-31+01:00,idm36595
1532,ZC82867648,01232710374,Comune di Bologna,1250.00,1202.81,"AUTORIZZAZIONE ALLA SPESA COMPLESSIVA DI EURO 4.794,60 PER CAMPAGNA PUBBLICITARIA MOSTRA JULIAN CHARRIERE AL MAMBO. CONTESTUALI IMPEGNI DI SPESA",23-AFFIDAMENTO DIRETTO,2019-05-14+02:00,2019-09-08+02:00,idm36612
1533,ZF1286768C,01232710374,Comune di Bologna,800.00,800.00,"AUTORIZZAZIONE ALLA SPESA COMPLESSIVA DI EURO 4.794,60 PER CAMPAGNA PUBBLICITARIA MOSTRA JULIAN CHARRIERE AL MAMBO. CONTESTUALI IMPEGNI DI SPESA",23-AFFIDAMENTO DIRETTO,2019-05-14+02:00,2019-09-08+02:00,idm36629
1534,ZDC28546D3,01232710374,Comune di Bologna,1880.00,1800.00,"AUTORIZZAZIONE ALLA SPESA COMPLESSIVA DI EURO 4.794,60 PER CAMPAGNA PUBBLICITARIA MOSTRA JULIAN CHARRIERE AL MAMBO. CONTESTUALI IMPEGNI DI SPESA",23-AFFIDAMENTO DIRETTO,2019-05-14+02:00,2019-09-08+02:00,idm36646
1535,ZDC2871791,01232710374,Comune di Bologna,6170.00,6170.00,"AFFIDAMENTO A GRUPPO N.N. S.R.L. DEL SERVIZIO DI ALLESTIMENTO STRUTTURALE PRESSO LA SEDE DEL MAMBO IN OCCASIONE DELLA MOSTRA DEDICATA A JULIAN CHARRIERE. CONTESTUALE IMPEGNO DI SPESA DI EURO 5.490,00",23-AFFIDAMENTO DIRETTO,2019-05-16+02:00,2019-09-08+02:00,idm36663
1536,Z17283ED8C,01232710374,Comune di Bologna,2380.00,2380.00,"CESSIONE DI DIRITTI D'AUTORE DA PARTE DI ELISABETTA ZONI PER LE TRADUZIONI IN ITALIANO DEI TESTI INSERITI NEL VOLUME 'COME ERAVAMO ABITUATI A GALLEGGIARE'. CONTESTUALI IMPEGNI DI SPESA DI EURO 1.960,00 E DI EURO 294,00 PER LA RITENUTA D'ACCONTO.",23-AFFIDAMENTO DIRETTO,2019-05-03+02:00,2019-06-03+02:00,idm36680
1537,Z4D2744F0B,01232710374,Comune di Bologna,38641.26,0.00,"SERVIZIO DI PROGETTAZIONE ESECUTIVA E COORDINAMENTO DELLA SICUREZZA IN FASE DI PROGETTAZIONE RELATIVO A LAVORI DI POTENZIAMENTO DEI SISTEMI DI VIDEOSORVEGLIANZA DELLE PIAZZE E DELLE PORTE DELLA CITTA' DI BOLOGNA. IMPEGNO DI SPESA DI EURO 47.142,34 (O",04-PROCEDURA NEGOZIATA SENZA PREVIA PUBBLICAZIONE,,,idm36697
1538,7913388E59,01232710374,Comune di Bologna,368677.75,225.00,Programma Straordinario di Intervento per la riqualificazione urbana e la sicurezza delle periferie di cui alla L. 208/2015 art 1 co 974-978: Progetto di ristrutturazione edilizia finalizzato al consolidamento strutturale e adeguamento normativo e fu,01-PROCEDURA APERTA,,,idm36712
1539,ZBD2884219,01232710374,Comune di Bologna,2825.00,2825.00,Aquisto di n. 5 lampeggianti magnetici con sirena integrata,23-AFFIDAMENTO DIRETTO,2019-06-04+02:00,2019-08-02+02:00,idm37010
1540,ZB528750B5,01232710374,Comune di Bologna,832.10,832.10,"AFFIDAMENTO ALLA DITTA PARTENUFFICIO DI FENIZIA ANTONIO SRL  DI NAPOLI PER L'ACQUISTO DI PRESIDI DI SICUREZZA E MATERIALI ELETTRICI PER LE BIBLIOTECHE DELL'ISTITUZIONE DEL COMUNE DI BOLOGNA PER L'IMPORTO COMPLESSIVO DI EURO 1.015,16 CON CONTESTUALE I",23-AFFIDAMENTO DIRETTO,,,idm37027
1541,Z9C2859F77,01232710374,Comune di Bologna,409.84,409.84,"AFFIDAMENTO ALLA DITTA BM SERVICE S.R.L. DI BOLOGNA PER LA FORNITURA DI SCHEDE PREPAGATE PER FOTOCOPIATORI OCCORRENTI ALL'ISTITUZIONE BIBLIOTECHE  DEL COMUNE DI BOLOGNA E CONTESTUALE COSTITUZIONE DI IMPEGNO PER L'IMPORTO DI EURO 500,00.",23-AFFIDAMENTO DIRETTO,,,idm37042
1542,79103757F3,01232710374,Comune di Bologna,2277044.20,0.00,GARA EUROPEA A PROCEDURA APERTA PER L’APPALTO RELATIVO ALL’AGGIUDICAZIONE DEI SERVIZI AUSILIARI PER L’ATTIVITÀ MUSEALE DELL’ISTITUZIONE BOLOGNA MUSEI. PERIODO 1 NOVEMBRE 2019 – 20 DICEMBRE 2021,01-PROCEDURA APERTA,,,idm37057
1543,7913002FCF,01232710374,Comune di Bologna,2059390.00,0.00,Gruppi  educativi per bambini dai 6 agli 11 anni e per ragazzi dagli 11 ai 18 anni,01-PROCEDURA APERTA,,,idm37102
1544,791300524D,01232710374,Comune di Bologna,460356.20,9151.20,Centri di aggregazione per ragazze e ragazzi dagli 11 ai 18 anni,01-PROCEDURA APERTA,,,idm37131
1545,791301173F,01232710374,Comune di Bologna,882767.60,14091.00,Educativa di strada per ragazzi e ragazze dagli 11 ai 18 anni,01-PROCEDURA APERTA,,,idm37152
1546,Z4D2821CA7,01232710374,Comune di Bologna,2200.00,2200.00,"AFFIDAMENTO ALLA DITTA ZEROSEIUP S.R.L. DELLA FORNITURA DI PUBBLICAZIONI NON PERIODICHE ITALIANE PER L'IMPORTO COMPLESSIVO DI EURO 2.200,00",23-AFFIDAMENTO DIRETTO,2019-05-10+02:00,2019-07-08+02:00,idm37177
1547,7918016980,01232710374,Comune di Bologna,79987.31,8617.64,APPALTO DEL SERVIZIO DI MANUTENZIONE DELLE ATTREZZATURE DA CUCINA E LAVANDERIA DEI NIDI DI INFANZIA PER IL PERIODO 1 AGOSTO 2019 - 31 AGOSTO 2021.,04-PROCEDURA NEGOZIATA SENZA PREVIA PUBBLICAZIONE,,,idm37194
1548,ZE727C8193,01232710374,Comune di Bologna,814.00,814.00,ACQUISTO N. 50 CRAVATTE PER I CERIMONIERI,23-AFFIDAMENTO DIRETTO,,,idm37209
1549,Z46284641B,01232710374,Comune di Bologna,6500.00,6500.00,"AFFIDAMENTO ALL'IMPRESA CUCINANDO SRLS, DELLA FORNITURA DI N. 2 ESSICCATOI ELETTRICI DA DESTINARE AI NIDI D'INFANZIA ""BIGARI"" E ""DOREMI"" DEL COMUNE DI BOLOGNA, MEDIANTE IL MERCATO ELETTRONICO DI CONSIP (MEPA).",23-AFFIDAMENTO DIRETTO,,,idm37224
1550,ZC22849246,01232710374,Comune di Bologna,1300.00,640.00,FORNITURA QUOTIDIANI GABINETTO DEL SINDACO,23-AFFIDAMENTO DIRETTO,,,idm37239
1551,Z3A28492E0,01232710374,Comune di Bologna,1800.00,1132.30,FORNITURA QUOTIDIANI UFFICIO STAMPA,23-AFFIDAMENTO DIRETTO,,,idm37254
1552,Z34288E91C,01232710374,Comune di Bologna,5695.28,5695.28,ACQUISTO ACCESSORI DI RICAMBIO PER RADIO PORTATILI,23-AFFIDAMENTO DIRETTO,2019-06-19+02:00,2019-09-09+02:00,idm37269
1553,Z102867C93,01232710374,Comune di Bologna,490.00,490.00,"ABBONAMENTI AL QUOTIDIANO CARTA +DIGITALE ""IL SOLE 24 ORE"" E AL ""QUOTIDIANO DIGITALE DEGLI ENTI LOCALI E DELLA PA"" PER L'ANNO 2019,",23-AFFIDAMENTO DIRETTO,2019-06-24+02:00,2020-06-23+02:00,idm37286
1554,Z09285061C,01232710374,Comune di Bologna,700.00,700.00,FONDAZIONE LEGAMBIENTE - PULIAMO IL MONDO 2019,23-AFFIDAMENTO DIRETTO,2019-09-20+02:00,2019-09-22+02:00,idm37303
1555,0000000000,01232710374,Comune di Bologna,45403.74,0.00,"APPROVAZIONE DELL'ULTERIORE SPESA DI EURO 55.392,56= PER ESTENSIONE DELLE PRESTAZIONI NECESSARIE ALLO SVOLGIMENTO DELLE CONSULTAZIONI ELETTORALI DEL 26 MAGGIO 2019 - ELEZIONE DEI MEMBRI DEL PARLAMENTO EUROPEO, NELL'AMBITO DEL SERVIZIO PLURIENNALE DI",23-AFFIDAMENTO DIRETTO,,,idm37320
1556,Z062873912,01232710374,Comune di Bologna,20670.00,20670.00,"AFFIDAMENTO A WILDLAB MULTIMEDIA DI FABRIZIO PIZZULO DELLA REALIZZAZIONE DI DUE VIDEO PROMOZIONALI PER IL MUSEO DEL PATRIMONIO INDUSTRIALE E PER LA CERTOSA. CONTESTUALE IMPEGNO DI SPESA DI EURO 25.217,40",23-AFFIDAMENTO DIRETTO,2019-05-17+02:00,2019-06-30+02:00,idm37335
1557,ZFA282EA1E,01232710374,Comune di Bologna,522.60,522.60,FORNITURA DI ETICHETTE NECESSARIE PER LE ATTIVITA' DI NOTIFICA DEI MESSI COMUNALI,03-PROCEDURA NEGOZIATA PREVIA PUBBLICAZIONE,,,idm37352
1558,Z1528911C7,01232710374,Comune di Bologna,10950.00,10950.00,"AGGIORNAMENTI DELLA PIATTAFORMA INFORMATICA ""TIMBRO DIGITALE 2D-PLUS"" PER L'ANNO 2019",23-AFFIDAMENTO DIRETTO,,,idm37367
1559,Z702854335,01232710374,Comune di Bologna,296.23,296.23,FORNITURA DI MATERIALE PER IL REINTEGRO DELLE CASSETTE DI PRONTO SOCCORSO - ORDINE 4500107441 - ISTIYUZIONE BIBLIOTECHE,23-AFFIDAMENTO DIRETTO,2019-05-22+02:00,2019-06-21+02:00,idm37382
1560,ZCF282C218,01232710374,Comune di Bologna,1146.08,1102.00,acqusito abbonamento foro italiano on line,23-AFFIDAMENTO DIRETTO,2019-07-01+02:00,2020-06-30+02:00,idm37399
1561,Z312881099,01232710374,Comune di Bologna,483.12,396.00,ACQUISTO RINNOVO N. 6 POSTAZIONI CONSOLLE AVVOCATO,23-AFFIDAMENTO DIRETTO,2019-06-11+02:00,2020-06-10+02:00,idm37416
1562,ZF1285BF33,01232710374,Comune di Bologna,130.04,120.55,"AFFIDAMENTO A BIBLIO' DI ISABELLA CARDINALI DELL'OSPITALITA' PER CONFERENZIERI DEL MUSEO MEDIEVALE. CONTESTUALE IMPEGNO DI SPESA DI EURO 148,48",23-AFFIDAMENTO DIRETTO,2019-05-10+02:00,2019-05-25+02:00,idm37433
1563,Z52288C804,01232710374,Comune di Bologna,500.00,500.00,"AFFIDAMENTO AD AON S.P.A. DEL SERVIZIO DI COPERTURA ASSICURATIVA DELLE OPERE ESPOSTE PER LA MOSTRA DI JULIAN CHARRIERE AL MAMBO POLIZZA N.IT00014402SP18A. CONTESTUALE IMPEGNO DI SPESA DI EURO 500,00 ONERI FISCALI INCLUSI.",23-AFFIDAMENTO DIRETTO,2019-05-23+02:00,2019-09-20+02:00,idm37450
1564,Z352891776,01232710374,Comune di Bologna,11020.67,10866.67,Acquisto di n. 200 cuffie e n. 200 cavi di acciaio con lucchetto per notebook necessari per lo smart working e n. 3 certificati SSL.,23-AFFIDAMENTO DIRETTO,,,idm37467
1565,Z92289CE62,01232710374,Comune di Bologna,2082.00,2080.00,ACQUISTO CANE PASTORE TEDESCO PER UNITA' CINOFILA CORPO POLIZIA LOCALE,23-AFFIDAMENTO DIRETTO,2019-05-29+02:00,2019-07-22+02:00,idm37482
1566,Z92243C974,01232710374,Comune di Bologna,8347.50,0.00,"INCARICO ALL'ING. FRIEDRICH DROLLMANN DI BOLOGNA DI DIREZIONE OPERATIVA STRUTTURE RELATIVA AI LAVORI DI ""RISTRUTTURAZIONE E RECUPERO FUNZIONALE DELL'EDIFICIO SITO IN VIA FANTONI N. 47"" NELL'AMBITO DEL PROGETTO DENOMINATO ""PROGRAMMA STRAORDINARIO DI I",04-PROCEDURA NEGOZIATA SENZA PREVIA PUBBLICAZIONE,,,idm37499
1567,7923703E8E,01232710374,Comune di Bologna,145430.00,145430.00,ADESIONE ALLA CONVENZIONE INTERCENT-ER 'PC NOTEBOOK 8' STIPULATA CON TEAM MEMORES COMPUTERS S.P.A. PER ACQUISTO DI NOTEBOOK PER LO SMART WORKING E PER ESIGENZE DI DIVERSI SETTORI DEL COMUNE DI BOLOGNA,26-AFFIDAMENTO DIRETTO IN ADESIONE AD ACCORDO QUADRO/CONVENZIONE,,,idm37514
1568,7919643825,01232710374,Comune di Bologna,0.00,0.00,"Acquisizione di servizi per la governance e la gestione dello spazio polivalente ""Bacchelli"" di cui al Piano Operativo Nazionale Città Metropolitane 2014-2020 – ASSE 3 AZIONE 3.3.1. PROGETTO BO.3.3.1a ""Attività culturali, di animazione territoriale e",01-PROCEDURA APERTA,,,idm37529
1569,Z06288808C,01232710374,Comune di Bologna,504.00,504.00,"AFFIDAMENTO A FORNITORI DIVERSI PER LA FORNITURA  DI MATERIALI DI CONSUMO DESTINATI AL TRATTAMENTO DEL PATRIMONIO DOCUMENTALE DELLE BIBLIOTECHE DELL'ISTITUZIONE DEL COMUNE DI BOLOGNA, NELL'ANNO 2019 E CONTESTUALE COSTITUZIONE DI IMPEGNI DI SPESA PER",23-AFFIDAMENTO DIRETTO,,,idm37541
1570,Z132887267,01232710374,Comune di Bologna,352.20,352.20,"ACQUISTO LAMPADINE ""BEGHELLI"" - ORDINE 4500107482 - BIBLIOTECA SALA BORSA",23-AFFIDAMENTO DIRETTO,2019-05-29+02:00,2019-06-28+02:00,idm37556
1571,Z6C28872DC,01232710374,Comune di Bologna,731.62,731.62,FORNITURA PELLICOLE ADESIVE TRASPARENTI - ORDINE 4500107483 - ISTITUZIONE BIBLIOTECHE,23-AFFIDAMENTO DIRETTO,2019-05-29+02:00,2019-06-28+02:00,idm37573
1572,ZDB284010A,01232710374,Comune di Bologna,690.00,690.00,"AFFIDAMENTO A INTRAS DEL SERVIZIO DI TRADUZIONE IN INGLESE DI UNA PUBBLICAZIONE SULL'ISTITUZIONE BOLOGNA MUSEI. CONTESTUALE IMPEGNO DI SPESA DI EURO 841,80",23-AFFIDAMENTO DIRETTO,2019-05-03+02:00,2019-06-30+02:00,idm37590
1573,Z982878B90,01232710374,Comune di Bologna,500.00,500.00,"AFFIDAMENTO A ASSOCIAZIONE CULTURALE RETROMARCHING BAND DELLA REALIZZAZIONE DI UNA LEZIONE MUSICALE NELL'AMBITO DI MAMAMUSICA 2019. CONTESTUALE IMPEGNO DI SPESA DI EURO 550,00",23-AFFIDAMENTO DIRETTO,2019-05-20+02:00,2019-06-23+02:00,idm37607
1574,Z9E2880AAE,01232710374,Comune di Bologna,8640.00,8260.80,"AFFIDAMENTO ALLA DITTA CAMST SOC. COOP. A R.L. DEL SERVIZIO PASTI PER I CENTRI ESTIVI 2019. CONTESTUALE IMPEGNO DI SPESA PER EURO 4.752,00",23-AFFIDAMENTO DIRETTO,2019-05-21+02:00,2019-09-13+02:00,idm37624
1575,ZA92792C86,01232710374,Comune di Bologna,1500.00,1500.00,fornitura di 6 espositori a rete necessari per organizzare degli eventi con mostra di quadri/fotografie/documenti all'interno del territorio del Quartiere Navile,23-AFFIDAMENTO DIRETTO,,,idm37641
1576,Z3E28A5D71,01232710374,Comune di Bologna,381.60,381.60,"AFFIDAMENTO ALLA DITTA  ""ITALCHIM SRL"" MEDIANTE ORDINE DIRETTO DI ACQUISTO SUL MEPA DI MATERIALE DI CONSUMO PER L'ORDINARIO FUNZIONAMENTO DEL SETTORE. IMPEGNO DI SPESA DI EURO 465,55  (O.F.I.)",23-AFFIDAMENTO DIRETTO,2019-06-14+02:00,2019-06-25+02:00,idm37656
1577,Z7B28A5A46,01232710374,Comune di Bologna,7040.00,6224.00,PROGETTO PARCHI IN MOVIMENTO 2019 - AFFIDAMENTO ALLE ASSOCIAZIONI  ED ENTI  DI PROMOZIONE SPORTIVA PRESENTI SUL TERRITORIO A SEGUITO DI MANIFESTAZIONE DI INTERESSE PER LO SVOLGIMENTO DELLE RELATIVE ATTIVITA',23-AFFIDAMENTO DIRETTO,,,idm37673
1578,Z322892E2F,01232710374,Comune di Bologna,6500.00,6500.00,progettazione e realizzazione di impianti di arredo urbano MUPI e  di tabelle da installare sugli autobus per Bologna Estate 2019,23-AFFIDAMENTO DIRETTO,2019-06-19+02:00,2019-08-27+02:00,idm37688
1579,Z9D28A5A9D,01232710374,Comune di Bologna,512.00,384.00,"PROGETTO PARCHI IN MOVIMENTO 2019 - AFFIDAMENTO ALLE ASSOCIAZIONI  ED ENTI  DI PROMOZIONE SPORTIVA PRESENTI SUL TERRITORIO A SEGUITO DI MANIFESTAZIONE DI INTERESSE PER LO SVOLGIMENTO DELLE RELATIVE ATTIVITA',",23-AFFIDAMENTO DIRETTO,,,idm37705
1580,ZCB2892E3E,01232710374,Comune di Bologna,810.00,810.00,"realizzazione, montaggio e  smontaggio di uno striscione per Bologna Estate 2019 - Successive integrazioni di impegno P.G. n. 307525/2019 (DDPRO/2019/782) e P.G. n. 382544/2019 (DD/PRO/2019/2794)",23-AFFIDAMENTO DIRETTO,2019-06-03+02:00,2019-06-04+02:00,idm37720
1581,Z3728A5B8E,01232710374,Comune di Bologna,1344.00,1184.00,"PROGETTO PARCHI IN MOVIMENTO 2019 - AFFIDAMENTO ALLE ASSOCIAZIONI  ED ENTI  DI PROMOZIONE SPORTIVA PRESENTI SUL TERRITORIO A SEGUITO DI MANIFESTAZIONE DI INTERESSE PER LO SVOLGIMENTO DELLE RELATIVE ATTIVITA',",23-AFFIDAMENTO DIRETTO,,,idm37737
1582,Z7928A5AB7,01232710374,Comune di Bologna,1344.00,1152.00,"PROGETTO PARCHI IN MOVIMENTO 2019 - AFFIDAMENTO ALLE ASSOCIAZIONI  ED ENTI  DI PROMOZIONE SPORTIVA PRESENTI SUL TERRITORIO A SEGUITO DI MANIFESTAZIONE DI INTERESSE PER LO SVOLGIMENTO DELLE RELATIVE ATTIVITA',",23-AFFIDAMENTO DIRETTO,,,idm37752
1583,ZBB28A5ADB,01232710374,Comune di Bologna,1088.00,896.00,PROGETTO PARCHI IN MOVIMENTO 2019 - AFFIDAMENTO ALLE ASSOCIAZIONI  ED ENTI  DI PROMOZIONE SPORTIVA PRESENTI SUL TERRITORIO A SEGUITO DI MANIFESTAZIONE DI INTERESSE PER LO SVOLGIMENTO DELLE RELATIVE ATTIVITA,23-AFFIDAMENTO DIRETTO,,,idm37767
1584,Z9628A5BAB,01232710374,Comune di Bologna,1216.00,1184.00,"PROGETTO PARCHI IN MOVIMENTO 2019 - AFFIDAMENTO ALLE ASSOCIAZIONI  ED ENTI  DI PROMOZIONE SPORTIVA PRESENTI SUL TERRITORIO A SEGUITO DI MANIFESTAZIONE DI INTERESSE PER LO SVOLGIMENTO DELLE RELATIVE ATTIVITA',",23-AFFIDAMENTO DIRETTO,,,idm37782
1585,Z3428A5BBA,01232710374,Comune di Bologna,1152.00,1088.00,PROGETTO PARCHI IN MOVIMENTO 2019 - AFFIDAMENTO ALLE ASSOCIAZIONI  ED ENTI  DI PROMOZIONE SPORTIVA PRESENTI SUL TERRITORIO A SEGUITO DI MANIFESTAZIONE DI INTERESSE PER LO SVOLGIMENTO DELLE RELATIVE ATTIVITA',23-AFFIDAMENTO DIRETTO,,,idm37797
1586,ZB828A5B07,01232710374,Comune di Bologna,2688.00,2560.00,"PROGETTO PARCHI IN MOVIMENTO 2019 - AFFIDAMENTO ALLE ASSOCIAZIONI  ED ENTI  DI PROMOZIONE SPORTIVA PRESENTI SUL TERRITORIO A SEGUITO DI MANIFESTAZIONE DI INTERESSE PER LO SVOLGIMENTO DELLE RELATIVE ATTIVITA',",23-AFFIDAMENTO DIRETTO,,,idm37812
1587,ZC028A5D2F,01232710374,Comune di Bologna,448.00,0.00,"PROGETTO PARCHI IN MOVIMENTO 2019 - AFFIDAMENTO ALLE ASSOCIAZIONI  ED ENTI  DI PROMOZIONE SPORTIVA PRESENTI SUL TERRITORIO A SEGUITO DI MANIFESTAZIONE DI INTERESSE PER LO SVOLGIMENTO DELLE RELATIVE ATTIVITA',",23-AFFIDAMENTO DIRETTO,,,idm37827
1588,Z1B28A5BDA,01232710374,Comune di Bologna,384.00,336.00,"PROGETTO PARCHI IN MOVIMENTO 2019 - AFFIDAMENTO ALLE ASSOCIAZIONI  ED ENTI  DI PROMOZIONE SPORTIVA PRESENTI SUL TERRITORIO A SEGUITO DI MANIFESTAZIONE DI INTERESSE PER LO SVOLGIMENTO DELLE RELATIVE ATTIVITA',",23-AFFIDAMENTO DIRETTO,,,idm37842
1589,Z3A28A5B62,01232710374,Comune di Bologna,1210.24,960.00,"PROGETTO PARCHI IN MOVIMENTO 2019 - AFFIDAMENTO ALLE ASSOCIAZIONI  ED ENTI  DI PROMOZIONE SPORTIVA PRESENTI SUL TERRITORIO A SEGUITO DI MANIFESTAZIONE DI INTERESSE PER LO SVOLGIMENTO DELLE RELATIVE ATTIVITA',",23-AFFIDAMENTO DIRETTO,,,idm37857
1590,ZE928A5C78,01232710374,Comune di Bologna,640.00,864.00,PROGETTO PARCHI IN MOVIMENTO 2019 - AFFIDAMENTO ALLE ASSOCIAZIONI  ED ENTI  DI PROMOZIONE SPORTIVA PRESENTI SUL TERRITORIO A SEGUITO DI MANIFESTAZIONE DI INTERESSE PER LO SVOLGIMENTO DELLE RELATIVE ATTIVITA',23-AFFIDAMENTO DIRETTO,,,idm37872
1591,ZCD28A5CC4,01232710374,Comune di Bologna,1344.00,1264.00,"PROGETTO PARCHI IN MOVIMENTO 2019 - AFFIDAMENTO ALLE ASSOCIAZIONI  ED ENTI  DI PROMOZIONE SPORTIVA PRESENTI SUL TERRITORIO A SEGUITO DI MANIFESTAZIONE DI INTERESSE PER LO SVOLGIMENTO DELLE RELATIVE ATTIVITA',",23-AFFIDAMENTO DIRETTO,,,idm37887
1592,ZEE28A5CD6,01232710374,Comune di Bologna,720.00,720.00,"PROGETTO PARCHI IN MOVIMENTO 2019 - AFFIDAMENTO ALLE ASSOCIAZIONI  ED ENTI  DI PROMOZIONE SPORTIVA PRESENTI SUL TERRITORIO A SEGUITO DI MANIFESTAZIONE DI INTERESSE PER LO SVOLGIMENTO DELLE RELATIVE ATTIVITA',",23-AFFIDAMENTO DIRETTO,,,idm37902
1593,Z752797AAC,01232710374,Comune di Bologna,412.50,412.50,fornitura carta termica crono comune per il ssitema eliminacode dello sportello del cittadino del quartiere navile,23-AFFIDAMENTO DIRETTO,,,idm37917
1594,Z0527F8DE7,01232710374,Comune di Bologna,220.00,220.00,"CORSO"" TECNOLOGIE INNOVATIVE, RIQUALIFICAZIONE, ANALISI DI RISCHIO, SICUREZZA DEI LAVORATORI, CONFRONTO ISTITUZIONALE, GEOTECNICA AMBIENTALE""",23-AFFIDAMENTO DIRETTO,,,idm37932
1595,ZA4284262E,01232710374,Comune di Bologna,1920.00,1920.00,"CORSO ""MINDSET AGILE""",23-AFFIDAMENTO DIRETTO,,,idm37947
1596,Z9C2838C0D,01232710374,Comune di Bologna,506.00,506.00,"CORSO ""PREVENZIONI ANTINCENDI FINALIZZATE AL MANTENIMENTO DELLE ISCRIZIONI DEI PROFESSIONISTI NEGLI ELENCHI DEL MINISTERO DEGLI INTERNI""",23-AFFIDAMENTO DIRETTO,,,idm37962
1597,Z99284CAE0,01232710374,Comune di Bologna,52.00,52.00,"CORSO""CONDOMINIO SICURO. NOVITA' NORMATIVE: OPPORTUNITA', PERCORSI, OSTACOLI""",23-AFFIDAMENTO DIRETTO,,,idm37977
1598,Z1F2891479,01232710374,Comune di Bologna,168.00,168.00,"AFFIDAMENTO ALLA DITTA BALDUZZI COPY CENTER SRL DI BOLOGNA PER LA REALIZZAZIONE DI STAMPATI PER LA BIBLIOTECA DELL'ARCHIGINNASIO E CASA CARDUCCI PER L'IMPORTO DI EURO 240,34. BILANCIO 2019.",23-AFFIDAMENTO DIRETTO,2019-05-24+02:00,2019-06-04+02:00,idm37992
1599,ZAE28914C7,01232710374,Comune di Bologna,29.00,29.00,"AFFIDAMENTO ALLA DITTA BALDUZZI COPY CENTER SRL DI BOLOGNA PER LA REALIZZAZIONE DI STAMPATI PER LA BIBLIOTECA DELL'ARCHIGINNASIO E CASA CARDUCCI PER L'IMPORTO DI EURO 240,34. BILANCIO 2019.",23-AFFIDAMENTO DIRETTO,2019-05-24+02:00,2019-06-07+02:00,idm38009
1600,0000000000,01232710374,Comune di Bologna,116.40,0.00,SPESE CUSTODIA VEICOLI SEQUESTRATI,23-AFFIDAMENTO DIRETTO,,,idm38026
1601,79214657B5,01232710374,Comune di Bologna,1228000.00,600.00,Programma straordinario di intervento per la riqualificazione urbana e la sicurezza delle periferie di cui alla L. 208/2015 art. 1 co. 974-978 - lotto 5: riqualificazione dell'area ortiva comunale di via Salgari - ambito territoriale zona Pilastro,01-PROCEDURA APERTA,,,idm38041
1602,0000000000,01232710374,Comune di Bologna,250.00,0.00,SPRECOZERO.NET QUOTA ANNO 2019,26-AFFIDAMENTO DIRETTO IN ADESIONE AD ACCORDO QUADRO/CONVENZIONE,2019-01-01+01:00,2019-12-31+01:00,idm38080
1603,Z3328535B5,01232710374,Comune di Bologna,330.00,330.00,"REALIZZAZIONE DI UN LABORATORIO EDUCATIVO PER PREADOLESCENTI SULL'UTILIZZO DI STRUMENTI DIGITALI, RIVOLTO AGLI UTENTI DEL CENTRO ANNI VERDI DEL QUARTIERE SAN VITALE",23-AFFIDAMENTO DIRETTO,,,idm38097
1604,ZED28A84C4,01232710374,Comune di Bologna,6200.00,3259.80,"AFFIDAMENTO ALL'EDICOLA ""GARDINI""  PER LA FORNITURA DI PERIODICI ITALIANI E STRANIERI - ORDINE 4500107504 - ISTITUZIONE BIBLIOTECHE",23-AFFIDAMENTO DIRETTO,2019-06-01+02:00,2019-12-31+01:00,idm38112
1605,Z5C28B22C2,01232710374,Comune di Bologna,1750.00,1750.00,ACQUISIZIONE DIRETTA DAL MEPA CONSIP DELL'AGGIORNAMENTO ANNUALE DEL PROGRAMMA INFORMATICO CITRIX XEN DESKTOP,23-AFFIDAMENTO DIRETTO,,,idm38129
1606,Z7028B2C12,01232710374,Comune di Bologna,38500.00,38500.00,"ACQUISIZIONE DIRETTA DAL MEPA CONSIP DEL MATERIALE INFORMATICO PER L'ALLESTIMENTO DELL'AUDITORIUM BIAGI NELL'AMBITO DEL PROGETTO ASSE 6 POR FESR 2014–2020, AZIONE 2.3.1",23-AFFIDAMENTO DIRETTO,,,idm38144
1607,Z2B28944CF,01232710374,Comune di Bologna,532.79,532.79,L'ACQUISTO DI TRE GAZEBO E RELATIVO AFFIDAMENTO ALLA SOCIETA' B-KOKKA OUTLIFE SRL,23-AFFIDAMENTO DIRETTO,,2019-06-02+02:00,idm38159
1608,Z3D2800FB6,01232710374,Comune di Bologna,402.00,402.00,"CORSO ""L'ENTE LOCALE E LA GESTIONE DEGLI IMPIANTI SPORTIVI""",23-AFFIDAMENTO DIRETTO,,,idm38175
1609,ZF12748EDB,01232710374,Comune di Bologna,742.00,742.00,"CORSO ""CERTIFICAZIONE ENERGETICA: AGGIORNAMENTO PROFESSIONALE""",23-AFFIDAMENTO DIRETTO,,,idm38190
1610,ZB22838732,01232710374,Comune di Bologna,820.60,820.60,"AFFIDAMENTO  ALLA DITTA ART&FACT SRL DI MEDA (MB) DELLA FORNITURA DI ARTICOLI PROMOZIONALI PERSONALIZZATI DESTINATI AL BOOKSHOP DEL TEATRO ANATOMICO PRESSO LA BIBLIOTECA  COMUNALE DELL'ARCHIGINNASIO E CONTESTUALE IMPEGNO  DELLA SPESA DI EURO 1.001,13",23-AFFIDAMENTO DIRETTO,2019-05-30+02:00,2019-07-01+02:00,idm38205
1611,Z722818ABB,01232710374,Comune di Bologna,430.00,430.00,"REALIZZAZIONE DI UN LABORATORIO EDUCATIVO PER PREADOLESCENTI SULLE ATTIVITA' DI GIOCOLERIA, RIVOLTO AGLI UTENTI DEL CENTRO ANNI VERDI DEL QUARTIERE SAN VITALE",23-AFFIDAMENTO DIRETTO,,,idm38222
1612,ZD828BA24E,01232710374,Comune di Bologna,1368.00,0.00,"ACQUISTO DEL RINNOVO, PER L'ANNO 2019, DEI SERVIZI DI SUPPORTO E MAINTENANCE SULLA APPLIANCE MAG (PRODOTTO PULSE).",23-AFFIDAMENTO DIRETTO,,,idm38237
1613,Z0F27A8B34,01232710374,Comune di Bologna,3374.04,562.34,"AUTORIZZAZIONE ALLA SPESA DI EURO 4.113,36 PER L''ACQUISIZIONE DEL SERVIZIO DI NOLEGGIO DI APPARECCHIATURE MULTIFUNZIONE PER SCANSIONE, STAMPA E COPIA E SERVIZI CONNESSI OCCORRENTI AD UFFICI DELLISTITUZIONE BOLOGNA MUSEI PER IL PERIODO 2019-2021- ADE",23-AFFIDAMENTO DIRETTO,2019-03-20+01:00,2019-08-31+02:00,idm38252
1614,Z9D2860D8C,01232710374,Comune di Bologna,178.50,178.50,AFFIDAMENTO ALLA  DITTA  SER DATA S.R.L.DELLA FORNITURA DI  ATTREZZATURA  NECESSARIA ALLA U.I SISTEMA INFORMATIVO INTEGRATO INFANZIA E ADOLESCENZA.,23-AFFIDAMENTO DIRETTO,,,idm38269
1615,ZC32886BEA,01232710374,Comune di Bologna,2750.00,2750.00,"AFFIDAMENTO AD ALPACA' S.A.S. DEL SERVIZIO DI CONSULENZA E CERTIFICAZIONE FINALE APPENDIMENTI PER ALLESTIMENTO MOSTRA JULIAN CHARRIERE AL MAMBO. CONTESTUALE IMPEGNO DI SPESA DI EURO 3.355,00",23-AFFIDAMENTO DIRETTO,2019-05-22+02:00,2019-09-15+02:00,idm38284
1616,ZC72886CFE,01232710374,Comune di Bologna,4095.60,3767.90,"AFFIDAMENTO ALLA DITTA ARTEFATTO DISTRIBUTION S.A.S. DELLA FORNITURA DI MATERIALE DI MERCHANDISING PER IL BOOKSHOP DEL MUSEO ARCHEOLOGICO, CONTESTUALE IMPEGNO DI SPESA DI EURO 4.996,63.",23-AFFIDAMENTO DIRETTO,2019-05-22+02:00,2019-06-30+02:00,idm38301
1617,Z95289FE41,01232710374,Comune di Bologna,720.00,720.00,"AFFIDAMENTO A TAGLIAVINI SRL DEL SERVIZIO DI NOLEGGIO DI UNA PIATTAFORMA ELETTRICA PER ALLESTIMENTO MOSTRA JULIAN CHARRIERE AL MAMBO. CONTESTUALE IMPEGNO DI SPESA DI EURO 878,40.",23-AFFIDAMENTO DIRETTO,2019-05-29+02:00,2019-06-08+02:00,idm38318
1618,ZC4289D8EB,01232710374,Comune di Bologna,2933.29,985.86,"AFFIDAMENTO A CANTARELLI GROUP SNC DEL SERVIZIO DI GRAFICA PER MOSTRE MAMBO E MUSEO MORANDI GIUGNO 2019 - GENNAIO 2020. CONTESTUALE IMPEGNO DI SPESA DI EURO 3.578,63.",23-AFFIDAMENTO DIRETTO,2019-05-29+02:00,2020-01-31+01:00,idm38335
1619,ZBF2876026,01232710374,Comune di Bologna,1299.20,1075.64,ADESIONE ALLA CONVENZIONE STIPULATA FRA L' AGENZIA REGIONALE INTERCENT-ER E LA DITTA LA PITAGORA PER LA FORNITURA DI CARTA IN RISME NECESSARIA AL FUNZIONAMENTO DI UFFICI E SERVIZI DELL'ISTITUZIONE BOLOGNA MUSEI DEL COMUNE DI BOLOGNA PER ALCUNI MESI D,23-AFFIDAMENTO DIRETTO,2019-05-17+02:00,2019-09-30+02:00,idm38352
1620,Z842891343,01232710374,Comune di Bologna,65.45,0.00,"AFFIDAMENTO A RUGGINE S.N.C. DEL SERVIZIO DI RISTORAZIONE IN OCCASIONE DEL PROGETTO ""L'ARTE E' DONNA"". CONTESTUALE IMPEGNO DI SPESA DI EURO 72,00",23-AFFIDAMENTO DIRETTO,2019-05-24+02:00,2019-05-28+02:00,idm38369
1621,7926446629,01232710374,Comune di Bologna,372.33,372.33,FORNITURA DI ARREDI SCOLASTICI PER IL NIDO FANTINI E L'INFANZIA DON MILANI TRAMITE ADESIONE A CONVENZIONE INTERCENT-ER,26-AFFIDAMENTO DIRETTO IN ADESIONE AD ACCORDO QUADRO/CONVENZIONE,,,idm38386
1622,ZA128B411F,01232710374,Comune di Bologna,1785.00,0.00,FORNITURA DI MATERIALE MONTESSORIANO,23-AFFIDAMENTO DIRETTO,,,idm38401
1623,Z95288EABE,01232710374,Comune di Bologna,1669.08,1669.08,FORNITURA DI MATERIALE INFORMATICO VARIO E DI TELEFONIA MEDIANTE ME.PA,23-AFFIDAMENTO DIRETTO,,,idm38416
1624,Z2C288BFBC,01232710374,Comune di Bologna,655.00,655.00,"AFFIDAMENTO A PANCALDI & C. DELLA FORNITURA DI MATERIALE DI ALLESTIMENTO PER MOSTRA CHARRIERE. CONTESTUALE IMPEGNO DI SPESA DI EURO 799,10",23-AFFIDAMENTO DIRETTO,2019-05-23+02:00,2019-06-08+02:00,idm38431
