n,cig,strutturaProponente:codiceFiscaleProp,strutturaProponente:denominazione,importoAggiudicazione,importoSommeLiquidate,oggetto,sceltaContraente,tempiCompletamento:dataInizio,tempiCompletamento:dataUltimazione,lottoID
2193,ZCB2A2E130,01232710374,Comune di Bologna,1800.00,1800.00,"AFFIDAMENTO DEL SERVIZIO DI COPERTURA ASSICURATIVA DI OPERE PARTECIPANTI ALLA MOSTRA IMAGO SPLENDIDA. COSTITUZIONE DI IMPEGNI DI SPESA PER COMPLESSIVI EURO 3.300,00",23-AFFIDAMENTO DIRETTO,2019-10-21+02:00,2020-03-08+01:00,idm49071
2194,0000000000,01232710374,Comune di Bologna,0.00,0.00,"Avviso per la presentazione di manifestazione di interesse a essere invitati alla successiva procedura negoziata per l'affidamento dell'intervento denominato "" Potenziamento dei sistemi di video sorveglianza delle piazze e delle porte della città di",04-PROCEDURA NEGOZIATA SENZA PREVIA PUBBLICAZIONE,,,idm49088
2195,ZD42A4854B,01232710374,Comune di Bologna,4197.00,4197.00,ACQUISTO DI N.350 GUIDE TURISTICHE DELLA CITTA' DI BOLOGNA,23-AFFIDAMENTO DIRETTO,,,idm49100
2196,ZD12A48963,01232710374,Comune di Bologna,600.00,0.00,AFFIDAMENTO DIRETTO CORSI DI FORMAZIONE ALL'INTERNO DEL PROGETTO - LEGGERE APPARTENENZE-,23-AFFIDAMENTO DIRETTO,,,idm49115
2197,ZAF2A48A07,01232710374,Comune di Bologna,1350.00,0.00,"AFFIDAMENTI DIRETTI DI SERVIZI DI FORMAZIONE AI SENSI DELL'ART. 36 COMMA 2, LETT. A) DEL D.LGS N. 50/2016 ALL'INTERNO DEL PROGETTO ""LEGGERE APPARTENENZE"" 2019/2020, ASSUNZIONE IMPEGNO DI SPESA DI EURO 4.900,00",23-AFFIDAMENTO DIRETTO,,,idm49130
2198,Z622A48AD8,01232710374,Comune di Bologna,1500.00,0.00,"AFFIDAMENTI DIRETTI DI SERVIZI DI FORMAZIONE AI SENSI DELL'ART. 36 COMMA 2, LETT. A) DEL D.LGS N. 50/2016 ALL'INTERNO DEL PROGETTO ""LEGGERE APPARTENENZE""",23-AFFIDAMENTO DIRETTO,,,idm49145
2199,ZF72A48EBA,01232710374,Comune di Bologna,650.00,0.00,"AFFIDAMENTI DIRETTI DI SERVIZI DI FORMAZIONE AI SENSI DELL'ART. 36 COMMA 2, LETT. A) DEL D.LGS N. 50/2016 ALL'INTERNO DEL PROGETTO ""LEGGERE APPARTENENZE"" 2019/2020, ASSUNZIONE IMPEGNO DI SPESA DI EURO 4.900,00",23-AFFIDAMENTO DIRETTO,,,idm49160
2200,ZA42A48FE3,01232710374,Comune di Bologna,800.00,800.00,"AFFIDAMENTI DIRETTI DI SERVIZI DI FORMAZIONE  ALL'INTERNO DEL PROGETTO ""LEGGERE APPARTENENZE"" 2019/2020, ASSUNZIONE IMPEGNO DI SPESA DI EURO 4.900,00",23-AFFIDAMENTO DIRETTO,,,idm49175
2201,Z3C2A48A68,01232710374,Comune di Bologna,22.85,22.85,"FORNITURA DI LIBRI DI TESTO PER LE SCUOLE PRIMARIE PER L'ANNO SCOLASTICO 2019/2020 IN ATTUAZIONE DELL'ART. 156DEL D.LGS N. 297/94 E DELL'ART. 3 DELLA L.R. n. 26/2001 IMPEGNO DELLA SPESA DI EURO 22,85 PER L'ACQUISTO DI LIBRI DI TESTO DALLA LIBRERIA LE",23-AFFIDAMENTO DIRETTO,,,idm49190
2202,Z922A4C5DD,01232710374,Comune di Bologna,498.75,0.00,ACQUISTO CASSAFORTE PER UFFICIO PER SEDE UFFICI QUARTIERE,23-AFFIDAMENTO DIRETTO,,,idm49205
2203,Z952A4CA98,01232710374,Comune di Bologna,5500.00,0.00,"AFFIDAMENTO, CON ACQUISIZIONE DIRETTA DAL MEPA CONSIP, DELLA FORNITURA DI MODULI OTTICI PER SWITCH CISCO",23-AFFIDAMENTO DIRETTO,,,idm49220
2204,Z782A4DB4A,01232710374,Comune di Bologna,529.38,0.00,ACQUISTO STAMPANTE EPSON AD IMPATTO CON ALIMENTATORE,23-AFFIDAMENTO DIRETTO,,,idm49235
2205,ZD72A4DC62,01232710374,Comune di Bologna,395.00,0.00,ACQUISTO DISPOSITIVO TRITADOCUMENTI,23-AFFIDAMENTO DIRETTO,,,idm49250
2206,Z622A4E7FD,01232710374,Comune di Bologna,900.00,0.00,"AFFIDAMENTO ALLA DITTA ARTECH DI ZOLA PREDOSA (BO) DELL'INSTALLAZIONE DI DUE TERMINALI PER LA RILEVAZIONE AUTOMATICA DELLE PRESENZE DEL PERSONALE. IMPEGNO DI SPESA DI EURO 1.098,00 IVA INCLUSA",23-AFFIDAMENTO DIRETTO,,,idm49265
2207,ZC429BCF51,01232710374,Comune di Bologna,221.25,232.50,servizi di  assistenza tecnica per la gestione dell'impianto audio-video nella sala dello Stabat Mater per la giornata del 24 settembre 2019,23-AFFIDAMENTO DIRETTO,2019-09-24+02:00,2019-09-24+02:00,idm49280
2208,ZA82A2DCA8,01232710374,Comune di Bologna,580.00,0.00,"AFFIDAMENTO  A FORNITORI DIVERSI PER L'ACQUISTO DI  ARREDI E COMPLEMENTI DI ARREDO PER LA BIBLIOTECA N. GINZBURG DELL'ISTITUZIONE BIBLIOTECHE DEL COMUNE DI BOLOGNA CON CONTESTUALI IMPEGNI DI SPESA PER UN IMPORTO COMPLESSIVO DI EURO  4.869,68  - BILAN",23-AFFIDAMENTO DIRETTO,,,idm49297
2209,Z3D2A3F896,01232710374,Comune di Bologna,519.00,249.12,"AFFIDAMENTO A FORNITORI DIVERSI PER LA FORNITURA DI MATERIALE DI
TRATTAMENTO PER LA BIBLIOTECA DELL'ARCHIGINNASIO PER L'IMPORTO
COMPLESSIVO DI EURO 5.758,40. BILANCIO 2019",23-AFFIDAMENTO DIRETTO,2019-10-21+02:00,2019-12-31+01:00,idm49312
2210,Z4C2A3CC96,01232710374,Comune di Bologna,3475.00,0.00,"AFFIDAMENTO A FORNITORI DIVERSI PER LA FORNITURA DI MATERIALE DI
TRATTAMENTO PER LA BIBLIOTECA DELL'ARCHIGINNASIO PER L'IMPORTO
COMPLESSIVO DI EURO 5.758,40. BILANCIO 2019",23-AFFIDAMENTO DIRETTO,2019-10-21+02:00,2019-12-31+01:00,idm49329
2211,Z2D2A2DBDC,01232710374,Comune di Bologna,3411.54,0.00,"AFFIDAMENTO  A FORNITORI DIVERSI PER L'ACQUISTO DI  ARREDI E COMPLEMENTI DI ARREDO PER LA BIBLIOTECA N. GINZBURG DELL'ISTITUZIONE BIBLIOTECHE DEL COMUNE DI BOLOGNA CON CONTESTUALI IMPEGNI DI SPESA PER UN IMPORTO COMPLESSIVO DI EURO  4.869,68  - BILAN",23-AFFIDAMENTO DIRETTO,,,idm49346
2212,Z7A2A3F85C,01232710374,Comune di Bologna,726.00,0.00,"AFFIDAMENTO A FORNITORI DIVERSI PER LA FORNITURA DI MATERIALE DI
TRATTAMENTO PER LA BIBLIOTECA DELL'ARCHIGINNASIO PER L'IMPORTO
COMPLESSIVO DI EURO 5.758,40. BILANCIO 2019",23-AFFIDAMENTO DIRETTO,2019-10-21+02:00,2019-12-31+01:00,idm49361
2213,Z95294D8E7,01232710374,Comune di Bologna,39700.00,0.00,"AFFIDAMENTO DELLE AZIONI VOLTE ALL 'ATTUAZIONE A LIVELLO OPERATIVO DEL PROGETTO DI
MOBILITA' SCOLASTICA SOSTENIBILE A BOLOGNA , TRAMITE TRATTATIVA DIRETTA SUL MEPA AI SENSI
DELL'ART. 36 COMMA 2 LETT. A) D.LGS. 50/2016 UNIVERSITA' VERDE DI BOLOGNA ,",04-PROCEDURA NEGOZIATA SENZA PREVIA PUBBLICAZIONE,2019-10-23+02:00,2021-06-30+02:00,idm49378
2214,7941657EAA,01232710374,Comune di Bologna,55583.93,30.00,"Servizio professionale di progettazione definitiva ed esecutiva per la riqualificazione della palestra popolare Pizzoli - Via Zanardi 228, di cui all'Asse 4 - Azione 4.2.1 - Progetto BO4.2.1 a.5 del Piano Operativo Città di Bologna, nell'ambito del p",04-PROCEDURA NEGOZIATA SENZA PREVIA PUBBLICAZIONE,,,idm49395
2215,Z212a270B2,01232710374,Comune di Bologna,2993.00,2993.00,SPECTRA SRL - MANUTENZIONE ED AGGIORNAMENTO MODELLO SOUNDPLAN,23-AFFIDAMENTO DIRETTO,,,idm49449
2216,Z8428E5186,01232710374,Comune di Bologna,15917.68,0.00,"CONVENZIONE FRA IL COMUNE DI BOLOGNA - AREA EDUCAZIONE, ISTRUZIONE E NUOVE GENERAZIONI E DIREZIONE REGIONALE DELL’AGENZIA DELLE ENTRATE E COOPERATIVA SOCIALE SOCIETÀ DOLCE SOCIETÀ COOPERATIVA PER LA RISERVA DI POSTI DA DESTINARE ALLE GRADUATORIE COMU",23-AFFIDAMENTO DIRETTO,,,idm49464
2217,Z2C2A50E61,01232710374,Comune di Bologna,122.20,122.20,"FORNITURA DI LIBRI DI TESTO PER LE SCUOLE PRIMARIE PER L'ANNO SCOLASTICO 2019/2020 IN ATTUAZIONE DELL'ART. 156 DEL D.LGS. N. 297/94 E DELL'ART. 3 DELLA L.R. N. 26/2001 IMPEGNO DELLA SPESA DI EURO 122,20 PER L'ACQUISTO DI LIBRI DI TESTO DALLA CARTOLER",23-AFFIDAMENTO DIRETTO,,,idm49479
2218,Z422A5435F,01232710374,Comune di Bologna,560.00,560.00,QUOTA DI PARTECIPAZIONE DEL COMUNE DI BOLOGNA ALL'ASSEMBLEA GENERALE ANNUALE EUROCITIES 2019.,23-AFFIDAMENTO DIRETTO,,,idm49494
2219,Z1729D26EA,01232710374,Comune di Bologna,10000.00,0.00,"AFFIDAMENTO AD AVVISO PUBBLICO DELLA REALIZZAZIONE DI MOMENTI FORMATIVI NELL'AMBITO DEL PROGETTO ""NARRARE LE MAFIE, SGUARDI SUL CONTEMPORANEO TRA AZIONI DI CONTRASTO E VALORIZZAZIONE DELLA CULTURA DELLA LEGALITA'""",23-AFFIDAMENTO DIRETTO,,,idm49509
2220,Z2E29F871F,01232710374,Comune di Bologna,3300.00,3300.00,AFFIDAMENTO AD ASSOCIAZIONE CROMOSOMA 2.0 DI REALIZZAZIONE DI LABORATORI INERENTI LE IMPLICAZIONI LEGALI DELL'USO DELLA RETE DA PARTE DI MINORI,23-AFFIDAMENTO DIRETTO,,,idm49524
2221,Z4B2A3A80A,01232710374,Comune di Bologna,1780.00,0.00,SERVIZIO DI SUPPORTO ALL'ORGANIZZAZIONE DELL'INCONTRO PREVISTO PER IL 23 NOVEMBRE 2019,23-AFFIDAMENTO DIRETTO,,,idm49539
2222,Z3F29F87C8,01232710374,Comune di Bologna,4995.00,4995.00,AFFIDAMENTO A CLINICA DELLA CRISI SRL DI PERCORSI DI PREVENZIONE DEL SUICIDIO IN ETA' ADOLESCENZIALE,23-AFFIDAMENTO DIRETTO,,,idm49554
2223,Z1829F880E,01232710374,Comune di Bologna,3600.00,3600.00,AFFIDAMENTO A CENTRO PSICOPEDAGOGICO PER LA PACE E GESTIONE CONFLITTI PER LA REALIZZAZIONE DI LABORATORI NELL'AMBITO DEL SOSTEGNO ALLA GENITORIALITA',23-AFFIDAMENTO DIRETTO,,,idm49569
2224,Z6229F8864,01232710374,Comune di Bologna,2000.00,2000.00,AFFIDAMENTO A EQUILIBRI COOP. SOCIALE PER LA REALIZZAZIONE DI LABORATORI SULL'EDUCAZIONE E PROMOZIONE ALLA LETTURA PER ADOLESCENTI CHE SI INFORMANO E LEGGONO UTILIZZANDO LE OPPORTUNITA' OFFERTE DAL MONDO DIGITALE,23-AFFIDAMENTO DIRETTO,,,idm49584
2225,8076898315,01232710374,Comune di Bologna,333364.73,0.00,Villa Salus: realizzazione laboratori in strutture prefabbricate,01-PROCEDURA APERTA,,,idm49599
2226,ZE52A2175B,01232710374,Comune di Bologna,10373.00,10373.00,"AFFIDAMENTO A CIOFS FP/ER DELL'ORGANIZZAZIONE DI PERCORSI FORMATIVI E LABORATORIALI PER GENITORI, DOCENTI ED EDUCATORI SU DIVERSI TEMI RIGUARDANTI GLI ADOLESCENTI",23-AFFIDAMENTO DIRETTO,,,idm49869
2227,ZB22A56F49,01232710374,Comune di Bologna,283.20,0.00,"AFFIDAMENTO ALLA DITTA BENGI DI VALPIANI PAOLA DELLA FORNITURA DI MATERIALE VARIO DI FERRAMENTA NECESSARIO AL FUNZIONAMENTO DEGLI UFFICI E SERVIZI DEL Q.RE SANTO STEFANO. IMPEGNO DELLA SPESA DO EURO 283,20 (ONERI FISCALI INCLUSI)",23-AFFIDAMENTO DIRETTO,,,idm49884
2228,Z442A59740,01232710374,Comune di Bologna,4500.00,0.00,SERVIZIO DI MANUTENZIONE CENTRALE RADIO OPERATIVA FINO AL 31/12/2019,23-AFFIDAMENTO DIRETTO,2019-10-30+01:00,2020-01-15+01:00,idm49899
2229,Z6F2A59A04,01232710374,Comune di Bologna,16000.00,8000.00,contrasto alle disuguaglianze nella città di Bologna,23-AFFIDAMENTO DIRETTO,2019-10-03+02:00,2020-12-31+01:00,idm49916
2230,Z172A5A0B1,01232710374,Comune di Bologna,1414.02,0.00,"PROGETTO BENESSERE ORGANIZZATIVO: AFFIDAMENTO, TRAMITE ADESIONE A CONVENZIONE CONSIP, DELLA FORNITURA DI N. 2 SWITCH ALLA DITTA TELECOM ITALIA S.P.A. PER L'IMPORTO COMPLESSIVO DI EURO 1.725,10 E CONTESTUALE IMPEGNO",26-AFFIDAMENTO DIRETTO IN ADESIONE AD ACCORDO QUADRO/CONVENZIONE,2019-10-25+02:00,2019-10-31+01:00,idm49933
2231,806270202D,01232710374,Comune di Bologna,150496.17,0.00,"Servizio finalizzato alla riduzione del rischio e alla prevenzione della dipendenza da sostanze legali ed illegali, rivolto a preadolescenti, adolescenti e giovani da svolgersi nei locali del divertimento serale e notturno di Bologna e in occasione d",01-PROCEDURA APERTA,2020-01-01+01:00,2021-12-31+01:00,idm49950
2232,7975563AC9,01232710374,Comune di Bologna,137740.99,30.00,"APPROVAZIONE DEL PROGETTO ESECUTIVO RELATIVO AL COMPLETAMENTO DEI LAVORI DI BONIFICA ORDIGNI BELLICI E INDAGINI ARCHEOLOGICHE ALL'INTERNO DEL COMPARTO R.5.2 ZONA NAVILE, AREA NUOVA FEDERZONI, LOTTO 4. IMPEGNO DI SPESA DELL'IMPORTO COMPLESSIVO DI EURO",23-AFFIDAMENTO DIRETTO,,,idm49967
2233,Z7129D093F,01232710374,Comune di Bologna,1720.00,1720.00,"IMPEGNO DI SPESA DI EURO 2.098,40 PER IL SERVIZIO DI GESTIONE AMMINISTRATIVA DEI LAVORI DELLA COMMISSIONE PER IL PROGETTO ""ROSE ED. 2020-2021"", AFFIDATO AD INTRAS CONGRESSI SRL",23-AFFIDAMENTO DIRETTO,2019-09-20+02:00,2019-12-31+01:00,idm49988
2234,ZBC29CD5E3,01232710374,Comune di Bologna,22850.00,0.00,"AFFIDAMENTO AD ABSOLUT DI M. LIOCE & C. S.N.C. DEL SERVIZIO DI GESTIONE AMMINISTRATIVA DEGLI ARTISTI PER IL PROGRAMMA ""ROSE ED. 2020-2021"" CON COSTITUZIONE DEL RELATIVO SUBIMPEGNO PER EURO 27.877,00.",23-AFFIDAMENTO DIRETTO,2019-10-23+02:00,2021-12-31+01:00,idm50005
2235,ZCE2A5D5F0,01232710374,Comune di Bologna,7619.05,0.00,"AFFIDAMENTO DIRETTO ALLA COOPERATIVA SOCIALE CEIS A.R.T.E. PER LA REALIZZAZIONE DEL PROGETTO ""IL CONSIGLIO DI QUARTIERE DELLE RAGAZZE E DEI RAGAZZI"", SPESA COMPLESSIVA EURO 8.000,00 - A.S. 2019/2020.",23-AFFIDAMENTO DIRETTO,,,idm50022
2236,ZA32A589A3,01232710374,Comune di Bologna,1338.00,1338.00,AFFIDAMENTO DIRETTO ALLA DITTA GIODICART  DELLA FORNITURA DI MATERIALE PER LA REALIZZAZIONE DI LABORATORI IN OCCASIONE DEL 50 ANNIVERSARIO DELL'APERTURA DEI NIDI DEL COMUNE DI BOLOGNA.,23-AFFIDAMENTO DIRETTO,,,idm50037
2237,Z7B2A46380,01232710374,Comune di Bologna,702.95,702.95,"AFFIDAMENTO DIRETTO ALLA DITTA DPS INFORMATICA PER L'ACQUISTO DI BENI DI CONSUMO PER UNA SPESA COMPLESSIVA DI EURO 857,60.=",23-AFFIDAMENTO DIRETTO,,,idm50052
2238,Z9E2A5B75A,01232710374,Comune di Bologna,500.00,500.00,"AFFIDAMENTO DIRETTO ALLA DITTA COSEPURI DEL SERVIZIO DI TRASPORTO DI BAMBINI/RAGAZZI FREQUENTANTI I SERVIZI SOCIO EDUCATIVI DEL QUARTIERE SAN DONATO-SAN VITALE E CONTESTUALE IMPEGNO DELLA SPESA COMPLESSIVA DI EURO 550,00.=(O.F.C.).",23-AFFIDAMENTO DIRETTO,,,idm50067
2239,ZB32A5FBC3,01232710374,Comune di Bologna,1698.90,789.41,"ACQUISTO AGENDE, MATERIALE DI CANCELLERIA
PER L'INFORTUNISTICA STRADALE E TIMBRI",23-AFFIDAMENTO DIRETTO,,,idm50082
2240,Z142A448B8,01232710374,Comune di Bologna,691.07,691.07,"AFFIDAMENTO DIRETTO PER LA SOMMA DI EURO 843,11.= ALLA FERRAMENTA MAZZA S.N.C. PER L'ACQUISTO DI MATERIALE DI CONSUMO PER PANCHINE/TAVOLI SITI NEI PARCHI E GIARDINI DEL QUARTIERE SAN DONATO-SAN VITALE",23-AFFIDAMENTO DIRETTO,,,idm50097
2241,Z242A44EFE,01232710374,Comune di Bologna,100.03,100.03,"AFFIDAMENTO A PELLONI SRL PER EURO 122,04 (O.F.C.) PER L'ACQUISIZIONE DELLA FORNITURA DI MATERIALE DI CONSUMO DI PRIMO SOCCORSO NECESSARIO PER L'ORDINARIO FUNZIONAMENTO DI UFFICI E SERVIZI DEL QUARTIERE SAN DONATO-SAN VITALE",23-AFFIDAMENTO DIRETTO,,,idm50112
2242,Z0E2A3AC30,01232710374,Comune di Bologna,2597.57,0.00,"AFFIDAMENTO DIRETTO PER LA SOMMA DI EURO 3.169,04.= ALLA DITTA L'OPEROSA SCARL PER L'ACQUISTO DI MATERIALE DI CONSUMO PER L'ALLESTIMENTO DI PARCHI E GIARDINI DEL QUARTIERE SAN DONATO-SAN VITALE",23-AFFIDAMENTO DIRETTO,,,idm50127
2243,ZD32A361D3,01232710374,Comune di Bologna,3994.00,3994.00,"ACQUISIZIONE DIRETTA DAL MEPA CONSIP DI N. 2 MACBOOK PRO 13""",23-AFFIDAMENTO DIRETTO,,,idm50142
2244,8060955E7D,01232710374,Comune di Bologna,309724.36,0.00,"FORNITURA DI MOTOCICLI PER LE ESIGENZE DEL CORPO DI POLIZIA LOCALE DEL COMUNE DI BOLOGNA E DI RITIRO, ROTTAMAZIONE E RADIAZIONE DI MOTOCICLI USATI DI PROPRIETA' DELL'AMMINISTRAZIONE",01-PROCEDURA APERTA,,,idm50157
2245,Z7D2A603C2,01232710374,Comune di Bologna,100.00,100.00,AFFIDAMENTO DIRETTO ALL'ASSOCIAZIONE FUNAMBULI PER L'ACQUISTO DI MATERIALE DI RICICLO PRESSO IL LORO EMPORIO DEGLI SCARTI DEL CENTRO REMIDA,23-AFFIDAMENTO DIRETTO,,,idm50184
2246,Z0E2A34929,01232710374,Comune di Bologna,1500.00,0.00,AFFIDAMENTO DIRETTO PER LA PROGETTAZIONE E GESTIONE DI UN LABORATORIO DI LOTTADANZA RIVOLTO A INDIRIZZATO A DISABILI FISICI E PSICHICI NELL'AMBITO DEL LAVORO DI COMUNITA' E FINALIZZATI ALLA PREVENZIONE DEL DISAGIO SOCIALE A FAVORE DELL'A.S.D.POLISPO,23-AFFIDAMENTO DIRETTO,,,idm50199
2247,ZAD2A2DEFC,01232710374,Comune di Bologna,2857.14,0.00,"AFFIDAMENTO DIRETTO ALLA COOPERATIVA SOCIALE QUADRIFOGLIO S.C. ONLUS PER LA REALIZZAZIONE DI UN PROGETTO DI PSICOMOTRICITA' NELL'AMBITO DEI SERVIZI EDUCATIVI SCOLASTICI. IMPEGNO DI EURO 3.000,00.=, NOVEMBRE 2019-GIUGNO 2020",23-AFFIDAMENTO DIRETTO,,,idm50214
2248,Z852A2C870,01232710374,Comune di Bologna,500.00,0.00,"AFFIDAMENTO DIRETTO ALL'ASSOCIAZIONE ""LA BALOTTA A.P.S."" PER LA REALIZZAZIONE DI UN LABORATORIO DENOMINATO ""COMPITIAMO TEEN'S 2019"" RICOMPRESO NEL PIANO DI QUALIFICAZIONE DELL'OFFERTA SCOLASTICA ED EXTRA-SCOLASTICA DEL SEST DEL QUARTIERE SAN DONATO-S",23-AFFIDAMENTO DIRETTO,,,idm50229
2249,7985298C5C,01232710374,Comune di Bologna,112904.00,36916.70,"CONVENZIONE PER L'AMPLIAMENTO DELL'OFFERTA DI SEZIONI SCUOLA DELL'INFANZIA     ""ELEFANTINO BLU""  PER L' ANNO SCOLASTICO 2019/20. FRA IL COMUNE DI BOLOGNA E CONSORZIO COOPERATIVO KARABAK  . IMPEGNO DI EURO  117.420,16",23-AFFIDAMENTO DIRETTO,2019-10-16+02:00,2020-08-31+02:00,idm50244
2250,798607800D,01232710374,Comune di Bologna,108581.78,12327.57,CONVENZIONE TRA IL COMUNE DI BOLOGNA E CADIAI COOPERATIVA SOCIALE PER L'AMPLIAMENTO DELL'OFFERTA DI POSTI  NELLA SCUOLA DELL'INFANZIA POLLICINO PER L' ANNO SCOLASTICO 2019/2020. APPROVAZIONE DELLO SCHEMA DI CONVENZIONE  E  IMPEGNO DELLA SPESA COMPLE,23-AFFIDAMENTO DIRETTO,2019-10-16+02:00,2020-08-31+02:00,idm50261
2251,7985682940,01232710374,Comune di Bologna,906024.00,94084.90,"CONVENZIONE PER L'AMPLIAMENTO DELL'OFFERTA DI POSTI IN  SEZIONI DI SCUOLA DELL'INFANZIA PER GLI ANNI SCOLASTICI 2019/2020 E 2020/2021 CON LA FONDAZIONE GUALANDI PER LA SCUOLA DELL'INFANZIA AL CINEMA. IMPEGNO  DELLA SPESA COMPLESSIVA DI EURO 906.024,0",23-AFFIDAMENTO DIRETTO,2019-10-17+02:00,2021-08-31+02:00,idm50278
2252,Z062A639F7,01232710374,Comune di Bologna,700.00,140.00,"AFFIDAMENTO ALLA DITTA  GALLIERA LORENZO DEL SERVIZIO DI 5 ACCORDATURE AL PIANOFORTE STEINWAY & SONS MODELLO B 211 COLLOCATO NELLA SALA BIAGI DEL QUARTIERE SANTO STEFANO: IMPEGNO DELLA SPESA COMPLESSIVA DI EURO 700,00.",23-AFFIDAMENTO DIRETTO,,,idm50295
2253,Z982A32AB4,01232710374,Comune di Bologna,1500.00,1485.00,AFFIDAMENTO E CONTESTUALE IMPEGNO DI SPESA PER L'ACQUISTO DI MARCHE DA BOLLO PRESSO LA TABACCHERIA DONDARINI DI ROBERTO DONDARINI.,23-AFFIDAMENTO DIRETTO,2019-10-18+02:00,2019-12-31+01:00,idm50310
2254,ZB129AE3C9,01232710374,Comune di Bologna,3120.00,0.00,AFFIDAMENTO PER LA REALIZZAZIONE DI UNA CAMPAGNA FOTOGRAFICA COMPARTI ERP,23-AFFIDAMENTO DIRETTO,,,idm50327
2255,Z042Z48EEC,01232710374,Comune di Bologna,3200.00,0.00,AFFIDAMENTO ALLA DITTA CSA BONIFICHE AMIANTO CONSULENZE E SERVIZI AMBIENTALI SRL DEL SERVIZIO PER LA MAPPATURA DI RIFIUTI ABBANDONATI IN VIA DEL PILASTRO.,23-AFFIDAMENTO DIRETTO,2019-10-25+02:00,2019-12-31+01:00,idm50342
2256,ZB92A652AE,01232710374,Comune di Bologna,380.00,0.00,ACQUISTO MATERIALE  VARIO PER OFFICINA ADOLESCENTI,23-AFFIDAMENTO DIRETTO,,,idm50359
2257,Z7A2A66113,01232710374,Comune di Bologna,245.90,0.00,DIRITTI S.I.A.E. PER RIPRODUZIONE MUSICHE DURANTE EVENTI NATALIZI IN QUARTIERE SAVENA ANNO 2019,23-AFFIDAMENTO DIRETTO,,,idm50374
2258,ZEB29BCE10,01232710374,Comune di Bologna,437.49,290.97,"IMPEGNO DI SPESA DI EURO 148,79 PER I SERVIZI DOGANALI NELL'AMBITO DELLA MOSTRA MORANDI-ESQUE PRESSO CASA MORANDI.",23-AFFIDAMENTO DIRETTO,2019-09-17+02:00,2019-10-29+01:00,idm50389
2259,ZF329DF257,01232710374,Comune di Bologna,1500.00,0.00,"APPROVAZIONE DELLO SCHEMA DI CONTRATTO DI CONTO VENDITA CON EDITORI VARI E COSTITUZIONE DI IMPEGNI DI SPESA PER COMPLESSIVI EURO 9.117,90",23-AFFIDAMENTO DIRETTO,2019-09-27+02:00,2019-12-31+01:00,idm50406
2260,ZAD29DF50B,01232710374,Comune di Bologna,490.70,0.00,"APPROVAZIONE DELLO SCHEMA DI CONTRATTO DI CONTO VENDITA CON EDITORI VARI E COSTITUZIONE DI IMPEGNI DI SPESA PER COMPLESSIVI EURO 9.117,90",23-AFFIDAMENTO DIRETTO,2019-09-27+02:00,2019-12-31+01:00,idm50423
2261,Z712A31B4A,01232710374,Comune di Bologna,6995.00,0.00,"IMPEGNO DI SPESA DI EURO 12.845,00 PER L'AFFIDAMENTO A SILVANA EDITORIALE S.P.A. DELLA FORNITURA DI N. 1000 COPIE DEL CATALOGO DELLA MOSTRA ""UN PASSATO PRESENTE"" E N. 1000 COPIE DEL CATALOGO DELLA MOSTRA ""SETTECENTO VENEZIANO""",23-AFFIDAMENTO DIRETTO,2019-10-17+02:00,2020-12-31+01:00,idm50440
2262,ZE92A00FCE,01232710374,Comune di Bologna,5850.00,5850.00,"IMPEGNO DI SPESA DI EURO 12.845,00 PER L'AFFIDAMENTO A SILVANA EDITORIALE S.P.A. DELLA FORNITURA DI N. 1000 COPIE DEL CATALOGO DELLA MOSTRA ""UN PASSATO PRESENTE"" E N. 1000 COPIE DEL CATALOGO DELLA MOSTRA ""SETTECENTO VENEZIANO""",23-AFFIDAMENTO DIRETTO,2019-10-17+02:00,2019-12-31+01:00,idm50457
2263,Z932A053CF,01232710374,Comune di Bologna,250.00,0.00,"IMPEGNO DI SPESA DI EURO 250,00 PER LA REALIZZAZIONE DI UNA LEZIONE MUSICALE PER LA RASSEGNA ""NOVECENTO"" PRESSO IL MUSEO DELLA MUSICA, AFFIDATA AD ASS. CROSSING ARTS.",23-AFFIDAMENTO DIRETTO,2019-10-23+02:00,2019-12-22+01:00,idm50474
2264,Z3B2A04DBD,01232710374,Comune di Bologna,1080.00,0.00,"IMPEGNO DI SPESA DI EURO 1.080,00 PER LA REALIZZAZIONE DI LABORATORI MUSICALI PER LA RASSEGNA THE BEST OF 2019 - PARTE II PRESSO IL MUSEO DELLA MUSICA, AFFIDATA ALL'ASS. LA MUSICA INTERNA.",23-AFFIDAMENTO DIRETTO,2019-10-23+02:00,2019-12-22+01:00,idm50491
2265,Z512A6775C,01232710374,Comune di Bologna,450.00,450.00,FORNITURA DI  MATERIALE INFORMATICO PER LA SALA CONSIGLIARE DEL QUARTIERE PORTO-SARAGOZZA DI VIA DELLO SCALO 21,23-AFFIDAMENTO DIRETTO,,,idm50508
2266,Z372A565AA,01232710374,Comune di Bologna,480.00,0.00,"MPEGNO DI SPESA DI EURO 480,00 PER LA REALIZZAZIONE DI LABORATORI MUSICALI PER LA RASSEGNA THE BEST OF - II PARTE PRESSO IL MUSEO DELLA MUSICA, AFFIDATA ALL'ASS. FORMATI SENSIBILI",23-AFFIDAMENTO DIRETTO,2019-10-25+02:00,2019-12-31+01:00,idm50523
2267,Z752A67C29,01232710374,Comune di Bologna,22.85,22.85,"FORNITURA DI LIBRI DI TESTO PER LE SCUOLE PRIMARIE PER L'ANNO SCOLASTICO 2019/2020 IN ATTUAZIONE DELL'ART. 156 DEL D.LEGS, N. 297/94 E DELLA L. N. 26/2001 - IMPEGNO DELLA SPESA DI EURO 22,85PER L'ACQUISTO DI LIBRI DI TESTO DALLA LIBRERIA SCUOLAPP DI",23-AFFIDAMENTO DIRETTO,,,idm50540
2268,Z3C29ABD63,01232710374,Comune di Bologna,850.00,850.00,"CESSIONE DI DIRITTI D'AUTORE DA PARTE DI ELISABETTA ZONI PER LE TRADUZIONI DI TESTI PER LA MOSTRA 'CESARE PIETROIUSTI'. CONTESTUALI IMPEGNI DI SPESA DI EURO 850,00 PER COMPENSO E DI EURO 127,50 PER RITENUTA D'ACCONTO.",23-AFFIDAMENTO DIRETTO,2019-09-19+02:00,2019-09-27+02:00,idm50555
2269,Z9C2A19BC0,01232710374,Comune di Bologna,500.00,500.00,ACCOMPAGNAMENTO MUSICALE ALL'ECCIDIO DI CASTELDEBOLE,17-AFFIDAMENTO DIRETTO EX ART. 5 DELLA LEGGE 381/91,,,idm50572
2270,Z012A562E0,01232710374,Comune di Bologna,300.00,300.00,"IMPEGNO DI SPESA DI EURO 300,00 PER LA REALIZZAZIONE DI UN LABORATORIO MUSICALE PER LA RASSEGNA THE BEST OF 2019 - II PARTE PRESSO IL MUSEO DELLA MUSICA, AFFIDATA ALL'ASS. QB QUANTO BASTA.",23-AFFIDAMENTO DIRETTO,2019-10-25+02:00,2019-12-22+01:00,idm50587
2271,ZF529CB535,01232710374,Comune di Bologna,19350.00,19350.00,"AFFIDAMENTO A LIGHT STUDIO SAS DI ALBERTO COTTARELLI & C. DELLA FORNITURA DI MATERIALE DI ILLUMINAZIONE PER LE VETRINE DEL MUSEO DELLA MUSICA E COSTITUZIONE DEL RELATIVO SUBIMPEGNO PER EURO 23.607,00.",23-AFFIDAMENTO DIRETTO,2019-10-25+02:00,2019-11-09+01:00,idm50604
2272,0000000000,01232710374,Comune di Bologna,13597.09,0.00,PROROGA DELL'AFFIDAMENTO A FAVORE DEL CONSORZIO MARCONI WIRELESS RELATIVO AL SERVIZIO DI SUPPORTO ED ASSISTENZA TECNICA ALLE ATTIVITA' DI ANALISI DELLE PROBLEMATICHE ELETTROMAGNETICHE RELATIVE AI PROCEDIMENTI E PROGETTI IN CAPO ALL'AMMINISTRAZIONE CO,23-AFFIDAMENTO DIRETTO,2020-01-01+01:00,2020-04-30+02:00,idm50621
2273,ZA32A6A20D,01232710374,Comune di Bologna,400.00,0.00,"LABORATORIO  SKATEBOARDING - ASSOCIAZIONE CARACO' - AFFIDAMENTI DIRETTI, AI SENSI DELL'ART. 36, CO.2, LETT. A) DEL D.LGS. N. 50/2016, DI VARI SERVIZI EDUCATIVI PER PREADOLESCENTI E ADOLESCENTI NELL'AMBITO DELLE ATTIVITA' DEI CENTRI ANNI VERDI DEL COM",23-AFFIDAMENTO DIRETTO,,,idm50638
2274,Z622A6A133,01232710374,Comune di Bologna,300.00,0.00,"LABORATORIO DAL SOCIAL AL SOCIALE - AFFIDAMENTI DIRETTI, AI SENSI DELL'ART. 36, CO.2, LETT. A) DEL D.LGS. N. 50/2016, DI VARI SERVIZI EDUCATIVI PER PREADOLESCENTI E ADOLESCENTI NELL'AMBITO DELLE ATTIVITA' DEI CENTRI ANNI VERDI DEL COMUNE DI BOLOGNA E",23-AFFIDAMENTO DIRETTO,,,idm50653
2275,Z2D2A69FA9,01232710374,Comune di Bologna,300.00,0.00,"LABORATORIO - STORIE DI ARGILLA - AFFIDAMENTI DIRETTI, AI SENSI DELL'ART. 36, CO.2, LETT. A) DEL D.LGS. N. 50/2016, DI VARI SERVIZI EDUCATIVI PER PREADOLESCENTI E ADOLESCENTI NELL'AMBITO DELLE ATTIVITA' DEI CENTRI ANNI VERDI DEL COMUNE DI BOLOGNA E D",23-AFFIDAMENTO DIRETTO,,,idm50668
2276,ZE02A6A0D8,01232710374,Comune di Bologna,400.00,0.00,"LABORATORIO L'ARTE DEL MURALE - AFFIDAMENTI DIRETTI, AI SENSI DELL'ART. 36, CO.2, LETT. A) DEL D.LGS. N. 50/2016, DI VARI SERVIZI EDUCATIVI PER PREADOLESCENTI E ADOLESCENTI NELL'AMBITO DELLE ATTIVITA' DEI CENTRI ANNI VERDI DEL COMUNE DI BOLOGNA E DI",23-AFFIDAMENTO DIRETTO,,,idm50683
2277,ZB32A6A07B,01232710374,Comune di Bologna,400.00,0.00,"LABORATORIO -ORA CHE FARE -AFFIDAMENTI DIRETTI, AI SENSI DELL'ART. 36, CO.2, LETT. A) DEL D.LGS. N. 50/2016, DI VARI SERVIZI EDUCATIVI PER PREADOLESCENTI E ADOLESCENTI NELL'AMBITO DELLE ATTIVITA' DEI CENTRI ANNI VERDI DEL COMUNE DI BOLOGNA E DI OFFIC",23-AFFIDAMENTO DIRETTO,,,idm50698
2278,80503330F4,01232710374,Comune di Bologna,36708.00,0.00,Ideazione e realizzazione di servizi e prodotti di comunicazione e grafica per la redazione e la promozione del Piano Urbanistico Generale del Comune di Bologna,03-PROCEDURA NEGOZIATA PREVIA PUBBLICAZIONE,,,idm50713
2279,Z8E2A48DE1,01232710374,Comune di Bologna,7000.00,0.00,"Realizzazione del corso di formazione ""Migliorare la gestione dei dipendenti disabili"" rivolto a dipendenti del Comune di Bologna.",23-AFFIDAMENTO DIRETTO,,,idm50755
2280,ZF52A5FAEC,01232710374,Comune di Bologna,1192.80,1192.80,"AFFIDAMENTO ALLA DITTA CORPORATE EXPRESS SRL DI CASTELLETTO CERVO PER L'ACQUISTO DI ROTOLI DI CARTA TERMICA DA DESTINARE ALLE ATTREZZATURE DI AUTOPRESTITO PRESENTI NELLE BIBLIOTECHE DELL'ISTITUZIONE DEL COMUNE DI BOLOGNA, PER UN IMPORTO COMPLESSIVO D",23-AFFIDAMENTO DIRETTO,,,idm50770
2281,Z0B2A6EFB8,01232710374,Comune di Bologna,4400.00,4400.00,SMONTAGGIO E RIMONTAGGIO ALLESTIMENTO SCOUT SOSTA,23-AFFIDAMENTO DIRETTO,2019-11-05+01:00,2019-11-29+01:00,idm50785
2282,ZF22A6F22C,01232710374,Comune di Bologna,19350.00,0.00,SERVIZIO DI RIMOZIONE DEL VANDALISMO GRAFICO DI ALCUNI IMMOBILI DEL QUARTIERE PORTO-SARAGOZZA,23-AFFIDAMENTO DIRETTO,,,idm50802
2283,ZDE2A6F2AA,01232710374,Comune di Bologna,33386.00,3386.00,PROGETTO PREPAIR: AFFIDAMENTO ALLA DITTA GRAF DI PAOLO BIANCO PER L'ACQUISTO DI GADGET E ACCESSORI VARI FUNZIONALI ALLO SVOLGIMENTO DELLE ATTIVITA' DI EDUCAZIONE STRADALE DI PROMOZIONE DELLA MOBILITA' SOSTENIBILE MEDIANTE L'ACQUISTO SUL MERCATO ELET,23-AFFIDAMENTO DIRETTO,2019-11-08+01:00,2019-12-17+01:00,idm50817
