n,cig,strutturaProponente:codiceFiscaleProp,strutturaProponente:denominazione,importoAggiudicazione,importoSommeLiquidate,oggetto,sceltaContraente,tempiCompletamento:dataInizio,tempiCompletamento:dataUltimazione,lottoID
1,5165777608,01232710374,Comune di Bologna,736475.00,1050385.35,"AGGIUDICAZIONE DEFINITIVA, A SEGUITO DI PROCEDURA NEGOZIATA, DEI LAVORI PER LA REALIZZAZIONE DI 12 ALLOGGI PER OSPITARE 50 PERSONE NELLA RESIDENZA ""GANDHI"" IN VIA PIRATINO NEL Q.RE SAN DONATO, ALL'IMPRESA OMNIA IMPIANTI SRL DI S. GIOVANNI IN FIORE (C",04-PROCEDURA NEGOZIATA SENZA PREVIA PUBBLICAZIONE,,,idm3
2,5039705022,01232710374,Comune di Bologna,81640.00,77781.01,"AGGIUDICAZIONE DEFINITIVA, A SEGUITO DI PROCEDURA APERTA CON IL CRITERIO DELL'OFFERTA ECONOMICAMENTE PIU' VANTAGGIOSA AI SENSI DELL'ART. 83 DEL D.LGS. 163/06 E SS.MM.II., PER LA FORNITURA E INSTALLAZIONE DEI VARCHI DI TELECONTROLLO DEGLI ACCESSI ALLA",01-PROCEDURA APERTA,,,idm50
3,5181241F51,01232710374,Comune di Bologna,64391791.30,46711842.26,"ADESIONE ALLA CONVENZIONE CONSIP ""SERVIZIO LUCE 2"" PER LA GESTIONE DEGLI IMPIANTI DI ILLUMINAZIONE PUBBLICA, DEI SEMAFORI E DEGLI IMPIANTI TECNOLOGICI A SERVIZIO DEL TUNNEL RAVONE",26-AFFIDAMENTO DIRETTO IN ADESIONE AD ACCORDO QUADRO/CONVENZIONE,,,idm68
4,46517097B2,01232710374,Comune di Bologna,540600.00,410244.00,GESTIONE E MANUTENZIONE STRAORDINARIA IMPIANTO SPORTIVO DI QUARTIERE G. BERNARDI,01-PROCEDURA APERTA,,,idm83
5,5237361704,01232710374,Comune di Bologna,41893429.83,35313239.01,Procedura aperta per l'affidamento del servizio quinquennale di manutenzione del patrimonio verde comunale.,01-PROCEDURA APERTA,2014-05-19+02:00,2019-05-18+02:00,idm98
6,512104867E,01232710374,Comune di Bologna,13633685.49,47902825.63,"Procedura aperta per l'affidamento del servizio di manutenzione quinquennale del patrimonio stradale, strade e segnaletica e del servizio neve.",01-PROCEDURA APERTA,,,idm146
7,55011951BA,01232710374,Comune di Bologna,801177.25,730595.26,Fornitura inerente il potenziamento del sistema di telecontrollo dei transiti alle corsie preferenziali (RITA) e degli accessi alla zona a traffico limitato (SIRIO) della zona ad alta pedonabilità e di alcune aree pedonali (ZAP),01-PROCEDURA APERTA,,,idm183
8,5224773313,01232710374,Comune di Bologna,1750000.00,1151062.78,"GARA FINALIZZATE ALLA CONCESSIONE DELLA GESTIONE, SENZA RILEVANZA ECONOMICA CON MODALITA' A BUDGET, DEL CENTRO SPORTIVO BARCA POSTO IN BOLOGNA,  VIA R. SANZIO 6-8,  PER IL PERIODO 1/1/2014 - 31/12/2022",01-PROCEDURA APERTA,,,idm211
9,522465300D,01232710374,Comune di Bologna,691200.00,454775.00,"GARA FINALIZZATE ALLA CONCESSIONE DELLA GESTIONE, SENZA RILEVANZA ECONOMICA CON MODALITA' A BUDGET, DEL CENTRO SPORTIVO CAVINA POSTO IN BOLOGNA,  VIA BIANCOLELLI N. 36 - PER IL PERIODO 1/1/2014 - 31/12/2022.",01-PROCEDURA APERTA,,,idm226
10,Z500D3ED40,01232710374,Comune di Bologna,3135.40,3135.00,AFFIDAMENTO ALLA SOCIETA' GLOBAL NETWORK ENGINEERING S.R.L. DELLA MANUTENZIONE TECNICA DI DUE POSTAZIONI PER L'EMISSIONE DI CARTA DI IDENTITA' ELETTRONICA,23-AFFIDAMENTO DIRETTO,,,idm241
11,50888056BA,01232710374,Comune di Bologna,334876719.89,429143818.99,IMPEGNO DI SPESA PER LA GESTIONE DEI SERVIZI DI NETTEZZA URBANA CON HERA,26-AFFIDAMENTO DIRETTO IN ADESIONE AD ACCORDO QUADRO/CONVENZIONE,,,idm256
12,5477007926,01232710374,Comune di Bologna,2747467.80,2112470.26,Servizio di trasporto scolastico collettivo del Comune di Bologna. Anni scolastici dal 2014/2015 al 2019/2020,04-PROCEDURA NEGOZIATA SENZA PREVIA PUBBLICAZIONE,2014-09-08+02:00,,idm271
13,57354345DC,01232710374,Comune di Bologna,2199796.72,1014004.33,"CONVENZIONE PER I SERVIZI DI GESTIONE ORDINARIA, ACCERTAMENTO E SUPPORTO ALLA RISCOSSIONE ORDINARIA E COATTIVA DIRETTA DEI TRIBUTI E DELLE ENTRATE COMUNALI STIPULATA FRA INTERCENT-ER E IL R.T.I. FORMATO DALLE IMPRESE ENGINEERING TRIBUTI S.P.A (MANDAT",26-AFFIDAMENTO DIRETTO IN ADESIONE AD ACCORDO QUADRO/CONVENZIONE,2014-04-29+02:00,,idm287
14,5728152C8E,01232710374,Comune di Bologna,1562773.75,1829664.50,"Servizio di gestione e manutenzione degli impianti speciali (antintrusione, tv circuito chiuso, rilevazione e segnalazione incendi) installati nei fabbricati comunali, e servizio di centrale operativa e vigilanza - durata pluriennale",01-PROCEDURA APERTA,2014-10-01+02:00,,idm317
15,5713860A6D,01232710374,Comune di Bologna,683356.30,246648.23,"SERVIZIO DI LAVANDERIA DEI CAPI DI VESTIARIO IN DOTAZIONE AL CORPO DI POLIZIA MUNICIPALE E SERVIZIO DI PICCOLA SARTORIA,  PER UNA DURATA CONTRATTUALE DI CINQUE ANNI.",01-PROCEDURA APERTA,2014-10-28+01:00,,idm349
16,52581266D6,01232710374,Comune di Bologna,850000.00,3356367.87,GESTIONE DEI SERVIZI CIMITERIALI E FUNERARI,03-PROCEDURA NEGOZIATA PREVIA PUBBLICAZIONE,,,idm365
17,520547912A,01232710374,Comune di Bologna,152893.95,161800.00,AGGIUDICAZIONE DELLA CONCESSIONE IN GESTIONE SENZA RILEVANZA ECONOMICA DEL CENTRO POLISPORTIVO PILASTRO DEL TERRITORIO DEL QUARTIERE SAN DONATO AL COSTITUENDO RTI FORMATO DA PROMOTER SPORT SCSD (MANDATARIA) E FORTITUDO RUGBY BOLOGNA ASD (MANDANTE) PE,01-PROCEDURA APERTA,2014-10-10+02:00,2016-08-31+02:00,idm380
18,6009139260,01232710374,Comune di Bologna,0.00,77591705.79,"Servizio pluriennale  per la gestione impianti tecnologici, manutenzione delle strutture edili, climatizzazione ed energia degli immobili destinati ad attività scolastica, ad uffici giudiziari, musei, biblioteche ed altri immobili di importanza citta",01-PROCEDURA APERTA,2015-05-31+02:00,,idm397
19,5814181DEE,01232710374,Comune di Bologna,61019.70,57120.78,"AGGIUDICAZIONE DEFINITIVA, A SEGUITO DI PROCEDURA NEGOZIATA, ALL'ING. VECCHI FEDERICO DELL'INCARICO PROFESSIONALE DI SUPPORTO AL R.U.P. PER LA GESTIONE DELLA SICUREZZA NEL CONTRATTO DI SERVIZIO PER LA MANUTENZIONE DEL PATRIMONIO COMUNALE DEL VERDE PU",04-PROCEDURA NEGOZIATA SENZA PREVIA PUBBLICAZIONE,2014-08-05+02:00,2016-12-31+01:00,idm433
20,ZDF123C563,01232710374,Comune di Bologna,3650.00,2904.83,"AFFIDAMENTO DIRETTO AI SENSI DELL'ART. 125, COMMA 11 DEL D.LGS.N. 163/2006 DEI SERVIZI DI RIPARAZIONE E MANUTENZIONE DI ATTREZZATURE PER I NIDI D'INFANZIA, ALLE DITTE RASPANTI DI PASINI MAURO, STANZANI LORIS E GOTTARDI GIULIANO E C. S.N.C., BERTOCCHI",23-AFFIDAMENTO DIRETTO,2015-01-01+01:00,2015-12-31+01:00,idm459
21,6068164757,01232710374,Comune di Bologna,464300.00,440531.97,LAVORI DI RISTRUTTURAZIONE ED ADEGUAMENTO NORMATIVO DEL FABBRICATO SITO IN VIA COLOMBAROLA N. 42 DA DESTINARE A COMUNITA’ SEMIRESIDENZIALE PER MINORI,04-PROCEDURA NEGOZIATA SENZA PREVIA PUBBLICAZIONE,2015-05-19+02:00,,idm476
22,620221126E,01232710374,Comune di Bologna,66140064.00,56292110.38,"SERVIZIO DI REFEZIONE SCOLASTICA PER LE SCUOLE D’INFANZIA, SCUOLE  PRIMARIE E SCUOLE SECONDARIE DI PRIMO GRADO TRAMITE ACQUISTO DI RAMO D’AZIENDA E GESTIONE DEI CENTRI PRODUZIONE PASTI COMUNALI",01-PROCEDURA APERTA,2015-09-01+02:00,,idm517
23,626619320C,01232710374,Comune di Bologna,645035.61,320457.03,"CONCESSIONE DELLA GESTIONE DEL NIDO D’INFANZIA ""IL GIARDINO SEGRETO""",01-PROCEDURA APERTA,,,idm544
24,6266206CC3,01232710374,Comune di Bologna,2079000.00,1167156.36,"CONCESSIONE DELLA GESTIONE DEL SERVIZIO EDUCATIVO E SCOLASTICO DENOMINATO ""PROGETTO UNOSEI""",01-PROCEDURA APERTA,,,idm559
25,63362273EE,01232710374,Comune di Bologna,10140000.00,8698160.67,Servizi pluriennali di manutenzione e assistenza informatica,01-PROCEDURA APERTA,2016-02-01+01:00,,idm574
26,6335598CDA,01232710374,Comune di Bologna,475048.85,550090.46,Polizza All Risks,01-PROCEDURA APERTA,,,idm598
27,63356106C3,01232710374,Comune di Bologna,308000.00,461030.00,Polizza Responsabilità Civile verso Terzi e prestatori d'Opera,01-PROCEDURA APERTA,,,idm613
28,6003425707,01232710374,Comune di Bologna,141333.30,167849.55,"Servizio per la manutenzione dei segnali inerenti l'informazione toponomastica, la numerazione civica e la numerazione interna nell'intero territorio del Comune di Bologna",04-PROCEDURA NEGOZIATA SENZA PREVIA PUBBLICAZIONE,2015-10-19+02:00,2018-10-18+02:00,idm628
29,6420618D93,01232710374,Comune di Bologna,3949076.39,1901594.63,Lavori di recupero della Tettoia Nervi e dei servizi pubblici correlati (edificio polifunzionale) localizzati all'interno della Z.I.S. - R 5.2 Zona Navile - Ex Mercato Ortofrutticolo,01-PROCEDURA APERTA,2016-09-28+02:00,,idm669
30,6414728102,01232710374,Comune di Bologna,548337.80,322954.95,"ADESIONE ALLA CONVENZIONE CONSIP ""APPARECCHIATURE MULTIFUNZIONE 24 - NOLEGGIO""
PER IL SERVIZIO DI NOLEGGIO APPARECCHIATURE MULTIFUNZIONE PER IL COMUNE DI BOLOGNA 2016-2020.",26-AFFIDAMENTO DIRETTO IN ADESIONE AD ACCORDO QUADRO/CONVENZIONE,2016-01-01+01:00,2020-12-31+01:00,idm789
31,6438997C68,01232710374,Comune di Bologna,497040.00,395643.84,Sostituzione e miglioramento apparati telecontrollo traffico,01-PROCEDURA APERTA,2016-05-31+02:00,2016-11-30+01:00,idm806
32,64940091C2,01232710374,Comune di Bologna,1950139.56,1910067.24,PROCEDURA APERTA PER L’APPALTO DEL SERVIZIO DI DIGITALIZZAZIONE DEGLI ARCHIVI DELLE PRATICHE EDILIZIE ED URBANISTICHE DEL COMUNE DI BOLOGNA . DURATA DELL’APPALTO: 30 MESI,01-PROCEDURA APERTA,2016-09-08+02:00,2020-04-02+02:00,idm831
33,650124229E,01232710374,Comune di Bologna,5600.00,3912.60,"ADESIONE ALLA CONVENZIONE CONSIP ""APPARECCHIATURE MULTIFUNZIONE 24 - NOLEGGIO""
PER IL SERVIZIO DI NOLEGGIO APPARECCHIATURA MULTIFUNZIONE A COLORI PER IL COMUNE DI BOLOGNA 2016-2020.",26-AFFIDAMENTO DIRETTO IN ADESIONE AD ACCORDO QUADRO/CONVENZIONE,2016-01-01+01:00,2020-12-31+01:00,idm854
34,65483193C9,01232710374,Comune di Bologna,910746.29,995856.93,"Servizio per gli interventi larvicidi ed adulticidi per la lotta alla zanzara tigre, derattizzazione e disinfestazione contro altri infestanti, contenimento di altri animali sinantropi in aree di pertinenza comunale nel territorio del Comune di Bolog",01-PROCEDURA APERTA,2016-06-01+02:00,2019-12-31+01:00,idm871
35,65562840B7,01232710374,Comune di Bologna,1207030.00,606102.11,Realizzazione dell'edificio Centro di Produzione Pasti Lazzaretto e opere funzionali all'accessibilità - Corpo 2 - Realizzazione edificio al grezzo,01-PROCEDURA APERTA,2018-06-06+02:00,,idm894
36,6515407BEF,01232710374,Comune di Bologna,294315.35,349055.65,RIQUALIFICAZIONE URBANA IN VIA DEL ROSARIO/TREBBO 12,03-PROCEDURA NEGOZIATA PREVIA PUBBLICAZIONE,2016-06-13+02:00,2017-10-17+02:00,idm979
37,ZC9186E1E9,01232710374,Comune di Bologna,3872.37,3659.81,"ORGANIZZAZIONE DI VIAGGIO E SOGGIORNO PER LA PARTECIPAZIONE DI UNA DELEGAZIONE DELLA CITTA' DI BOLOGNA AD UNO SCAMBIO DI COLLABORAZIONE CON LA CITTA' GIAPPONESE DI HAMAMATSU, NELL'AMBITO DELLE INIZIATIVE DI BOLOGNA CITTA' CREATIVA DELLA MUSICA UNESCO",23-AFFIDAMENTO DIRETTO,,,idm1017
38,6443591B7F,01232710374,Comune di Bologna,47285.00,47285.00,"AFFIDAMENTO DI UN'ATTIVITA' DI MANUTENZIONE DI UN SISTEMA DI NR. 5 PANNELLI INFORMATIVI A MESSAGGIO VARIABILE RELATIVI ALLA ZONA UNIVERSITARIA E LA COSIDDETTA ""T"" E FORNITURA DI RELATIVA PIATTAFORMA DI GESTIONE NONCHE' DI UN SISTEMA DI NR. 9 PANNELLI",04-PROCEDURA NEGOZIATA SENZA PREVIA PUBBLICAZIONE,2016-02-10+01:00,2016-12-31+01:00,idm1032
39,65645283EO,01232710374,Comune di Bologna,6114.14,58084.14,"Rinnovo concessione in gestione impianto sportivo ""Barbieri""",01-PROCEDURA APERTA,2016-01-01+01:00,2017-12-31+01:00,idm1049
40,Z39185F410,01232710374,Comune di Bologna,6529.57,6529.57,FORNITURA PUBBLICAZIONI BIBLIOTECHE,23-AFFIDAMENTO DIRETTO,,,idm1066
41,6623728941,01232710374,Comune di Bologna,963135.00,890676.05,"SERVIZIO DI FACCHINAGGIO, TRASPORTO, TRASLOCO DI BENI MOBILI PRESSO UFFICI COMUNALI E STRUTTURE SCOLASTICHE ED EDUCATIVE 01/04/2016 - 30/03/2019",26-AFFIDAMENTO DIRETTO IN ADESIONE AD ACCORDO QUADRO/CONVENZIONE,2016-04-01+02:00,2019-03-31+02:00,idm1081
42,6638174A78,01232710374,Comune di Bologna,243046.18,252808.93,Centri di aggregazione per ragazze e ragazzi dagli 11 ai 18 anni,01-PROCEDURA APERTA,,,idm1098
43,6638180F6A,01232710374,Comune di Bologna,307681.40,357268.05,Educativa di strada per ragazze e ragazzi dagli 11 ai 18 anni,01-PROCEDURA APERTA,,,idm1123
44,6655729153,01232710374,Comune di Bologna,39481454.71,3397146.92,CONCESSIONE DEL SERVIZIO DI GESTIONE INTEGRATA DELLE ATTIVITA' SPORTIVE AGONISTICHE E DILETTANTISTICHE E LA GESTIONE TECNICA E FUNZIONALE DEGLI IMPIANTI SPORTIVI PER IL NUOTO DEL COMUNE DI BOLOGNA,01-PROCEDURA APERTA,2016-09-01+02:00,2041-06-30+02:00,idm1156
45,6663909FA8,01232710374,Comune di Bologna,11333.60,7070.96,"COLLAUDO STATICO E TECNICO AMMINISTRATIVO, IN CORSO D'OPERA, NELL'AMBITO DELLA REALIZZAZIONE SCUOLA SECONDARIA DI PRIMO GRADO IN VIA LOMBARDIA, Q.RE SAVENA",04-PROCEDURA NEGOZIATA SENZA PREVIA PUBBLICAZIONE,2016-10-10+02:00,2018-02-16+01:00,idm1195
46,669645055A,01232710374,Comune di Bologna,70916.18,69365.60,"Affidamento del servizio biennale della manutenzione della parte meccanica di dispositivi tecnologici ITS (Intelligent Traffic System) per il controllo e monitoraggio del traffico (dissuasori mobili, rilevatori di velocità e armadi stars).",04-PROCEDURA NEGOZIATA SENZA PREVIA PUBBLICAZIONE,2016-07-21+02:00,2018-07-20+02:00,idm1224
47,Z3E1ADBE85,01232710374,Comune di Bologna,25475.41,16452.94,"PROROGA DELLA CONCESSIONE IN GESTIONE, SENZA RILEVANZA ECONOMICA, DELL'IMPIANTO SPORTIVO 'CENTRO SPORTIVO SAN DONATO'SITO IN BOLOGNA VIA BERTINI 9/2 A PROMOTER SPORT SCSD FINO AL 31/12/2018 E CONTESTUALE IMPEGNO DI EURO 19.425,00.= CAPITOLO U30850-00",01-PROCEDURA APERTA,2016-07-01+02:00,2020-06-30+02:00,idm1241
48,67908789CC,01232710374,Comune di Bologna,211885.25,205698.65,AFFIDAMENTO SERVIZI DI VIGILANZA  IN SALA BORSA ALLA DITTA COOPSERVICE PERIODO SETTEMBRE 2016/DICEMBRE 2018. - PGN. 286798/2016 - ORDINI 4500100319 - 4500100328 - 4500100329.,26-AFFIDAMENTO DIRETTO IN ADESIONE AD ACCORDO QUADRO/CONVENZIONE,2016-09-01+02:00,2018-12-31+01:00,idm1255
49,Z151B37131,01232710374,Comune di Bologna,35000.62,35000.60,"PROROGA DELLA CONCESSIONE IN GESTIONE, SENZA RILEVANZA ECONOMICA, DELL'IMPIANTO SPORTIVO 'UBALDO TAMBURINI' SITO A BOLOGNA IN VIA SCANDELLARA 52/3 FINO AL 31/12/2018 E CONTESTUALE IMPEGNO DI EURO 42.700,76.= CAPITOLO U30850-000 BILANCI 2016-2018.",02-PROCEDURA RISTRETTA,2016-09-16+02:00,2018-08-31+02:00,idm1272
50,ZC51B7299A,01232710374,Comune di Bologna,4850.00,4850.00,ESTENSIONE DELLA MAN A SUPPORTO DEL SISTEMA DI VIDEOSORVEGLIANZA CITTADINO,24-AFFIDAMENTO DIRETTO A SOCIETA' IN HOUSE,,,idm1289
51,6825612136,01232710374,Comune di Bologna,0.00,113288.40,"Affidamento in finanza di progetto artt 179 co 3 e 183 del D.lgs 50/2016,  della Concessione di servizi relativa alla gestione del Centro Sportivo Biavati - Qre Navile",01-PROCEDURA APERTA,2017-01-31+01:00,,idm1304
52,6834486C41,01232710374,Comune di Bologna,150000.00,150000.00,"SERVIZI COMPLEMENTARI NELL'AMBITO DEL CONTRATTO DI APPALTO DEL SERVIZIO DI CUSTODIA, GESTIONE E MOVIMENTAZIONE DELLE PRATICHE EDILIZIE DEL COMUNE DI BOLOGNA",04-PROCEDURA NEGOZIATA SENZA PREVIA PUBBLICAZIONE,2016-12-13+01:00,2018-03-31+02:00,idm1320
53,6764205E89,01232710374,Comune di Bologna,5439344.26,5416912.38,"ADESIONE ALLA CONVENZIONE ""SERVIZIO DI PULIZIA,SANIFICAZIONE,SE SERVIZI AUSILIARI 4"" STIPULATA FRA AGENZIA REGIONALE INTERCENT-ER E RAGGRUPPAMENTO DI IMPRESE CNS-CICLAT PER UFFICI E SERVIZI COMUNALI PER IL PERIODO 01/08/2016-31/07/2019",26-AFFIDAMENTO DIRETTO IN ADESIONE AD ACCORDO QUADRO/CONVENZIONE,2016-08-01+02:00,2019-07-31+02:00,idm1337
54,6762885D3D,01232710374,Comune di Bologna,97332.00,97076.96,"ADESIONE ALLA CONVENZIONE STIPULATA DA INTERCENTER-ER DENOMINATA ""PRODOTTI CARTARI E DETERGENTI, ACCESSORI PER COMUNITA' E ACCESSORI PER LA CONSUMAZIONE DEI PASTI 3"" LOTTO 2 PER FORNITURE DA DESTINARE AI NIDI, C.B.G. E ALCUNE SCUOLE D'INFANZIA",26-AFFIDAMENTO DIRETTO IN ADESIONE AD ACCORDO QUADRO/CONVENZIONE,,,idm1354
55,ZE71B9629D,01232710374,Comune di Bologna,2901.79,3165.01,"ADESIONE ALLA CONVENZIONE STIPULATA DA INTERCENT ER ""NOLEGGIO FOTOCOPIATRICI DIGITALI 5"" PER IL NOLEGGIO DI UNA FOTOCOPIATRICE MULTIFUNZIONE MONOCROMATICA KYOCERA 3510I CON DURATA 36 MESI",26-AFFIDAMENTO DIRETTO IN ADESIONE AD ACCORDO QUADRO/CONVENZIONE,,,idm1369
56,6834291B56,01232710374,Comune di Bologna,216918.00,154497.13,"ADESIONE ALLA CONVENZIONE PER LA FORNITURA DI PANNOLINI MONOUSO STIPULATA DA INTERCENT-ER DENOMINATA ""AUSILI PER INCONTINENZA ED ASSORBENZA 2"" LOTTO 6 ""FORNITURA DI PANNOLINI PER I NIDI COMUNALI PER L'INFANZIA"", PER IL FABBISOGNO DEI NIDI DI INFANZIA",26-AFFIDAMENTO DIRETTO IN ADESIONE AD ACCORDO QUADRO/CONVENZIONE,,,idm1384
57,68408331FA,01232710374,Comune di Bologna,0.00,138839.23,"Affidamento in finanza di progetto artt 179 co 3 e 183 del D. lgs 50/2016,  della Concessione di servizi relativa alla gestione del Circolo ricreativo, culturale e sportivo ""Il Fossolo"" - Quartiere Savena",01-PROCEDURA APERTA,2017-05-02+02:00,,idm1399
58,ZD81C21EF1,01232710374,Comune di Bologna,2446.72,2282.78,SERVIZI DI ALLACCIAMENTO ALLA RETE ELETTRICA DELLE TELECAMERE DERIVANTI DAL PROGETTO DI VIDEOSORVEGLIANZA,23-AFFIDAMENTO DIRETTO,,,idm1420
59,Z691B873BC,01232710374,Comune di Bologna,9800.59,9800.59,UNIVERSITA' VERDE DI BOLOGNA - SERVIZI PER REALIZZAZIONE PROGETTO RAINBO LIFE,23-AFFIDAMENTO DIRETTO,2016-10-14+02:00,,idm1435
60,68765081EB,01232710374,Comune di Bologna,496161.56,497663.90,"Bando di gara per l'affidamento dei seguenti lavori a misura: ""Lavori di Potenziamento, riqualificazione e manutenzione straordinaria segnaletica stradale - attuazione ordinanze""",01-PROCEDURA APERTA,2017-05-15+02:00,2018-05-25+02:00,idm1451
61,ZD21BE21A3,01232710374,Comune di Bologna,6525.11,6332.09,ABBONAMENTI ANNUALI PUBBLICAZIONI PER BIBLIOTECHE ISTITUZIONE,04-PROCEDURA NEGOZIATA SENZA PREVIA PUBBLICAZIONE,,,idm1820
62,6880007960,01232710374,Comune di Bologna,5797568.64,4679053.54,Servizi di gestione del pubblico e del patrimonio documentario,01-PROCEDURA APERTA,,,idm1835
63,68800279E1,01232710374,Comune di Bologna,539420.65,434511.77,Servizi di catalogazione,01-PROCEDURA APERTA,,,idm1877
64,ZC31BA3A6B,01232710374,Comune di Bologna,18052.64,16372.72,"DETERMINAZIONE A CONTRARRE PER L'AFFIDAMENTO DIRETTO DEL SERVIZIO DI TRASMISSIONE RADIOFONICA DELLE SEDUTE CONSILIARI. PERIODO 1 GENNAIO 2017 - 31 DICEMBRE 2018 CON CONTESTUALE IMPEGNO DI SPESA DI 22.448,00 (O.F.I.)",02-PROCEDURA RISTRETTA,2017-01-01+01:00,2017-12-31+01:00,idm1898
65,ZB71C3A80A,01232710374,Comune di Bologna,10916.75,24658.07,"PRENOTAZIONE DI IMPEGNO PER LA FORNITURA DI PERIODICI ITALIANI E STRANIERI TRAMITE EDICOLA PER L'ISTITUZIONE BIBLIOTECHE DEL COMUNE DI BOLOGNA PER GLI ANNI 2017 E 2018 PER L'IMPORTO COMPLESSIVO DI SPESA DI EURO 25.500,00. APPROVAZIONE DEL RELATIVO AV",01-PROCEDURA APERTA,2017-01-01+01:00,2018-12-31+01:00,idm1915
66,68880338A4,01232710374,Comune di Bologna,479836.06,104195.02,ACQUISTO CALZATURE PER POLIZIA MUNICIPALE,23-AFFIDAMENTO DIRETTO,2016-12-13+01:00,,idm1932
67,683129207F,01232710374,Comune di Bologna,10520.00,10960.00,INCARICO DI COLLAUDATORE TECNICO AMMINISTRATIVO IN CORSO D'OPERA NELL'AMBITO DELL'INTERVENTO DI RECUPERO DELLA TETTOIA NERVI E DEI SERVIZI PUBBLICI CORRELATI (EDIFICIO POLIFUNZIONALE) LOCALIZZATI ALL'INTERNO DELLA Z.I.S. R.5.2. ZONA NAVILE - EX MERCA,04-PROCEDURA NEGOZIATA SENZA PREVIA PUBBLICAZIONE,2016-12-29+01:00,,idm1948
68,688529552D,01232710374,Comune di Bologna,1679482.69,1658425.47,Lavori di consolidamento del coperto del Museo Civico Archeologico - Via dei Musei 8 - Bologna,01-PROCEDURA APERTA,2017-09-01+02:00,,idm1975
69,Z981C5D85B,01232710374,Comune di Bologna,1278.68,1278.68,"AFFIDAMENTO ALL'ASSOCIAZIONE MACIGNO ITALIA - VOLONTARI PER L'AMBIENTE DELLA TUTELA E MANUTENZIONE DELL'AREA VERDE DI PROPRIETA' COMUNALE DENOMINATA STAGNO DIDATTICO, SITA ALL'INTERNO DEI GIARDINI MARGHERITA, DAL 01/01/2017 AL 31/12/2018, PER COMPLES",23-AFFIDAMENTO DIRETTO,2017-01-02+01:00,2018-12-31+01:00,idm2135
70,6885265C69,01232710374,Comune di Bologna,1067254.18,986486.47,Intervento di ripristino di parte delle coperture e di consolidamento e restauro di taluni dei paramenti murari e degli elementi di rivestimento e decorativi litici di Palazzo d'Accursio,01-PROCEDURA APERTA,2017-10-19+02:00,,idm2152
71,687655370C,01232710374,Comune di Bologna,67000.00,66999.92,NOLEGGIO BIENNALE DELLA SOLUZIONE STONESOFT NEXT GENERATION FIREWALL,22-PROCEDURA NEGOZIATA CON PREVIA INDIZIONE DI GARA (SETTORI SPECIALI),2017-01-01+01:00,2018-12-31+01:00,idm2217
72,ZE41BBEECC,01232710374,Comune di Bologna,8196.00,8196.00,DITTA JANUS SRL - SITO INTERNET PROGETTO EUROPEO RAINBO LIFE,23-AFFIDAMENTO DIRETTO,2016-12-15+01:00,2018-11-30+01:00,idm2234
73,ZA51CBAE2C,01232710374,Comune di Bologna,30000.00,168.30,SERVIZIO DI AFFRANCATURA E NOTIFICAZIONE DI ATTI GIUDIZIARI NON RICOMPRESI NEL SERVIZIO DELLA POSTALIZZAZIONE,23-AFFIDAMENTO DIRETTO,,,idm2251
74,ZA31C65DB9,01232710374,Comune di Bologna,16889.00,15200.10,REALIZZAZIONE DEL NUOVO LAYOUT DELLA PAGINA WEB UTILIZZATA PER LA NAVIGAZIONE ALL'INTERNO DELLA STRUTTURA NORMATIVA E CARTOGRAFICA DEGLI STRUMENTI URBANISTICI DEL COMUNE DI BOLOGNA,22-PROCEDURA NEGOZIATA CON PREVIA INDIZIONE DI GARA (SETTORI SPECIALI),,,idm2266
75,Z091CD8FB2,01232710374,Comune di Bologna,180.00,180.00,ATTIVAZIONE DEL BOLLETTINO REPORT GOLD,23-AFFIDAMENTO DIRETTO,,,idm2281
76,67668472CC,01232710374,Comune di Bologna,160000.00,87785.00,Servizio di supporto al mantenimento ed alla gestione del sistema di controllo del traffico della città di Bologna (U.T.O.P.I.A.),04-PROCEDURA NEGOZIATA SENZA PREVIA PUBBLICAZIONE,,,idm2296
77,Z891CC7581,01232710374,Comune di Bologna,34398.00,20003.09,VIGILANZA ARMATA SEDI ISTITUZIONE BOLOGNA MUSEI,04-PROCEDURA NEGOZIATA SENZA PREVIA PUBBLICAZIONE,,,idm2311
78,Z191D0B608,01232710374,Comune di Bologna,35000.00,35000.00,ARPAE - RINNOVO CONVENZIONE MONITORAGGIO QUALITA' DELL'ARIA,26-AFFIDAMENTO DIRETTO IN ADESIONE AD ACCORDO QUADRO/CONVENZIONE,2017-01-23+01:00,2018-12-12+01:00,idm2326
79,Z9A1CFA6E5,01232710374,Comune di Bologna,136.36,136.36,OSPITALITA' AI COMPONENTI DELLA DELEGAZIONE DEL MUSEO STATALE DI RUSSIA IN VISITA AL MAMBO,04-PROCEDURA NEGOZIATA SENZA PREVIA PUBBLICAZIONE,,,idm2343
80,6965994818,01232710374,Comune di Bologna,182429.85,195808.04,"ADESIONE ALL'ACCORDO QUADRO ""ORACLE COMMUNITY NETWORK CON LICENZE ILLIMITATE"" PROMOSSO DA LEPIDA S.P.A. PER GLI ENTI DEL PERIMETRO REGIONALE (TRIENNIO 2017-2019)",24-AFFIDAMENTO DIRETTO A SOCIETA' IN HOUSE,,,idm2358
81,Z801D44C0F,01232710374,Comune di Bologna,9900.00,9900.00,ACQUISIZIONE DIRETTA DAL MEPA CONSIP DI PROGRAMMI INFORMATICI ARC MAP PER LE ESIGENZE DI GESTIONE DEL PATRIMONIO ABITATIVO E DELL'AREA PROGRAMMAZIONE CONTROLLI E STATISTICA DEL COMUNE DI BOLOGNA,23-AFFIDAMENTO DIRETTO,,,idm2373
82,ZF61CD1D21,01232710374,Comune di Bologna,1143.10,1143.10,"TUTELA E MANUTENZIONE DELLE AREE DI  VERDE PUBBLICO SITE IN VIA ZANARDI CIV. 232 / 244 DENOMINATA ""VAPORINO"" ED IN VIA ZANARDI 228/C  ALL’INTERNO DEL CENTRO SPORTIVO ""PIZZOLI""",23-AFFIDAMENTO DIRETTO,2017-02-10+01:00,2017-06-30+02:00,idm2388
83,6966289B88,01232710374,Comune di Bologna,74523.12,75322.80,"ADESIONE ALLA CONVENZIONE INTERCENT-ER ""TONER ORIGINALI"" STIPULATA CON LA DITTA LA TECNICA S.P.A. PER LA FORNITURA DI TONER PER IL COMUNE DI BOLOGNA E LE SUE ISTITUZIONI.",26-AFFIDAMENTO DIRETTO IN ADESIONE AD ACCORDO QUADRO/CONVENZIONE,2017-02-09+01:00,2019-11-11+01:00,idm2405
84,6966243594,01232710374,Comune di Bologna,124067.05,19540.25,ADESIONE ALLA CONVENZIONE INTERCENT-ER 'TONER RIGENERATI' STIPULATA CON LA DITTA LYRECO ITALIA S.R.L. PER LA FORNITURA DI TONER PER IL COMUNE DI BOLOGNA E LE SUE ISTITUZIONI,26-AFFIDAMENTO DIRETTO IN ADESIONE AD ACCORDO QUADRO/CONVENZIONE,2017-02-09+01:00,2019-11-15+01:00,idm2422
85,ZAA1DB0551,01232710374,Comune di Bologna,35000.00,33918.72,SERVIZIO DI GESTIONE STAMPE PER IL SISTEMA CENTRALE DI ELABORAZIONE DATI FINO AL 31.12.2017,04-PROCEDURA NEGOZIATA SENZA PREVIA PUBBLICAZIONE,,,idm2439
86,6998557FEC,01232710374,Comune di Bologna,286380.31,269199.17,"Servizio di progettazione definitiva ed esecutiva inerente l'intervento di consolidamento, riqualificazione e adeguamento del ponte stradale sul fiume Reno denominato Pontelungo: reindizione di gara a seguito di precedente procedura deserta",01-PROCEDURA APERTA,2017-12-12+01:00,,idm2454
87,6902149988,01232710374,Comune di Bologna,72276.60,72306.60,ASS. TECNOSCIENZA.IT - SHOW ROOM ENERGIA E AMBIENTE,22-PROCEDURA NEGOZIATA CON PREVIA INDIZIONE DI GARA (SETTORI SPECIALI),2017-03-09+01:00,2018-12-31+01:00,idm2508
88,700642901F,01232710374,Comune di Bologna,26175706.20,24802569.45,"PROCEDURA APERTA PER L’AGGIUDICAZIONE DEI SERVIZI EDUCATIVI PER L'INCLUSIONE SCOLASTICA DEGLI ALUNNI DISABILI, DEI SERVIZI DI PREVENZIONE EDUCATIVA/PEDAGOGICA E  DEI SERVIZI EDUCATIVI INTEGRATIVI SCOLASTICI NEL PERIODO SETTEMBRE 2017 – SETTEMBRE 2020",01-PROCEDURA APERTA,2017-09-07+02:00,,idm2525
89,702012780F,01232710374,Comune di Bologna,255937.50,256817.95,ACQUISIZIONE DI SERVIZI DI SUPPORTO TECNOLOGICO PER ESIGENZE DI EVOLUZIONE DELLA RETE DATI DEL COMUNE PER LA DURATA DI 1 ANNO CON DECORRENZA 1° APRILE 2017.,24-AFFIDAMENTO DIRETTO A SOCIETA' IN HOUSE,,,idm2554
90,Z001E12E2C,01232710374,Comune di Bologna,5483.61,3655.74,ACQUISIZIONE DI SERVIZI DI DATA CENTER PER IL NETWORK METROPOLITANO DELL'INFORMAGIOVANI MULTITASKING FLASHGIOVANI FINO AL 31 DICEMBRE 2019,24-AFFIDAMENTO DIRETTO A SOCIETA' IN HOUSE,,,idm2569
91,7031386349,01232710374,Comune di Bologna,2452921.25,1232803.43,"PROCEDURA APERTA PER L’AGGIUDICAZIONE DEL SERVIZIO DI ACCOMPAGNAMENTO SCOLASTICO RIVOLTO A BAMBINI DISABILI RESIDENTI NEL COMUNE DI BOLOGNA, NELL'AMBITO DEL DIRITTO ALLO STUDIO. PERIODO SETTEMBRE 2017/ AGOSTO 2022",01-PROCEDURA APERTA,2017-09-01+02:00,2022-08-31+02:00,idm2584
92,Z471E2B7D9,01232710374,Comune di Bologna,234.43,234.43,RIPARAZIONE STAMPANTE SEG GEN CONTOLLO ATTI,23-AFFIDAMENTO DIRETTO,2017-04-28+02:00,,idm2616
93,Z561DF5928,01232710374,Comune di Bologna,325.00,325.00,OSPITALITA' ARTISTA PER MOSTRA WAGNER,04-PROCEDURA NEGOZIATA SENZA PREVIA PUBBLICAZIONE,,,idm2632
